hechos,intervencion,resultado,fecha_hechos,fecha_denuncia,provincia,ambito,tipo_desciminacion,reference,link
"Varios periódicos publican una misma noticia, con la información remitida por la agencia de noticias, Europa Press. Los artículos, que recogen el caso de “El Peluso”, donde el Tribunal Supremo exculpa a 18 imputados de narcotráfico fruto de la Operación Plata. La agencia de noticias, explicando las investigaciones policiales, afirma que a una persona se “le había visto contactar en el barrio de Pajarillos con personas de etnia gitana vinculadas al entorno de los ‘Monchines’”. En esta breve frase no solo se hace mención a la etnia de ciertas personas de forma innecesaria, sino que, además, se refieren al barrio de Pajarillos, barrio obrero de Valladolid que mantiene una férrea lucha por limpiar su imagen y desvincular al barrio de esa imagen negativa que tiene debido a la existencia de ciertos vecinos involucrados en actividades ilegales.",,,2010-01-01T00:00:00+01:00,2010-01-01T00:00:00+01:00,Estatal,Medios de comunicación,Sin especificar,,https://informesdiscriminacion.gitanos.org/casos/diciembre-estatal-medios-de-comunicaci%C3%B3n
"Dos publicaciones digitales, El Mundo Today y Voley San Javier, recogen un mismo contenido donde se refuerza la imagen negativa de la comunidad gitana. Con un tono supuestamente humorístico, el titular reza “La NASA entrena a gitanos para que recojan chatarra espacial”, continuando con comentarios como el siguiente: “se está intentando formar a los gitanos para que aprendan a conducir la nave, aunque éstos aseguran que no lo necesitan. “Tampoco tengo carné y conduzco desde los siete años. Lo de los cohetes viene a ser lo mismo”, declara José ‘el moños’ Heredia, uno de los futuros astronautas”. A lo largo de estas publicaciones se discrimina a la comunidad gitana asociándola a la comisión de infracciones, robos y toda clase de hechos delictivos, además de reforzar estereotipos negativos existentes sobre dicha comunidad.",,,2010-01-01T00:00:00+01:00,2010-01-01T00:00:00+01:00,Estatal,Redes sociales,Sin especificar,,https://informesdiscriminacion.gitanos.org/casos/diciembre-estatal-internet-0
"La FSG recibe a la cuenta de correo general, el siguiente email: “Me llamo Roberto busco gitana virgen para mantener relación sexual me encuentro en Madrid ciudad y pago muy bien. No doy mi contacto por seguridad pero cuando hablemos por teléfono ya concreto el dinero que entrego por acto sexual. No me importa edad de gitana si es menor de dieciséis años. Yo pago muy bien, pero imprescindible que ella sea gitana y virgen. Mi nombre de contacto es Roberto y pido mucha discreción para contactar por teléfono, insisto en que pago mucho dinero y que es importante que sea gitana virgen, se que no es fácil esto porque es una raza promiscua pero yo pido seriedad y discreción a cambio de mucho dinero por relación sexual con virgen gitana. Mi número es…”. En este caso observamos desde el Área de Igualdad de Trato cómo nos encontramos ante un caso de discriminación y un posible delito de corrupción de menores, concretamente de mujeres gitanas. Desde la FSG nos ponemos en contacto con la Fiscalía de delitos de odio y discriminación de Barcelona y con la de Madrid e iniciamos la actuación con la denuncia del hecho ante la Brigada de Delitos Informáticos.",,,2010-01-01T00:00:00+01:00,2010-01-01T00:00:00+01:00,Estatal,Redes sociales,Sin especificar,,https://informesdiscriminacion.gitanos.org/casos/diciembre-estatal-internet
"Nuevamente el Diario de Ferrol recoge una noticia relacionada con una condena de siete años y nueves meses de prisión a un acusado de tres robos con violencia. En la noticia se narran los hechos ocurridos además del desarrollo del juicio y la intervención tanto del acusado como de los denunciantes. En cuanto al acusado de los hechos, aparecen las iniciales y posteriormente que es de “etnia gitana”.",,,2010-01-01T00:00:00+01:00,2010-01-01T00:00:00+01:00,A Coruña,Medios de comunicación,Sin especificar,,https://informesdiscriminacion.gitanos.org/casos/noviembre-galicia-medios-de-comunicaci%C3%B3n-0
"En el periódico local Diario de Ferrol se publica una noticia titulada “Una reyerta entre clanes gitanos concentra a las fuerzas policiales en el cementerio de Catabois”. La misma incluye en detalle, y de forma exagerada, cómo se produjo un enfrentamiento entre varias personas de etnia gitana: “una pelea multitudinaria […] un grupo de mujeres se estaba peleando a muerte, tirándose de los pelos y dándose manotazos. Los hombres comenzaron a sacarse las chaquetas y se metieron en el tumulto, que en un instante llegó a superar el centenar de personas”. Junto a ello, en la misma noticia se hace una referencia a la vivencia por parte de la comunidad gitana del día de los difuntos, bastante inadecuada y muy poco respetuosa con un valor cultural muy importante para esta comunidad: “Como todos los años, y este quizás más, los panteones y nichos de estas familias eran los que reunían los centros y ramos más grandes, vistosos y de fl ores más caras […] Junto a las tumbas se concentraban en grupos grandes […] turnándose para no dejar nunca solo a su difunto. De ahí la presencia de un colectivo tan numeroso en Catabois, puesto que el resto de los visitantes se limitaban a eso, a visitar a sus muertos, sin permanecer allí todo el día”. En el caso de este artículo, además de hacer mención a la etnia y describir los sucesos bajo un enfoque de gran peligrosidad, reforzando la mala imagen de la comunidad gitana, hay que destacar el uso de palabras cargadas de connotaciones negativas, como “reyerta” o “clan”.",,,2010-01-01T00:00:00+01:00,2010-01-01T00:00:00+01:00,A Coruña,Medios de comunicación,Sin especificar,,https://informesdiscriminacion.gitanos.org/casos/noviembre-galicia-medios-de-comunicaci%C3%B3n
"Dentro de una campaña de concienciación contra la pobreza de RTVE, el canal nacional emite un documental sobre el desalojo de un barrio de Barcelona llamado Can Tunís. En el mismo se ofrece una imagen de la comunidad gitana ligada a delincuencia, drogas y marginalidad. El documental se centra, además, en el testimonio de varios niños gitanos, reforzando la imagen de delincuencia y marginalidad de esta comunidad, y provocando sobre la audiencia el efecto contrario al pretendido, es decir, en lugar de generar un acercamiento refl exivo a la realidad de la exclusión social, el documental lo que consigue es ahondar en el rechazo social hacia estas personas.",,,2010-01-01T00:00:00+01:00,2010-01-01T00:00:00+01:00,Alicante,Medios de comunicación,Sin especificar,,https://informesdiscriminacion.gitanos.org/casos/octubre-estatal-medios-de-comunicaci%C3%B3n
"El Centro de documentación de la FSG, recibe el siguiente correo: “Los gitanos sois la mayor basura de la humanidad. Habría que mataros a todos ratas de alcantarilla, parásitos hijos de puta. Un gitano un tiro en la cabeza. No sois mas que unas putas ratas asquerosas que vivís a costa de los demás. A ver cuando os echan ya a todos de Europa, gentuza de mierda, y os meten en vuestra puta cloaca (Rumania) para que allí sigáis criando como ratas y os matéis los unos a los otros. Lo único que sabéis hacer es extorsionar, robar, amenazar y chupar de las subvenciones. Que pena que Hitler no acabó con todos vosotros, gentuza miserable. ¿Aparte de tener 8 hijos cada uno, sabéis hacer otra cosa en la vida que no sea vivir del estado? Que os manden a todos para Rumania, (el basurero de Europa, donde vive toda la mierda) pronto, gentuza de mierda. La solución final contra los gitanos es plenamente legítima y perfectamente válida. Con la gentuza, la basura y la mierda, hay que acabar de raíz”. El correo, con un claro contenido de apología del racismo, además de injuriar claramente a la comunidad gitana y estar lleno de prejuicios, ha sido llevado por la FSG ante la Brigada de Delitos Informáticos y el caso continúa abierto en la actualidad.",,,2010-01-01T00:00:00+01:00,2010-01-01T00:00:00+01:00,Estatal,Redes sociales,Sin especificar,,https://informesdiscriminacion.gitanos.org/casos/octubre-estatal-internet
"La cadena de radio 40 Principales, en su programa “Anda ya”, incluye un espacio de supuesto contenido humorístico llamado “Los chichouss”. El nombre pretende ser una parodia de la serie de animación basada en una familia estadounidense media “Los Simpson”. En este espacio se intenta presentar una familia gitana media, a base de incluir prácticamente todos los estereotipos sobre la comunidad gitana existentes. El propio nombre de la sección “Chichouss” ya supone una asociación entre la comunidad gitana y el grupo de rumbas Los Chichos, famoso por representar muchas de las imágenes estereotipadas de la comunidad gitana en España. El programa continúa en este sentido, parodiando la sintonía de “Los Simpson” pero cantada al estilo rumbero. Asimismo la mención de un personaje como Farruquito, vuelve a asociar a la comunidad gitana con el mundo de la farándula y la comisión de hechos delictivos. Una parte de la parodia se basa simplemente en pronunciar una frase en inglés con el acento de los personajes, empleando el acento que suele utilizarse para imitar a la comunidad gitana. No queda aquí el contenido del programa: hay abundantes referencias a estereotipos fl amencos (“por el amor del Cigala”), a las actividades tradicionales propias (mercadillos), y a refl ejar los estereotipos en curso de reciente cuño (“vamos a tener que volver a dejar el curriculum en Callejeros”). En definitiva, toda una muestra del nulo interés de los medios de comunicación de masas por difundir una imagen real y heterogénea de la comunidad gitana; además, se observa que generalizar negativamente continúan considerándolo divertido.",,,2010-01-01T00:00:00+01:00,2010-01-01T00:00:00+01:00,Estatal,Medios de comunicación,Sin especificar,,https://informesdiscriminacion.gitanos.org/casos/septiembre-estatal-medios-de-comunicaci%C3%B3n
"Otro ejemplo donde se menciona la etnia de los protagonistas la encontramos en el artículo “Persecución de un menor sin carné hasta el polígono de San Cristóbal” del diario regional El Norte de Castilla. Una vez más se menciona el origen étnico, al narrar un suceso delictivo.",,,2010-01-01T00:00:00+01:00,2010-01-01T00:00:00+01:00,Valladolid,Medios de comunicación,Sin especificar,,https://informesdiscriminacion.gitanos.org/casos/agosto-castilla-y-le%C3%B3n-medios-de-comunicaci%C3%B3n
"Libertad Digital publica una noticia bajo el siguiente titular: “Grupo de menores causa el pánico con total impunidad en las piscinas públicas de Madrid”. Una vez más se relaciona explícitamente a la comunidad gitana con conductas delictivas. Como elemento novedoso y positivo, en esta ocasión se comenta además la labor de intermediación que personas de etnia gitana están llevando a cabo para poner fin a estas situaciones.",,,2010-01-01T00:00:00+01:00,2010-01-01T00:00:00+01:00,Estatal,Medios de comunicación,Sin especificar,,https://informesdiscriminacion.gitanos.org/casos/agosto-estatal-medios-de-comunicaci%C3%B3n
"Diario de Valladolid publica dos noticias en el mismo día donde se especifica la etnia de las personas implicadas en los sucesos: “No vendo droga, pero tengo un problema grave de consumo” y “7,5 años de cárcel para dos “Monchines” detenidos con el mayor alijo de hachís”. Como resultado de la interlocución por parte de la FSG con el redactor de las noticias, éste reconoce que se podría poner más atención a este tipo de detalles importantes, aunque el acelerado ritmo de trabajo no permite la redacción cuidada. La cuestión sugiere, por tanto, que los profesionales de los medios de comunicación tienen muy interiorizado la mención al origen étnico, cuando se trata de ciertas comunidades. Sin embargo, ¿En cuántas ocasiones encontramos referencia a, por ejemplo, la raza caucásica? Sería sencillamente cuestión de, como regla general, no mencionar ningún dato sensible de carácter personalísimo, como son la raza o la etnia en ninguna circunstancia.",,,2010-01-01T00:00:00+01:00,2010-01-01T00:00:00+01:00,Valladolid,Medios de comunicación,Sin especificar,,https://informesdiscriminacion.gitanos.org/casos/julio-castilla-y-le%C3%B3n-medios-de-comunicaci%C3%B3n
"La edición digital Última Hora, diario de las Islas Baleares, hace referencia a una pelea entre dos grupos de personas en Son Gotleu, barrio de Palma de Mallorca. El comienzo de la noticia “En Son Gotleu los periodos de paz son efímeros. Y las hostilidades estallan con peligrosa frecuencia”, hace ya una referencia inapropiada a la etnia de las personas implicadas en los sucesos, continuando del mismo modo a lo largo de toda la noticia: “En la tarde-noche del lunes al martes un grupo de unos cincuenta gitanos y negros se enfrentó en la plaza después de que una mujer subsahariana destrozara supuestamente el coche a un hombre de etnia gitana”. Como ya hemos mencionado en otras ocasiones similares, la mención a la etnia no aporta nada a la noticia, generando, al contrario, la idea de que inmigrantes y gitanos son los únicos causantes de la “violencia social” a la que está sometida el barrio y, por tanto, reafirmando la imagen negativa que se tiene hacia estas comunidades.",,,2010-01-01T00:00:00+01:00,2010-01-01T00:00:00+01:00,Estatal,Medios de comunicación,Sin especificar,,https://informesdiscriminacion.gitanos.org/casos/julio-estatal-medios-de-comunicaci%C3%B3n-3
"Otra muestra del tratamiento inadecuado de la información nos llega a través de la publicación digital La verdad de Murcia, con el artículo “Un baño poco tranquilo”, dirigida a mostrar una visión negativa de los usuarios de una piscina en la que supuestamente ocurren hechos delictivos. La noticia da más importancia a la presencia de inmigrantes y personas de etnia gitana que a los hechos en sí, de los que apenas detalla su contenido. La noticia sí se encarga, sin embargo, de relacionar etnias y conductas asociales, como insultos o peleas, con la pertenencia a un grupo étnico determinado. Del mismo modo, la noticia cae en el sensacionalismo, como por ejemplo denominando “bandas” a los grupos de amigos que acuden a la piscina, con la intención de hacer la noticia más llamativa.",,,2010-01-01T00:00:00+01:00,2010-01-01T00:00:00+01:00,Estatal,Medios de comunicación,Sin especificar,,https://informesdiscriminacion.gitanos.org/casos/julio-estatal-medios-de-comunicaci%C3%B3n-2
"La edición impresa del periódico de tirada nacional, Público, se hace eco de la noticia “Tres detenidos por el tiroteo de Asturias”, con el siguiente sumario: “Un padre y dos hijos se entregan tras matar a dos miembros de otro clan gitano”. En el desarrollo del mismo se vuelven a etiquetar como “miembros de un clan gitano” a los detenidos por el terrible hecho documentado. Las víctimas también son denominadas como “integrantes de su clan”. En este caso, la innecesaria mención a la etnia, acompañado de uno de los términos peyorativos más usados y recurrentes por los medios, “clan”, llama nuestra atención. Efectivamente, la palabra “clan”, utilizada para referirse a las familias gitanas en general, crea una evidente distancia entre el lector y los protagonistas de la noticia, representando una barrera más entre esta comunidad y el resto de la sociedad, totalmente innecesaria, que además la propia comunidad gitana está intentando combatir.",,,2010-01-01T00:00:00+01:00,2010-01-01T00:00:00+01:00,Estatal,Medios de comunicación,Sin especificar,,https://informesdiscriminacion.gitanos.org/casos/julio-estatal-medios-de-comunicaci%C3%B3n-1
"En la edición regional del diario ABC, encontramos el artículo “La mujer de aspecto gitano y corazón de oro”. A pesar de la buena intencionalidad de la publicación, resaltar aspectos positivos de una persona que podría ser de etnia gitana, se incluyen abundantes estereotipos que bien pueden contribuir a mantener la persistencia de éstos. Así, se hace referencia a “signos externos a destacar” y atribuye la etnia gitana a una mujer por “sus rasgos, forma de vestir —modesta por otro lado— y de ponerse los complementos”. Un estereotipo clásico, que presume que es posible identificar físicamente a los miembros de la comunidad gitana. Asimismo, se atribuye el adjetivo “agitanada” a la mujer “con signos externos”, nuevamente un término desafortunado, como si fuera posible agitanarse, y dando por supuesto que hay un único modo de ser gitano o de parecerlo. El mensaje que lanza el artículo aparentemente es positivo, pero desafortunadamente contribuye a certificar que la persona de etnia gitana “en los medios de comunicación suele aparecer sólo por sucesos desagradables”.",,,2010-01-01T00:00:00+01:00,2010-01-01T00:00:00+01:00,Estatal,Medios de comunicación,Sin especificar,,https://informesdiscriminacion.gitanos.org/casos/julio-estatal-medios-de-comunicaci%C3%B3n-0
"El grupo Intereconomía Corporación está compuesto por varios canales de televisión, un diario de tirada nacional, emisoras de radio, dos semanarios, una productora de programas y contenidos audiovisuales, una editorial de publicaciones y un portal de Internet, así como otros servicios no relacionados directamente con la comunicación, como una escuela de finanzas. La infl uencia de este grupo es bastante amplia y su tendencia al crecimiento es acelerada. La imagen de la comunidad gitana en las publicaciones consultadas de este grupo suele tener un tratamiento inadecuado, muy asociada a situaciones de delincuencia y marginalidad. Los estereotipos y expresiones injuriosas (con titulares como “Comparar a dios con un gitano” y comentarios del tipo “A los gitanos de casta no les gustan los hijos con buenos principios”) son frecuentes, así como la puesta en duda de las políticas en aras de la igualdad de trato y no discriminación, especialmente las relacionadas con gitanos como beneficiarios. No obstante, lo más grave resulta ser el hecho de que no exista moderación en los comentarios a las noticias que aparecen en las publicaciones digitales, lo que permite que se torne en una tribuna de propaganda racista, xenófoba y discriminatoria, en la que en muchas ocasiones la comunidad gitana es el destinatario principal de los comentarios, promoviéndose incluso la violencia contra la misma en algunas ocasiones. Para pormenorizar los contenidos en cuestión, basta con incluir en el buscador de la propia página de Intereconomía la palabra “gitano” o “gitanos”. La FSG ha remitido en varias ocasiones cartas al responsable del medio, sin obtener respuesta alguna.",,,2010-01-01T00:00:00+01:00,2010-01-01T00:00:00+01:00,Estatal,Medios de comunicación,Sin especificar,,https://informesdiscriminacion.gitanos.org/casos/julio-estatal-medios-de-comunicaci%C3%B3n
"En el diario regional El Ideal Gallego, se publica una noticia titulada “Recibe una brutal paliza el peruano al que la familia de una menor acusa de secuestrarla”. La misma incluye una mención expresa a la etnia de la menor protagonista de la noticia aunque lo más destacable, es la desafortunada columna inmersa en el propio artículo llamada “Una cultura celosa de sus mujeres jóvenes”, en la que se atribuye a toda la comunidad gitana similares comportamientos calificados como poco ortodoxos, no ausente de intencionalidad: “El origen gitano de la familia explica el empeño y los medios poco ortodoxos que emplean para conseguir sus objetivos”.",,,2010-01-01T00:00:00+01:00,2010-01-01T00:00:00+01:00,A Coruña,Medios de comunicación,Sin especificar,,https://informesdiscriminacion.gitanos.org/casos/julio-galicia-medios-de-comunicaci%C3%B3n
"En el medio regional digital Hoy, del grupo de comunicación Vocento, encontramos una noticia de Cáceres: “En lo que va de año he sufrido 10 robos en la tienda”. El artículo recoge varias declaraciones de comerciantes afectados por estos hechos, que relacionan directamente a gitanos y rumanos con la comisión de los hechos delictivos, reconociendo solamente uno de los empresarios que no se trata solo de estos ciudadanos. A pesar de que la referencia a la etnia o nacionalidad es un dato irrelevante, puesto que no aporta información básica para la comprensión de la noticia, éste suele aparecer constantemente en los medios. Sin embargo, la relación implícita entre la etnia y determinadas conductas contrarias a la ley debe ser evitada, puesto que contribuye a reforzar los prejuicios existentes hacia la comunidad gitana y su rechazo social. La FSG considera, además, que la difusión de una idea estigmatizada de dicha comunidad, vulnera el derecho al honor y a la propia imagen de las personas de etnia gitana.",,,2010-01-01T00:00:00+01:00,2010-01-01T00:00:00+01:00,Cáceres,Medios de comunicación,Sin especificar,,https://informesdiscriminacion.gitanos.org/casos/julio-extremadura-medios-de-comunicaci%C3%B3n
"El periódico La Voz de Asturias recoge la noticia, “No dejes los libros, primo”, sobre una campaña de fomento de la educación de la FSG. El artículo comienza con unas desafortunadas afirmaciones que incluyen motivos genéticos para justificar el abandono escolar entre los jóvenes de etnia gitana: “Los gitanos llevan el nomadismo en los genes. Se les hace difícil asentarse, persistir en un lugar o un hábito. Los estudios no son ajenos a esta fenomenología histórica”. Los medios de comunicación tienen un papel clave en la lucha contra los prejuicios y los estereotipos, pudiendo contribuir enormemente a mejorar la igualdad de trato y no discriminación de aquellos colectivos más vulnerables. Sin embargo, este tipo de comentarios recogidos en la prensa nos lleva a considerar a los medios de comunicación como agentes discriminadores más activos, vulnerando la imagen de estas comunidades y dañando gravemente su dignidad.",,,2010-01-01T00:00:00+01:00,2010-01-01T00:00:00+01:00,Asturias,Medios de comunicación,Sin especificar,,https://informesdiscriminacion.gitanos.org/casos/junio-asturias-medios-de-comunicaci%C3%B3n
"En el diario La Gaceta de Salamanca, aparece la noticia de un suceso bajo el titular “Reyerta con cuchillo a las puertas de un instituto en San José. El origen, una discusión entre dos familias gitanas cuyos hijos, alumnos del centro, tenían problemas entre ellos”. Dado que la FSG colabora con ese centro educativo, se pudieron investigar de primera mano los hechos recogidos en la noticia. Los protagonistas del incidente resultan no ser de etnia gitana y la propia Jefa de Estudios del centro lo confirma. El error se debe a la falta de rigor periodístico y, ante esta, a la tendencia de conectar automáticamente ciertos hechos delictivos y conductas incívicas con la pertenencia a una determinada etnia lo que provoca, como en este caso, discriminaciones por error o asociación.",,,2010-01-01T00:00:00+01:00,2010-01-01T00:00:00+01:00,Salamanca,Medios de comunicación,Sin especificar,,https://informesdiscriminacion.gitanos.org/casos/junio-castilla-y-le%C3%B3n-medios-de-comunicaci%C3%B3n
"El Norte de Castilla, diario regional, publica el artículo “Absueltos seis vendedores ambulantes que llevaban relojes falsos de marca”. Una vez más nos encontramos con la mención a la etnia de los protagonistas de la noticia. A pesar de ser este dato personal considerado como de gran sensibilidad y, por tanto, necesitado de especial protección, el origen étnico continúa siendo una de las informaciones más divulgadas por los medios de comunicación en sus publicaciones. Debemos, por otra parte, recordar que esta mención es totalmente innecesaria puesto que, en la mayoría de los casos, como el presente, dicha información personal no aporta nada para la comprensión de las noticias.",,,2010-01-01T00:00:00+01:00,2010-01-01T00:00:00+01:00,León,Medios de comunicación,Sin especificar,,https://informesdiscriminacion.gitanos.org/casos/mayo-castilla-y-le%C3%B3n-medios-de-comunicaci%C3%B3n
