hechos,intervencion,resultado,fecha_hechos,fecha_denuncia,provincia,ambito,tipo_desciminacion,reference
"El orientador laboral de la FSG Almería se acercó a tirar la basura a un contenedor situado enfrente de la oficina, cuando un hombre de aproximadamente unos 75 años se le acercó y le dijo: “Muy bien por tirar la basura al contenedor, no como esos gitanos que no tienen educación”. También le contó que hace unas semanas vio a una familia gitana tirar la basura fuera del contenedor, y que él se lo recriminó y que la madre de familia le contestó en tonto grosero. El técnico le respondió: “Yo soy de etnia gitana. Los valores y principios dependen de cada persona y no de un colectivo o comunidad”. Después de identificarse como gitano, el hombre se marchó sin antes decirle “Si sé que eres gitano, no me paro contigo”.","Se hizo una entrevista en profundidad con la víctima, en este caso, el técnico de la FSG, y se le informó y asesoró sobre cómo actuar ante un caso de discriminación.",El orientador valoró positivamente la información recibida.,2018-01-01T00:00:00+01:00,2018-01-01T00:00:00+01:00,Almería,Otros,Discriminación directa,
"Una mujer, participante del Programa de empleo Acceder en un pueblo en Asturias, les relató a sus compañeras de curso que un perro mordió a un niño gitano y que la dueña del perro comentó: “no pasa nada, un gitano menos”. La familia del niño fue al hospital y denunció el caso. Además la familia del niño fue a la casa de la dueña del perro y solicitaron los papeles del perro; la mujer salió con un cuchillo y les amenazó, por lo que la familia interpuso una denuncia. El caso fue archivado: “al no resultar debidamente justificada la perpetración del delito”.",Desde la FSG se comprobó el Auto del Juzgado y se intentó en varias ocasiones contactar con la familia del niño para asesorarles y ofrecerles apoyo.,Fue imposible contactar con la familia. Tenemos constancia que la familia se trasladó de lugar de residencia.,2018-01-01T00:00:00+01:00,2018-01-01T00:00:00+01:00,Asturias,Otros,Discriminación directa,
"Un hombre de Guadalajara, que se dedicaba al servicio de limpieza, envió un mensaje a la FSG para solicitar asesoramiento sobre una carta que quiere enviar al Ayuntamiento de un pueblo de Guadalajara porque en la planificación de la limpieza asignada a los operarios, por escrito ponía: BARRIO GITANOS. Este no es el nombre oficial del barrio ni de la calle, sino que es un barrio donde viven bastantes personas de etnia gitana.","Se revisó la carta que el operario quería enviar al Ayuntamiento, se le asesoró y se le enviaron algunos comentarios a la carta.","Positivo. Hubo una respuesta inmediata por parte del Ayuntamiento, que remitió respuesta al operario y subsanó el nombre del barrio, poniendo el nombre oficial y eliminando la mención anterior. Igualmente, desde el Departamento de Servicios Sociales respondieron que trabajan por la no discriminación y por la inclusión de todas las personas, que estaban de acuerdo con la valoración de la FSG y que a las personas de etnia gitana consultadas esta denominación les pareció: “Despectiva, marginal e incluso lo ven como racista” y que las calles se deberían de nombrar por sus nombres oficiales.",2018-01-01T00:00:00+01:00,2018-01-01T00:00:00+01:00,Guadalajara,Otros,Discriminación directa,
"Un joven participante del Programa de empleo Acceder de la FSG, en el transcurso de una entrevista para un curso en la FSG empezó a realizar una serie de comentarios estereotipados sobre los gitanos, como por ejemplo que: “todas las ayudas son para los gitanos” “todos los empleos y subvenciones las obtienen los gitanos” o bien “los gitanos no necesitan esas ayudas porque tienen más ingresos que los payos”.","La técnica de igualdad y el tutor de empleo, al escuchar estos comentarios, se dirigieron al joven, contestando a sus comentarios, trataron de sensibilizarle y decidieron no facilitar la entrada del joven en el curso, porque podían crearse situaciones problemáticas.","Positivo. No se permitió el acceso al curso al chico, lo cual fue ejemplarizante para el resto de participantes. Además se valoró la necesidad de establecer algún tipo de filtro o medida para trabajar en la prevención de estas situaciones.",2018-01-01T00:00:00+01:00,2018-01-01T00:00:00+01:00,Jaén,Otros,Discriminación directa,
"Un vecino de un pueblo de Asturias grabó con la cámara del teléfono a un menor de edad, de etnia gitana, mofándose de él y haciendo alusiones a “los gitanos” y subió la grabación a redes sociales. La familia no se enteró hasta que, un año después, otro vecino se lo enseñó. La madre del menor se disgustó y le pidió explicaciones al vecino que había grabado a su hijo y éste afirmó que sí había subido el vídeo a redes sociales. El menor estuvo muy afectado por la grabación, e incluso tuvo que recibir tratamiento por depresión. La familia interpuso una denuncia a la Guardia civil, que aconsejó a la familia que contasen el caso a la FSG, porque los hechos les parecieron racistas. La familia solicitó un abogado de oficio.","La técnica de igualdad se entrevistó con la madre, que le relató los hechos en profundidad y aportó las pruebas documentales. Comprobó los vídeos, informes médicos y analizó la denuncia que interpuso la familia y comprobó que no estaba mencionado el móvil antigitano del vídeo. Contactó con el abogado. Desde la FSG se envió escrito a la Fiscalía de Oviedo para que conociera los hechos y se hizo seguimiento del procedimiento y del recurso interpuesto por el abogado ante el sobreseimiento del caso.","Negativo. El caso se archivó por el Juzgado de Instrucción, argumentando que: “Ni el contenido más o menos chusco de los comentarios que acompañan a la imagen, tienen entidad para entrañar menos crédito de grupo alguno en forma idónea, ni consta que se hayan producido materiales o soportes con la finalidad de denigrar o humillar a grupos. Menos aún el enaltecimiento o justificación de la comisión de delitos. De lo contrario, se estaría dando pie a una aplicación extensiva del Derecho Penal obviando principios como el de lesividad y el de intervención mínima”. El caso fue archivado definitivamente por la Audiencia Provincial de Asturias.",2018-01-01T00:00:00+01:00,2018-01-01T00:00:00+01:00,Asturias,Otros,Acoso discriminatorio,
"Tres jóvenes de etnia gitana fueron a actuar, como en otras ocasiones, a un restaurante. Al finalizar la actuación, uno de los trabajadores del restaurante comenzó a increparles con comentarios como “los gitanos sois pobres, nunca tenéis dinero, si tenéis algo que llevaros a la boca es por nosotros”, añadiendo “los gitanos sólo valen para robar y cantar”. Uno de los jóvenes le dijo que ellos estaban allí trabajando para ganarse su dinero y pidió respeto. Sin embargo, la otra persona continuó insultándoles.","En esos momentos se encontraba en el restaurante cenando una trabajadora de la FSG, conocida por los jóvenes, que presenció lo que estaba ocurriendo. La técnica se acercó, le confirmaron lo que estaba sucediendo y medió entre las partes.","Positivo. El trabajador del restaurante pidió disculpas a los jóvenes por lo que había dicho, les aseguró que no era su intención insultar ni generalizar.",2018-01-01T00:00:00+01:00,2018-01-01T00:00:00+01:00,Cuenca,Otros,Discriminación directa,
"Una joven de etnia gitana le comentó a la técnica de igualdad de la FSG que durante una cita con una funcionaria de la administración local, ésta le hizo comentarios como “tú siendo gitana es muy difícil que vayas a trabajar” o bien: “yo no soy racista, pero nadie te va a contratar” y añadió “los cursos que haces no te van a valer para nada”.","La técnica de igualdad entrevistó en profundidad a la joven, que sintió que la funcionaria había tenido un trato incorrecto con ella; sin embargo, nos dijo que era un trato que tenía con muchas personas de la zona, que se encuentran en situación de exclusión social. Se planteó hacer seguimiento del recurso a través de reuniones periódicas. Se realizó una reunión con la funcionaria, se verificó que existía un trato que no era apropiado y que era generalizado hacía todas las personas que acudían al recurso. Se trató de sensibilizarla mediante contraargumentos.","El trato de la funcionaria mejoró en las formas, pero no puede confirmarse que cambiara su percepción.",2018-01-01T00:00:00+01:00,2018-01-01T00:00:00+01:00,A Coruña,Otros,Discriminación directa,
"Tras un accidente ocurrido en Pedrera en el que se vieron involucrados dos vehículos, un chico de nacionalidad rumana que iba en uno de los vehículos agredió al conductor del otro vehículo. Tras conocerse este hecho en el pueblo de Pedrera se organizó una concentración a la puerta del Ayuntamiento: se convocó a través de las redes sociales y sin autorización alguna se llevó a cabo la concentración de unas 200 personas, aproximadamente. Después de la concentración algunas personas causaron diversos destrozos en tres de los coches de algunas familias rumanas. Estos hechos causaron temor entre la población rumana. El caso lo detectamos desde la Fundación Secretariado Gitano porque salta a los medios de comunicación debido a los graves incidentes ocurridos contra la población rumana de Pedrera.","Desde la FSG se realizaron diversas acciones: • Se realizó un análisis de todas las noticias que salieron en los medios de comunicación, relacionadas con los incidentes. • Se entrevistó a una de las mujeres rumanas víctima de los sucesos y nos confirmó que todas las personas rumanas objetivo de los incidentes xenófobos eran de etnia gitana. • Se contactó con una de las funcionarias del Ayuntamiento para recabar más información y contrastar la información recogida y nos confirmó que eran familias rumanas de etnia gitana. Igualmente corroboró que fue una situación violenta ya que además del destrozo de los vehículos se golpeó con violencia en las puertas de las casas de familias rumanas, causando mucho miedo entre las familias. Asimismo, se confirmó una correcta actuación del Ayuntamiento y de las Fuerzas y Cuerpos de Seguridad del Estado. Desde la FSG nos pusimos a su disposición para cualquier situación que pudiera surgir o para atender a las víctimas de los incidentes. • Se elaboró y difundió un Comunicado por varias de entidades mostrando preocupación por los actos violentos por algunas personas residentes en Pedrera contra las familias rumanas, que podrían constituir un delito de odio hacía las mismas.","Finalmente, alguna de las familias gitanas rumanas se marcharon del pueblo, pero la mayoría continúan en el pueblo sin problema. Ya no se sucedieron más concentraciones ni agresiones vecinales hacia las familias que permanecían en el pueblo.",2018-01-01T00:00:00+01:00,2018-01-01T00:00:00+01:00,Sevilla,Otros,Discriminación directa,['https://www.gitanos.org/actualidad/archivo/122944.html']
"Una familia gitana que vivía en una comunidad en la que eran las únicas personas gitanas, tenía algunos impedimentos que no tenía el resto del vecindario, a la hora de poner una antena en la fachada o colocar una lámpara en su balcón, como otros vecinos y vecinas habían hecho. La hija, que tiene una discapacidad de 65%, era alérgica a la lejía que utilizaban para limpiar el portal y solicitaron que se cambiara, aportando informe médico; sin embargo no se atendió a su petición y siguieron utilizando la misma lejía. El padre un día decidió cambiar la lejía por otra que no le provocaba alergia a su hija y una de las vecinas le acusó de haber robado la lejía. En una reunión de la Comunidad vecinal, donde se iban a tratar estos temas, uno de los vecinos le dijo a la familia, con tono despectivo, según nos comentó el padre “para las personas como ustedes, hay unos pisos preciosos en el Everest y mira dónde han venido a comprarlo…”. La familia está convencida de que se trataba de un caso de discriminación.","La técnica de igualdad entrevistó a la familia y les propuso actuar como mediadora en el conflicto vecinal y enviar una carta a la Comunidad vecinal. La familia, que quería llevar a cabo una actuación en vía judicial, decidió interponer una denuncia por discriminación hacía la persona discapacitada. Desde la FSG se realizó seguimiento a la familia.",Se archivó la denuncia en la vía penal.,2018-01-01T00:00:00+01:00,2018-01-01T00:00:00+01:00,Huelva,Vivienda,Discriminación directa,
"Una mujer de etnia gitana que vive con sus hijas se sentía acosada por un vecino desde que llegó a su vivienda por un vecino y estaba convencida de que esto era consecuencia de un prejuicio antigitano y de género. Este vecino subía a golpear la puerta frecuentemente para decirle que sus hijas metían ruido. Muchas veces las niñas no estaban en casa. En alguna ocasión incluso llegó a amenazarla, diciéndole: “como no me hagas caso, prepárate” y las insultaba, diciendo cosas como “gitanas de mierda” o “hijas de puta”. Siempre lo hacía cuando no hay gente delante.","Ante esta situación, desde la FSG y Servicios sociales se medió con el hombre y se le exigió que dejase de molestar a la mujer y a sus hijas. Se asesoró a la mujer sobre cómo actuar. Además, se entrevistó a algunos vecinos, que confirman que la mujer es una buena vecina y que este señor “se la ha tomado con ella”.",Positivo. Meses después contactamos con la mujer que afirma que ha cesado el acoso desde que se realizó la mediación.,2018-01-01T00:00:00+01:00,2018-01-01T00:00:00+01:00,Asturias,Vivienda,Acoso discriminatorio,
"Una mujer de etnia gitana y su novio de origen marroquí alquilaron una habitación en una vivienda compartida con el propio arrendador. Un día, la joven mantuvo una conversación con el arrendador sobre el censo que iba a crear Salvini y ella le dijo que a ella como gitana le afectaba mucho. El arrendador le dijo que le había engañado por no decirle cuando alquilo la habitación que era gitana. A partir de aquí cambió la actitud, comenzó a esconder utensilios de cocina, un día le explicitó: “como tú eres gitana y tu novio marroquí podéis robarme, la gente como vosotros no es de fiar”. La situación se agravó y un día les dijo que se tenían que marchar, ellos protestaron y el arrendador comenzó a amenazarles blandiendo una navaja, con la que hirió a la joven. Finalmente, pudieron escapar de la casa, solicitando ayuda al vecindario. Una de las vecinas llamó a la policía. La joven interpuso denuncia en Comisaría.",Se comprobó la documentación y se asesoró a la joven. Se presentó escrito de denuncia a la Fiscalía Provincial de delitos de odio. Se acompañó a la joven a declarar en los Juzgados.,A fecha de hoy no hay todavía resolución judicial.,2018-01-01T00:00:00+01:00,2018-01-01T00:00:00+01:00,Granada,Vivienda,Discriminación directa,
"Una joven que buscaba vivienda para alquilar, acudió a una inmobiliaria y la gestora le enseñó algunos pisos disponibles. Cuando la joven se decidió por un piso, comenzaron los trámites de la documentación y la gestora le solicitó las nóminas y DNI. Cuando ya tenían todo confirmado y la joven acudió, junto con su tía, para firmar el contrato, la gestora al verlas, le dijo a la joven que tenía que conocerlas el jefe antes del contrato de alquiler. Después de encontrarse con el jefe, la gestora le dijo a la joven: “lo siento el jefe no alquila pisos a gente como vosotras” La joven está convencida de que no les alquilaron la vivienda por identificarlas por su etnia gitana.","Estos hechos fueron corroborados por dos mujeres de etnia gitana, una de ellas trabajadora de la FSG, que fueron a la inmobiliaria y las atendió la misma gestora, que al verlas les preguntó: ¿Qué aval bancario tenéis? ¿De dónde venís? ¿Cuánto tiempo os vais a quedar? ¿Por qué queréis vivir aquí? ¿De qué trabajáis? O ¿dónde tenéis pensado trabajar? ¿Cuantos de tu familia trabajan? Y finalmente ¿qué podéis aportar para alquilar la vivienda? A pesar de que las mujeres cumplían con todos los requisitos, la agente no respondió y dijo que lo tenía que comentar con su jefe, que las llamaría para una entrevista. La gestora no contactó con ellas. Desde la FSG se envió una carta de queja a la inmobiliaria dónde se solicitó que se reconocieran los hechos y se tomaran las medidas oportunas.",El responsable de la inmobiliaria respondió a la carta sin reconocer que se había producido un acto discriminatorio y al mismo tiempo pedía disculpas si hubieran podido causar algún daño a las personas que buscaban vivienda. La joven se sintió satisfecha con las actuaciones llevadas a cabo y con la respuesta y no quiso llevar a cabo otra actuación.,2018-01-01T00:00:00+01:00,2018-01-01T00:00:00+01:00,Murcia,Vivienda,Orden de discriminar,
"El equipo de Cañada Real Galeana de la FSG empezó a recibir llamadas urgentes de familias de etnia gitana que vivían en Cañada, explicando alarmadas que había un despliegue policial y acudían con excavadoras con la intención de derribar algunas viviendas. Las familias tenían miedo porque no era la primera vez que sucedía que en el marco de un operativo policial, aprovechaban la ocasión para derribar algunas viviendas. Ver información ampliada en el capítulo sobre Litigio y capítulo A Fondo (Rafael Cid), en este mismo Informe.","Parte del equipo de la FSG se desplazó al lugar de los hechos y allí comprobaron in situ cómo la policía entraba en las viviendas, desalojaba a las familias y posteriormente, derribaban la vivienda ante las súplicas de las familias de detener los derribos. Una de las mujeres fue desalojada con su bebé de un año en brazos, para posteriormente derribar su vivienda en presencia de las trabajadoras de la FSG. La mujer, su marido y sus tres hijos menores de 6, 4 y 1 año se quedaron sin vivienda y solicitaron apoyo de la FSG. Desde la FSG se acompañó, se asesoró y se representó judicialmente a la familia. Se presentó una Demanda ante el Juzgado Contencioso Administrativo de Madrid por vulneración de derechos fundamentales por parte de la administración y por incumplir el procedimiento legal establecido.","Positivo. A pesar de que el Juzgado en 1ª Instancia desestimó la Demanda, el Tribunal Superior de Justicia estimó parcialmente nuestro Recurso y reconoció la vulneración del derecho a la inviolabilidad del domicilio, así como a su honor e intimidad personal y familiar, recogido en el artículo 18.1 de la Constitución española y estableció a su favor una indemnización de un total de 13.000 euros (2.000 euros por adulto y 3.000 euros por cada menor de edad).",2018-01-01T00:00:00+01:00,2018-01-01T00:00:00+01:00,Madrid,Vivienda,Discriminación directa,['https://www.gitanos.org/actualidad/archivo/127993.html']
"Una trabajadora social contactó con la FSG para explicar la dificultad de una familia de acceder a una vivienda, por su pertenencia a la etnia gitana. Según la trabajadora social les ponían todo tipo de trabas cuando les reconocían como una familia gitana y en alguna inmobiliaria les dijo: “los dueños no quieren alquilar a personas gitanas”. En una ocasión, la persona de la inmobiliaria, cuando vio a la familia, dijo que no encontraba las llaves y que no podía enseñarles el piso. En otra ocasión les dijeron “gitanos aquí, no” y en otra le dijeron a la trabajadora social: “meterlos en vuestra casa”. La trabajadora solicitó información a la FSG sobre qué podían hacer.","Se asesoró a esta persona y a la familia sobre cuáles eran sus derechos en el acceso a la vivienda y cómo recoger alguna prueba de denegación en el acceso a vivienda por motivos antigitanos. Le propusimos acompañamiento para las familias. La trabajadora social nos informó que enviaría un informe al Ayuntamiento alertando de la situación de dificultad a la que se enfrentan las personas con pocos ingresos para alquilar viviendas. Asimismo, desde la FSG se realizó un testing por teléfono y se comprobó que existían barreras en el acceso a vivienda por cuestiones de recursos económicos, que podían verse reforzadas por motivos étnicos.",La trabajadora social nos informó que enviaría un informe al Ayuntamiento alertando de la situación de dificultad a la que se enfrentan las personas con pocos ingresos para alquilar viviendas.,2018-01-01T00:00:00+01:00,2018-01-01T00:00:00+01:00,A Coruña,Vivienda,Discriminación directa,
"Una mujer acudió a la delegación provincial solicitando una vivienda, con la documentación requerida. El funcionario encargado de la demanda la recibió con malas formas, y comentarios prejuiciosos contra los gitanos, como: “siempre estáis igual los gitanos, pidiendo ayudas”.",Se acompañó a la mujer a una reunión y mostramos nuestra preocupación por el trato que recibió. Al comentarle los hechos que ocurrieron y en conclusión de toda la conversación el técnico no quiso hablar de ese tema. Dijo que iba a revisar la documentación y que en tres semanas le daba una respuesta.,"Se le informó de que no cumplía los requisitos y, aunque la víctima insiste que es por discriminación, decidió no continuar con la queja.",2018-01-01T00:00:00+01:00,2018-01-01T00:00:00+01:00,Cuenca,Vivienda,Discriminación directa,
"La propietaria de una vivienda alquiló ésta a una pareja. Les dio las llaves para entrar a vivir en ella. Los arrendatarios habían pagado la fianza acordada. Pasados unos días, la propietaria llamó a la pareja y les devolvió la fianza, les reclamó las llaves de la vivienda, expresando que se tenían que ir de su propiedad ya que no quería alojar a personas gitanas.","La pareja se entrevistó con la técnica de igualdad. Tras informales de sus derechos, las víctimas no quisieron continuar debido a la falta de pruebas para poder defenderse. La fianza fue entregada en metálico y no existe prueba documental de ello, tampoco había contrato de arrendamiento, ya que según el agente discriminador les había negado el acceso a la vivienda antes de realizar el contrato.","Negativo. Debido a la falta de información sobre cómo actuar ante un incidente discriminatorio, las víctimas no sabían cómo proceder en el momento del incidente, lo que ha dificultado la actuación del caso y la recopilación de pruebas.",2018-01-01T00:00:00+01:00,2018-01-01T00:00:00+01:00,Valladolid,Vivienda,Discriminación directa,
"Una familia gitana de Zamora fue a una inmobiliaria porque estaban buscando una vivienda en alquiler. Una vez allí, sintieron que les trataban de una manera inadecuada: les hicieron esperar más de una hora y les dijeron que no sabían si el piso en el que estaban interesados estaba o no disponible. Estaban convencidos de que este trato se debía al hecho de que eran gitanos.","Desde la FSG en Zamora, con el consentimiento de la familia, se desarrolló una interlocución con la inmobiliaria, quién no reconoció los hechos ni la falta de atención a la familia gitana que estaba interesada en la vivienda. Se les trasladó que aquel tratamiento dado podía ser discriminatorio y denunciable. Se incidió en la importancia de no generalizar con las personas gitanas y que la denegación de estos servicios podían constituir una ilícito penal. Finalmente, la inmobiliaria confesó que tenía órdenes de los propietarios de no alquilar sus viviendas a familias gitanas y que lamentaban lo sucedido pero que ellos no eran responsables.",La familia no quiso interponer denuncia contra la inmobiliaria.,2018-01-01T00:00:00+01:00,2018-01-01T00:00:00+01:00,Zamora,Vivienda,Discriminación directa,
"Una familia gitana sufre un trato discriminatorio por parte de los vecinos de una urbanización a la que acaban de mudarse. El problema, inicialmente vecinal, se traslada al ámbito educativo, ya que tanto los padres -algunos de ellos profesores- como los hijos, transmiten en el colegio del barrio el mensaje de que “son gitanos, no jugar con ellos”. La FSG realiza un informe sobre los hechos, tras las infructuosas reuniones mantenidas, tanto con los vecinos como con la dirección del centro escolar, para solucionar la cuestión, logrando que las relaciones vecinales y escolares sean tolerantes, aunque la familia sigue sin sentirse acogida por los vecinos a los que acusa de seguir manteniendo alguna actitud discriminatoria.",,,2006-01-01T00:00:00+01:00,2006-01-01T00:00:00+01:00,Zaragoza,Vivienda,Sin especificar,
"En la sección local de un periódico aparece publicada una noticia en la que se describe la pelea que se originó en un poblado chabolista cuando la guardia civil entró a buscar a una chica menor de edad que estaba enganchada a la heroína. El tratamiento de la noticia es claramente discriminatorio, ya que además de utilizar términos cargados de prejuicios y estereotipos, se asocia a toda la comunidad gitana con la delincuencia las drogas o la violencia.",,,2006-01-01T00:00:00+01:00,2006-01-01T00:00:00+01:00,A Coruña,Medios de comunicación,Sin especificar,
"Un periódico local publica varias noticias en las que personas de la comunidad gitana son protagonistas de actuaciones delictivas vinculadas al tráfico de drogas. En la descripción de los hechos se hace, en repetidas ocasiones, mención expresa del origen étnico de los presuntos delincuentes, por lo que la FSG escribe una carta al director de este periódico exigiéndole un tratamiento correcto y no discriminatorio en las noticias. El director pide disculpas por estos hechos.",,,2006-01-01T00:00:00+01:00,2006-01-01T00:00:00+01:00,A Coruña,Medios de comunicación,Sin especificar,
