hechos,intervencion,resultado,fecha_hechos,fecha_denuncia,provincia,ambito,tipo_desciminacion,reference
"La madrugada del 1 de marzo, alrededor de la 1 hs de la mañana, un grupo de amigos con edades entre los 18 y los 24 años de edad, todos ellos de etnia gitana, decidieron tomar unas copas en diferentes bares de la ciudad de Albacete. Intentaron entrar en algunos bares de la ciudad pero se les negó el acceso. En algún establecimiento se les exigió pagar una entrada de 10 euros a cada uno, pero a nadie más se lo pidieron, sólo a ellos por ser gitanos. En otro pub los porteros les negaron la entrada y tras mucho insistir en conocer las razones les dijeron que era por llevar zapatillas de deporte, sin embargo un grupo de personas no gitanas accedieron al local y contaron al menos cinco personas con zapatillas de deporte, comunicándoselo al portero, si bien éste no hizo nada al respecto. Llegados a ese punto se llamó a la policía local para que se personase en el lugar pero la contestación que se obtuvo fue que eso no era de su competencia.",,,2009-01-01T00:00:00+01:00,2009-01-01T00:00:00+01:00,Albacete,Acceso a bienes y servicios,Sin especificar,
"En Linares, una localidad de Jaén, cuatro jóvenes de etnia gitana se dirigen a un gimnasio para inscribirse, pero al ir a hacerlo les informan de que no disponen de plazas. A través de una persona que está inscrita descubren que sí disponen de plazas, pero que el problema es que un hermano del gerente tuvo un enfrentamiento con una persona de etnia gitana y ha dado la orden de no inscribir a gitanos. Ante la negativa, se realiza una actuación por parte de una trabajadora de la FSG, quien ella misma solicita la inscripción de un supuesto grupo de amigos. Cuando ésta intenta inscribirse en ningún caso le expresan que no haya plazas disponibles, e incluso le hablan de un posible descuento, invitándola a que acuda por la tarde a realizar la inscripción. Esa misma tarde acude la trabajadora con los cuatro chicos que solicitaron la inscripción y, a pesar de que en ese mismo momento están siendo inscritos tres personas, vuelven a decir que no tienen plazas, que ha habido un malentendido y se excusan como pueden para justifi car la no inscripción. No obstante, en dos ocasiones más se vuelve a realizar la comprobación de que sí tienen plazas, a través de otros trabajadores de la FSG, y fi nalmente se procede a presentar una queja ante la ofi cina de consumo. Los chicos consiguieron inscribirse en otro gimnasio, pero encontraron serias difi cultades en que les aceptaran en alguno, pues otros también alegaron que no tenían plazas. Tampoco se tuvo conocimiento de actuaciones de la administración contra el gimnasio discriminador a pesar de encontrarnos ante un caso de discriminación directa en el acceso a bienes y servicios prohibido por la Directiva 2000/43/CE y su ley de transposición.",,,2009-01-01T00:00:00+01:00,2009-01-01T00:00:00+01:00,Jaén,Acceso a bienes y servicios,Sin especificar,
"Una usuaria del programa de empleo Acceder venía de llevar a su hijo al médico y cogió un taxi. Cuando el taxista la vio (iba vestida con un chándal, pelo recogido alto y pendientes grandes) le preguntó inmediatamente que dónde tendría que llevarla y ella le contestó que su destino era Pinos Puente2. La respuesta del taxista fue que no podía llevarla porque entonces corría el riesgo de volver a Granada sin ruedas. Como hemos señalado en otro caso anterior, esto es el resultado de achacar sistemáticamente la responsabilidad de todos los sucesos negativos a la población gitana de esta zona. Se trataría de un caso de discriminación directa en el acceso a bienes y servicios donde, nuevamente, los prejuicios y estereotipos hacia toda la comunidad gitana han sido el detonante de esta actitud discriminatoria de denegar el derecho a un servicio a una persona.",,,2009-01-01T00:00:00+01:00,2009-01-01T00:00:00+01:00,Granada,Acceso a bienes y servicios,Sin especificar,
"Una mujer gitana acude a una empresa de reformas para contratar la rehabilitación de su vivienda con dinero sufi ciente como para pagar por adelantado. A pesar de la situación de crisis generalizada y de la delicada situación del empresario al que acude en particular, éste decide no aceptar la obra de reforma porque “no da abasto a la demanda y sus trabajadores no tienen tiempo para realizar la reforma”. Días después una vecina amiga de la mujer escuchó por casualidad en otro comercio cómo el empresario le comentaba a su mujer: “me da pena esta señora pero es que yo, por norma, no trabajo para gitanos”.",,,2009-01-01T00:00:00+01:00,2009-01-01T00:00:00+01:00,Córdoba,Acceso a bienes y servicios,Sin especificar,
"Uno de los prospectores de la FSG tiene conocimiento de que una empresa encargada de selección de personal no es partidaria de entrevistar a personas gitanas. Se decide tener una conversación con la persona de referencia de esa empresa y sensibilizarla, y en el transcurso de ésta, responde que el problema lo tienen las empresas que contratan sus servicios de selección de personal, pues éstas no quieren contratar a personas de etnia gitana. Sin embargo, precisamente una de estas empresas a las que él hace referencia es la quien ha informado a la 1FSG que el problema reside en la empresa de selección y con la que se ha promovido la contratación de personas gitanas. En este caso la empresa que realiza la selección tiene una aptitud discriminatoria que impide el acceso al empleo a las personas gitanas que puedan cumplir el perfi l para ese puesto de trabajo, e intenta justifi carse diciendo que actúa según las ordenes de otras empresas que contratan su servicio siendo incierto, nos encontramos ante un caso de discriminación directa encubierta.",,,2009-01-01T00:00:00+01:00,2009-01-01T00:00:00+01:00,Málaga,Empleo,Sin especificar,
"Una joven de etnia gitana consigue empleo en un hotel de la localidad como camarera de piso a través de la empresa en la que se encontraba trabajando su madre. Desde que inicia su actividad laboral es objeto de un continuo trato discriminatorio por parte de la gobernanta de dicho establecimiento hotelero. Así, la agente discriminadora nunca llamó a la víctima por su nombre, utilizando la expresión “gitana” para dirigirse a ella, y la sometía a continua presión laboral en lo que resultaba un auténtico caso de acoso laboral prohibido por la Directiva 2000/43/CE. Como consecuencia de todo esto, la joven llegó incluso a requerir incluso asistencia psicológica.",,,2009-01-01T00:00:00+01:00,2009-01-01T00:00:00+01:00,Málaga,Empleo,Sin especificar,
"Dos hombres de etnia gitana acuden a una empresa para buscar trabajo como vigilante de seguridad. El primero de ellos, que no cumplía con el perfi l físico habitualmente atribuido a la comunidad gitana, preguntó al encargado de la empresa sobre la posibilidad de conseguir un puesto, quien respondió que a pesar de que era difícil, alguna posibilidad habría. Cuando llegó el turno al segundo, con formación específi ca en esta ocupación y que sí respondía al estereotipo físico atribuido a la comunidad gitana, hizo la misma pregunta, pero obtuvo como respuesta que no había ninguna posibilidad, alegando que “la cosa está muy mala”. Es un claro ejemplo de cómo las personas reciben un trato totalmente diferente basado únicamente en la percepción física ligada a prejuicios y estereotipos. Nos encontramos en ante un caso de discriminación directa en el acceso al empleo prohibido por la Directiva 2000/43/CE.",,,2009-01-01T00:00:00+01:00,2009-01-01T00:00:00+01:00,Granada,Empleo,Sin especificar,
"Hombre joven usuario del programa Acceder, trabaja como instalador de gas. Realizando las tareas de su puesto de trabajo, fue a una casa para prestar el servicio contratado. Llamó varias veces al timbre pero como no le abría nadie llamó a su jefe para explicarle la situación y decirle que se iba al siguiente domicilio. Su jefe le insistió para que volviese a llamar pero tampoco obtuvo respuesta a pesar de intentarlo en repetidas ocasiones. Vuelve a llamar al jefe para decirle que defi nitivamente se va y el jefe le dice: “seguro que estás en el bar, gitano, cómo no va a haber nadie?”, a lo que el usuario le responde que no, y que si quiere venir él a ver si consigue que le abran porque si hay alguien es que no le quieren abrir (refi ere que no es la primera vez que le pasa). Llega el jefe al lugar donde estaba el hombre y llaman, pero se esconde de tal forma que a través de la mirilla sólo viesen al jefe. En ese momento se abre la puerta. La señora se justifi ca con que no había escuchado el timbre en ninguna de las anteriores ocasiones. La discriminación directa en este caso es doble, por un lado el jefe utiliza su pertenencia étnica de forma despectiva para referirse a él y por otro lado la persona que estaba en el piso no le quiso abrir la puerta.",,,2009-01-01T00:00:00+01:00,2009-01-01T00:00:00+01:00,Granada,Empleo,Sin especificar,
"Un joven gitano usuario del programa Acceder entró a trabajar como controlador de seguridad por el contacto de un cuñado no gitano. El empresario se enteró de que era gitano hasta pasado un cierto tiempo, pues él no lo sabía ya que el joven no responde al estereotipo físico asignado a la comunidad gitana, y la persona que le recomendó no era gitana. Al descubrirlo, el empresario le dijo que tenía que habérselo dicho antes y que iba a pedir referencias. Cuando llevaba más de un año trabajando en la empresa, el joven fue despedido alegando que no había superado el periodo de prueba. Con posterioridad, al consultar su vida laboral, se dio cuenta de que el empresario sólo le había dado de alta en la seguridad social los últimos 15 días en vez de todo el año que había estado trabajando realmente. Lamentablemente, la víctima no quiso reclamar por no crear un confl icto, pues entró a trabajar allí recomendado por su cuñado. Nos encontramos ante un caso de discriminación directa prohibido por la Directiva 2000/43/CE.",,,2009-01-01T00:00:00+01:00,2009-01-01T00:00:00+01:00,Granada,Empleo,Sin especificar,
"La FSG se pone en contacto con una empresa que ofrece servicios de limpieza y ayuda a domicilio, para solicitar una propuesta formativa. El contacto lo realiza un prospector laboral con una de las trabajadoras, quien responde favorablemente, concluyendo las conversaciones con una entrevista personal. A la entrevista acudimos el prospector y la coordinadora de la FSG, por su parte, a la empresa la representan la trabajadora con la que se habían realizado las gestiones, el gerente y la formadora. Durante la entrevista se percibió una actitud bastante negativa a colaborar con la FSG por parte del gerente y de la formadora, lo que sorprendió especialmente a la trabajadora, pues éstos habían tenido en todo momento una actitud colaboradora. A medida que avanzaba la entrevista y conocían más a la entidad y con qué personas trabaja la FSG, más crecían las reticencias a colaborar, llegando incluso a decirnos que no veían posible realizar la formación con la FSG. La entrevista fi naliza con su compromiso de que enviarían una propuesta de trabajo de cara al próximo año, que nunca se recibió. Nos encontramos ante un caso de discriminación directa prohibido por la Directiva 2000/43/CE.",,,2009-01-01T00:00:00+01:00,2009-01-01T00:00:00+01:00,Lugo,Empleo,Sin especificar,
"Una usuaria del programa Acceder desarrolla unas prácticas en una cadena de supermercados. La persona que la supervisa directamente cuestiona la precisión de sus habilidades en la caja y la relaciona con la pertenencia a la etnia gitana, en términos como “¿no se te habrán caído 50 euros en el bolsillo?”. La usuaria fi nalmente abandona las prácticas ante la presión que sufre por parte del supervisor. Realizado un contacto con la cadena de supermercados por parte de la FSG, se determinó que se trataba de una actuación individual por parte del jefe de cajas, en absoluto autorizada por la propia empresa, quien lamentó lo ocurrido. Posteriormente se conversó con el citado jefe de caja, quien reconoció la improcedencia de su actuación y pidió que trasladáramos sus disculpas a la usuaria, invitándola a retomar las prácticas, si bien no lo hizo personalmente sino tan sólo cuando la FSG se entrevistó con él. La usuaria no quiso continuar las prácticas, especialmente por la presencia de esta persona, con lo que el perjuicio de la actuación discriminadora se produjo sin que conllevara una reparación a la víctima. Nos encontramos ante un caso de acoso laboral por la condición étnica de la victima, prohibido por la Directiva 2000/43/CE.",,,2009-01-01T00:00:00+01:00,2009-01-01T00:00:00+01:00,Navarra,Empleo,Sin especificar,
"Una mujer joven de etnia gitana usuaria del programa Acceder acude a la entrevista de trabajo concertada en una tienda de ropa situada en un centro comercial de la ciudad. Nada más llegar el entrevistador le dice que su tipo de físico no encaja en la tienda y que la ropa que vestía no le gustaba, en relación a que su apariencia concuerda bastante con el estereotipo atribuido generalmente a los miembros de la comunidad gitana. La víctima le dice que ella estaba dispuesta a ponerse la ropa precisa para trabajar en la tienda pero después de muchas vueltas el entrevistador le termina reconociendo que el jefe no quiere gitanas en su negocio. En este caso, no sólo se trata de un caso de discriminación directa en el acceso al empleo, sino también de orden de discriminar por parte del jefe, ambos supuestos de discriminación están prohibidos por la Directiva 2000/43/CE.",,,2009-01-01T00:00:00+01:00,2009-01-01T00:00:00+01:00,Córdoba,Empleo,Sin especificar,
"Una mujer de etnia gitana y procedente de un barrio de exclusión social fue contratada para cubrir una baja como limpiadora en un hotel de la ciudad. Cumplió perfectamente su trabajo y, de hecho, una vez terminada la baja, fue renovada para cubrir la limpieza de otra sección. La gobernanta de esta sección empezó a someterla a una vigilancia exhaustiva y le exigía más que a las demás. La situación se volvió tan angustiosa e insoportable que la víctima decidió dejar el trabajo. Pasado el tiempo se enteró, por otra compañera, también gitana pero cuyos rasgos físicos no corresponden con el perfi l atribuido comúnmente a los miembros de la comunidad gitana, de que la gobernanta en una reunión del hotel había dicho que no quería gitanas en su equipo, y que la víctima robaba todo lo que pillaba, en especial las toallas del hotel, lo cual no era cierto. En este caso, la discriminación hizo a la jefa exigirle a la víctima más que al resto de trabajadores, nos encontramos ante un claro caso de acoso laboral por la condición étnica, que llevó a la víctima a abandonar su empleo.",,,2009-01-01T00:00:00+01:00,2009-01-01T00:00:00+01:00,Córdoba,Empleo,Sin especificar,
"Una mujer de etnia gitana acude a una entrevista de trabajo para cubrir un puesto de ayudante en un restaurante. En principio, la entrevista fue realizada por el propietario del local. Finalizada la misma, dicho propietario, al que la usuaria conoce de vista al estar el restaurante en el mismo barrio en el que vive, le asegura que el puesto es suyo y que puede empezar, en periodo de prueba, al día siguiente. Por la tarde, la usuaria recibe una llamada del propio encargado en la que se retracta de lo dicho en la entrevista, tratando de justifi car su decisión en el hecho de que pretende cerrar el negocio. A los pocos días la mujer pudo comprobar cómo otra vecina de la localidad había empezado a trabajar en ese puesto. Posteriormente, la usuaria, a través de otros vecinos que conocen a la familia propietaria del local, ha tenido conocimiento que la mujer del propietario tiene una imagen totalmente negativa de la comunidad gitana. A pesar de asesorarla en ese sentido, la usuaria no quiso realizar ningún tipo de acción para denunciar la discriminación en el acceso al empleo. Nos encontramos ante un caso de discriminación directa prohibido por la Directiva 2000/43/CE.",,,2009-01-01T00:00:00+01:00,2009-01-01T00:00:00+01:00,Málaga,Empleo,Sin especificar,
"Joven gitano se presenta a las oposiciones para policía nacional después de un periodo de preparación. Aprueba las pruebas teóricas, las físicas y la evaluación psicopedagógica. En el reconocimiento médico (se había hecho uno unos días antes para asegurarse de que todo estaba correcto) todo iba bien hasta que en un momento dado el médico encargado del reconocimiento hizo referencia a su procedencia dado su color de piel más morena. El joven le dijo que era español. El médico insistió en preguntar si tenía familia en Latinoamérica y el joven le contestó que no, que el tono de piel podía tener relación con que era de etnia gitana. A partir de ahí se transformó por completo el tono de la conversación que se convirtió en distante e incluso empezó a llamarle de usted. Al recibir los resultados de las pruebas se encontró con la califi cación de no apto ya que según el informe médico el joven tenía pies planos (cosa no cierta al comparar con los exámenes que el joven se hizo previamente) y que tenía sobrepeso de 10kg (cosa igualmente incierta y demostrable con el mismo informe). Desde el área de Igualdad de Trato de la FSG se tramitó un recurso administrativo contra esta decisión, y actualmente el caso está en los tribunales. Nos encontramos ante un caso de discriminación directa encubierta en el acceso a un empleo público.",,,2009-01-01T00:00:00+01:00,2009-01-01T00:00:00+01:00,Zaragoza,Servicios policiales,Sin especificar,
"Un hombre de etnia gitana estuvo vinculado a una empresa de cítricos durante un período de 6 meses sin contrato laboral, donde realizaba tareas de almacenamiento. A pesar del compromiso verbal al que había llegado con el responsable de recursos humanos, no llegó nunca a ser contratado, mientras que otros trabajadores que se incorporaron con posterioridad a la víctima sí fueron contratados. Ante el incumplimiento empresarial y a haber recibido comentarios discriminatorios, el trabajador termina abandonando su empleo. El hecho de ser la única persona a la que no se contrata y justamente la única de etnia gitana, añadiendo la existencia de comentarios discriminatorios hace que nos encontremos ante un caso de acoso laboral por razón de la étnia prohibido por la Directiva 2000/43/CE.",,,2009-01-01T00:00:00+01:00,2009-01-01T00:00:00+01:00,Málaga,Empleo,Sin especificar,
"Un joven de etnia gitana ha estado vinculado laboralmente, a pesar de no contar con contrato de trabajo, a una carpintería metálica de la localidad durante varios años. Con motivo de un accidente de tráfi co sufrido por el trabajador con la furgoneta de la empresa, éste olvidó su teléfono móvil en el interior del vehículo que fue retirado por la grúa. Al fi nal de la jornada el gerente recriminó al trabajador el hecho de no haber estado localizado durante todo el día, llegando a utilizar expresiones como “el gitano cuando no te la hace a la entrada te la hace a la salida”. A partir de entonces, la víctima percibió un cambio de actitud hacia él, que degeneró en un ambiente que le llevó a abandonar la empresa pasado un tiempo. Nos encontramos ante un caso de acoso laboral por la condición étnica del trabajador prohibido por la Directiva 2000/43.",,,2009-01-01T00:00:00+01:00,2009-01-01T00:00:00+01:00,Málaga,Empleo,Sin especificar,
"Una usuaria del programa de empleo Acceder trabajaba en una peluquería de Atarfe, un pueblo granadino. Todo transcurría con normalidad hasta el momento en que comentó que se iba a casar con un joven de una zona llamada Pinos Puente. La dueña de la peluquería le dijo que si era así no iba a poder seguir contratándola. La trabajadora le dijo que no tenía que temer nada pues había medios de transporte adecuados para llegar a su puesto de trabajo sin problemas, ya que la joven pensó que se refería a este problema. La dueña le dijo que esa no era la razón, sino el que se casase con un muchacho gitano de Pinos Puente. Al ver la actitud por parte de la dueña de la peluquería, la víctima optó por dejar el trabajo. Se trataría de un caso de discriminación directa en el empleo por asociación, ya que la diferencia de trato en la relación laboral viene determinada no por la actitud de la trabajadora sino por la relación personal de ésta con una persona de etnia gitana. En este caso es relevante el papel que han jugado los prejuicios y estereotipos negativos hacia la comunidad gitana, ya que la empresaria ni siquiera conoce a la persona que le produce el rechazo, pero interpreta que la mayoría de los sucesos negativos que ocurren en el barrio desfavorecido son causados por la presencia de miembros de la comunidad gitana.",,,2009-01-01T00:00:00+01:00,2009-01-01T00:00:00+01:00,Granada,Empleo,Sin especificar,
"Un grupo de mujeres gitanas, participantes del Programa “Calí”, fueron a un restaurante con sus hijas e hijos a cenar. Una de ellas se acercó a la barra y el dueño le dijo de muy malas formas que “hablen más bajo, que esto no es la feria y si no os gusta os marcháis” y añadió que tenía derecho a echarlas si quería. Una de las mujeres, que había participado en una de las jornadas de información en derechos, le dijo que eso era discriminación, porque si no fueran gitanas no las estaría amenazando con echarlas a todas. Asimismo, la mujer decidió interponer una hoja de reclamaciones y se la solicitó al dueño, el cual cambió de actitud y pidió disculpas. Aun así, decidió ponerla ya que el trato le había parecido injusto y discriminatorio.",La Técnica de Igualdad acompañó a las mujeres a Consumo a poner la hoja de reclamaciones. La trabajadora que recogió la denuncia en Consumo se sorprendió por lo que había pasado y que las trataran así sólo por ser gitanas y manifestó que era la primera reclamación de este tipo que se ponía allí.,"Se intentó hacer seguimiento de la reclamación por parte de la Técnica de Igualdad, que llamó a la Xunta para solicitar información del expediente, pero en estos momentos no hay número de expediente asignado para esta reclamación ni ninguna respuesta.",2017-01-01T00:00:00+01:00,2017-01-01T00:00:00+01:00,A Coruña,Acceso a bienes y servicios,Discriminación directa,
"Una mujer gitana estaba en un supermercado, con sus dos hijas menores de edad, cuando la cajera acusó a un grupo de mujeres gitanas de robar. La mujer que estaba cerca de ellas también fue acusada de robo. Al llegar el encargado, una de las cajeras que seguía acusándola y diciendo “ya sé de qué palo vas, todas las gitanas sois iguales, venís a llevaros cosas gratis”. La mujer enseñó el bolso y aunque demostró que no tenía nada, no recibió disculpas. Se sintió tan dolida que llamó a la policía local, quién tras coger los datos de la cajera, animaron a la mujer a tomar medidas en el asunto, indicándole que estaba en su derecho.","La mujer llamó a la oficina de la FSG y contactó con la Técnica de Igualdad, quién se entrevistó con ella ese mismo día. La mujer le contó lo ocurrido con detalles y expresó la situación tan dolorosa que había vivido y la impotencia que sintió al no tener credibilidad su testimonio y al ver que la gente tiene aún este tipo de prejuicios.",La Técnica le informó y asesoró sobre sus derechos y la posibilidad de interponer una hoja de reclamaciones a la Oficina de Consumo. La mujer interpuso la hoja de reclamaciones y se sintió satisfecha con su actuación. A fecha de hoy no tenemos noticias sobre la Resolución.,2017-01-01T00:00:00+01:00,2017-01-01T00:00:00+01:00,Zaragoza,Acceso a bienes y servicios,Discriminación interseccional,
