hechos,intervencion,resultado,fecha_hechos,fecha_denuncia,provincia,ambito,tipo_desciminacion,reference,link
"Una trabajadora de la FSG contactó con una empresa para ofertar la posibilidad de que participantes de un curso realizaran las prácticas laborales en la empresa. La persona de la empresa encargada del personal se mostró abierta a que algún alumno o alumna pudiera hacer sus prácticas allí. Sin embargo, en la reunión que se mantuvo, de forma presencial, para cerrar el acuerdo de prácticas, la encargada dijo “de etnia gitana no quiero a nadie, ya tuve problemas con ellos, los tengo muy cerca. Lo que quieras, pero gitanos no”.","Desde la FSG se envió un correo electrónico al responsable de la empresa para confirmar que no quería personas de etnia gitana y llevar a cabo alguna actuación, bien de interlocución, sensibilización o denuncia.","Se recibió una llamada telefónica del responsable de la empresa, que con una actitud abierta y positiva aseveró que trataría de convencer al encargado de personal de aceptar a personas de etnia gitana en prácticas. Sin embargo, el gerente de la empresa se mostró cerrado. El equipo de empleo de la FSG decidió prescindir de este espacio para las prácticas.",2018-01-01T00:00:00+01:00,2018-01-01T00:00:00+01:00,A Coruña,Empleo,Discriminación directa,,https://informesdiscriminacion.gitanos.org/casos/santiago-de-compostela-empleo-discriminaci%C3%B3n-directa-2
"Una joven de etnia gitana contó a la técnica de igualdad que estaba buscando empleo activamente y que en esta búsqueda llamó a varios bares de un pueblo de Jaén para comprobar si necesitaban gente para trabajar. En uno de los bares que le dijeron que sí necesitaban, la citaron para una entrevista. La entrevista se la hizo la mujer del dueño del bar; le dijo que necesitaban a alguien urgente ese mismo fin de semana, la entrevista fue muy bien y la mujer quedó en llamarla. En ese momento entró el hijo de la mujer; este cambió la cara y le dijo que no tenían tanta prisa en contratar a alguien, pero la madre insistió que necesitaban a alguien ese fin de semana, que era urgente. El hijo dijo que no, que no necesitaban a nadie, que se esperara. A los pocos días, la joven gitana volvió llamó a la dueña del bar, que le dijo que lo sentía pero que ya no necesitaban a nadie y colgó. La joven, extrañada de lo ocurrido, llamó al cabo de dos días y, sin identificarse, preguntó si necesitaban a alguien para trabajar y la mujer del bar dijo que sí.","Desde la FSG se llamó por teléfono al bar y se preguntó por vacantes disponibles. El hijo de la dueña, que fue quien contestó la llamada, dijo que de momento no, pero que próximamente necesitarían personal para la terraza. Entonces, se le preguntó por la joven gitana, a lo que contestó que no había resultado seleccionada porque preferían contratar a personas conocidas.","La joven realizó un curso de camarera en la FSG y tiene trabajo esporádicamente. Asimismo, ha dejado su C.V. en el bar al que llamamos desde la FSG y haremos seguimiento.",2018-01-01T00:00:00+01:00,2018-01-01T00:00:00+01:00,Jaén,Empleo,Discriminación directa,,https://informesdiscriminacion.gitanos.org/casos/ja%C3%A9n-empleo-discriminaci%C3%B3n-directa-0
"La prospectora laboral de la FSG contactó con el encargado de una empresa para establecer algún Convenio de colaboración para que participantes de la FSG tuvieran oportunidad de realizar prácticas en la empresa. El encargado de la empresa envió un email a la FSG que decía expresamente que no podía colaborar con la entidad, habida cuenta de que los participantes son personas gitanas y aludiendo a unos supuestos robos cometidos en el pasado presuntamente, por personas de personas que pertenecen a la etnia gitana.",Desde la FSG se consideró que el contenido del email era una discriminación directa que impide las futuras prácticas laborales y contrataciones a las personas gitanas y disuade la presentación de usuarios/as gitanos de la FSG que podrían acceder a dichas prácticas o formación laboral.,Negativo.,2018-01-01T00:00:00+01:00,2018-01-01T00:00:00+01:00,Lugo,Empleo,Discriminación directa,,https://informesdiscriminacion.gitanos.org/casos/lugo-empleo-discriminaci%C3%B3n-directa
"Un joven gitano se presentó a una entrevista de trabajo como agente bursátil. El joven fue seleccionado y comenzó a trabajar en la empresa el mismo día que otro joven, que no era de etnia gitana. Los cuatro primeros días los dos jóvenes estuvieron sin contrato, en formación. El quinto día le dieron el alta y a la semana el encargado le preguntó, delante de todos sus compañeros de dónde era y si tenía raíces gitanas, a lo que el joven respondió que sí. Al día siguiente el encargado le llamó a su despacho y le comunicó que no había superado el periodo de prueba. El otro joven, que se había incorporado el mismo día que él y que había obtenido los mismos resultados en ventas, continuaba trabajando en la empresa.","La técnica de igualdad entrevistó al joven, que estaba convencido que le habían despedido por ser gitano. Se asesoró al joven y se valoró la posibilidad de presentar una denuncia a la inspección laboral. El joven le dijo a la técnica que tenía que hablarlo con su familia.","Después de varias llamadas al joven y a su familia, la madre nos comunicó que habían decidido no llevar a cabo ninguna actuación.",2018-01-01T00:00:00+01:00,2018-01-01T00:00:00+01:00,Madrid,Empleo,Discriminación directa,,https://informesdiscriminacion.gitanos.org/casos/madrid-empleo-discriminaci%C3%B3n-directa
"La técnica de empleo de la FSG del Programa de empleo de Acceder contactó con una empresa, con la que se había colaborado en ocasiones anteriores para realizar prácticas. Incluso se contrató a una de las personas que participaron en las prácticas. Sin embargo, en esta ocasión se comunicó desde la empresa al equipo de Acceder que no querían colaborar con la FSG por un incidente ajeno, que no tenía relación con las personas participantes de la FSG.",Desde la FSG se investigó el incidente y se comprobó que a raíz de una mala experiencia que tuvieron en la empresa se generalizó y ahora rechazaban a personas gitanas en prácticas. Desde la FSG se solicitó una reunión con la directiva de la empresa para retomar de nuevo la colaboración y sensibilizar sobre la diversidad existente en la comunidad gitana con el objetivo de que personas participantes en formación pudieran realizar las prácticas en esta empresa.,En esos momentos no hubo respuesta por parte de la empresa. Meses más tarde hubo un cambio en la Dirección de la empresa y esto pudo desbloquear la propuesta de las prácticas por la FSG. Se retomó el contacto con la empresa con un buen resultado.,2018-01-01T00:00:00+01:00,2018-01-01T00:00:00+01:00,A Coruña,Empleo,Discriminación directa,,https://informesdiscriminacion.gitanos.org/casos/santiago-de-compostela-empleo-discriminaci%C3%B3n-directa-1
"Desde la FSG se contactó con una empresa privada para realizar unas prácticas laborales. El responsable de la empresa rechazó a las personas participantes en la formación de la FSG, argumentando: “tengo mucha clientela gitana y tengo buena relación con ella; sin embargo, tengo mucha otra clientela es racista y no quiero tener problemas”.","Desde el equipo de empleo de la FSG contactaron, vía correo electrónico, con el responsable de la empresa para intentar sensibilizarle sobre la labor que lleva a cabo la entidad con la comunidad gitana.","Aunque parecía predispuesto a esta sensibilización, no volvió a ponerse en contacto con la FSG.",2018-01-01T00:00:00+01:00,2018-01-01T00:00:00+01:00,A Coruña,Empleo,Discriminación directa,,https://informesdiscriminacion.gitanos.org/casos/santiago-de-compostela-empleo-discriminaci%C3%B3n-directa-0
"Un joven participante del programa de empleo presentó su CV a una empresa de seguridad. Unos días después desde la empresa contactaron con él, comentándole que estaban buscando agentes de seguridad para la feria de Lorca y que les había interesado su CV. El joven comentó que no tenía el título de agente de seguridad y que por eso tampoco aparecía en el CV, sin embargo desde la empresa le dijeron que no importaba que le querían contratar durante 11 días y lo citaron el día siguiente para que fuera a recoger su uniforme. El joven acudió a la empresa el día siguiente, le dieron el uniforme y horas después le enviaron un WhatsApp con el cuadrante de sus horarios durante 4 días de trabajo con la empresa, no 11 como habían dicho en un principio. El día siguiente el joven recibió una llamada desde la empresa y le comunicaron que finalmente no le contratarían ya que no dispone de título oficial que acreditara que podía ejercer como agente de seguridad. El joven estaba convencido de que no le habían contratado porque el día que fue a la empresa a por el uniforme, le identificaron como un joven de etnia gitana, por su perfil étnico, muy marcado. Días después, tuvimos conocimiento desde el dispositivo de la FSG de que la empresa realizó varias contrataciones para el puesto de seguridad privada, contratando a personas que no eran de etnia gitana y que tampoco tenían el título oficial para ejercer como agentes de seguridad.",Desde la FSG se informó al joven y se le asesoró en relación a la discriminación racial o étnica. Se asesoró al joven de las distintas vías de actuación en relación a la situación de discriminación en el acceso al trabajo.,"El joven recibió todo el apoyo para realizar una actuación, pero no quiso continuar por temor a represalias en la búsqueda de empleo.",2018-01-01T00:00:00+01:00,2018-01-01T00:00:00+01:00,Murcia,Empleo,Discriminación directa,,https://informesdiscriminacion.gitanos.org/casos/murcia-empleo-discriminaci%C3%B3n-directa-1
"Un técnico de empleo de la FSG vio una oferta en una empresa para hacer unos cursos de soldadura de los que podían beneficiarse algunos/as participantes de la FSG. El técnico llamó por teléfono a la empresa y le atendió la responsable de formación. El técnico de la FSG le preguntó por los cursos de soldadura, le informó que llamaba de la FSG y ella preguntó si los participantes eran gitanos y añadió “si son gente problemática no los queremos para hacer cursos y si no tienen formación, tampoco”. El técnico de la FSG le explicó que no se debía generalizar, que en la comunidad gitana hay diversidad de personas, que la mayoría son personas no problemáticas y muchas con formación. La responsable de formación trató de retractarse diciendo que no pensara que había dicho eso, pero que “si eran marginales iban a dar problemas”.","Se envió una carta desde la FSG al presidente de la empresa manifestando la preocupación por los estereotipos y prejuicios de la responsable de formación de la empresa en la conversación mantenida con el técnico de empleo de la FSG. Asimismo, se solicitó que se tomaran las medidas oportunas para que este tipo de situaciones no se volvieran a repetir. Después de dos semanas sin obtener respuesta, la técnica de igualdad de Jaén llamó por teléfono a la empresa en reiteradas ocasiones y finalmente consiguió hablar con el presidente, que le informó que habían hablado con la formadora y que la habían expedientado, además analizarían el caso en la junta directiva. Asimismo, el presidente pidió disculpas y aseguró que mandarían por email lo que acordaran en la reunión. Pasado un mes desde la conversación, se llamó de nuevo al Presidente quién solicitó que se pidiera por carta certificada. Se envió carta certificada solicitando una respuesta. Al no responder, la técnica de igualdad realizó varias llamadas.","Parcialmente positivo. A pesar de la cordialidad el presidente con la técnica de igualdad en un primer momento, no se continuó el diálogo ni se informó de las medidas adoptadas para evitar que este suceso vuelva a ocurrir en el futuro.",2018-01-01T00:00:00+01:00,2018-01-01T00:00:00+01:00,Jaén,Empleo,Discriminación directa,,https://informesdiscriminacion.gitanos.org/casos/ja%C3%A9n-empleo-discriminaci%C3%B3n-directa
"Desde el programa de empleo Acceder de la FSG se contactó de manera presencial con la responsable de un establecimiento para solicitar prácticas, la cual se mostró muy interesada. Sin embargo, cuando supieron que la entidad era la FSG llegó un correo electrónico diciendo que “no están interesados desde dirección”. Tienen personas en prácticas de otras entidades sociales.",Desde el equipo de Empleo de la FSG se contactó con la persona responsable del establecimiento para informar y sensibilizar sobre la labor de la entidad con la Comunidad gitana y conocer si el rechazo estaba basado en prejuicios hacía las personas gitanas.,No hubo ninguna respuesta por parte de la empresa.,2018-01-01T00:00:00+01:00,2018-01-01T00:00:00+01:00,A Coruña,Empleo,Discriminación directa,,https://informesdiscriminacion.gitanos.org/casos/santiago-de-compostela-empleo-discriminaci%C3%B3n-directa
"Un joven participante de un programa de mejora de empleo de la FSG “Currélatelo Puerto Lumbreras”, de etnia gitana, presentó, a través de la orientadora laboral de la FSG, su CV en una empresa de distribución de licores y alimentación. Días después desde la empresa contactaron con él para una entrevista. Algunas semanas después, volvieron a contactar con el joven, le trasladaron el interés de contratarle y le pidieron que acudiera el día siguiente con ropa cómoda. A la mañana siguiente acudió al trabajo y durante la mañana le llamó la administrativa para firmar el contrato. En ese momento entró un hombre relacionado con la dirección de la empresa, que impidió la firma del contrato y que informo al joven que la empresa no podría contratarle por la caída en el volumen de la producción y le entregó un sobre con 40 euros por el trabajo desempeñado. Al día siguiente de acudir a su puesto de trabajo, al joven le cesaron de sus funciones, sin llegar a firmar el contrato, por “motivos relacionados con la productividad de la empresa”. Hace unos años la prospectora laboral de la FSG reportó un caso de discriminación con la misma empresa.","El joven informó a la orientadora de la FSG de lo sucedido y le manifestó que sentía que la decisión de no contratarle había sido por motivo de discriminación étnica. Desde la FSG se realizó una llamada a la empresa solicitándoles una reunión para presentar una bolsa de empleo. Además, se solicitó información relacionada con la falta de contratación al joven participante y desde la empresa la información fue la cancelación de un pedido para el que se pensaba contratar al joven. Se concretó una reunión para unas semanas después.","Unas semanas más tarde se mantuvo una reunión por parte de la FSG con el gerente de la empresa. Se presentó la FSG y el trabajo que desarrolla en la promoción de la Comunidad gitana, se consiguió concienciar de la necesidad de trabajar conjuntamente, promover el acceso al empleo de las personas gitanas desde la igualdad de oportunidades y el gerente de la empresa accedió a trabajar coordinadamente con el dispositivo de la FSG Puerto Lumbreras. Asimismo, tras hablar del caso concreto del joven participante que finalmente no se contrató, nos dijo que tendría en cuenta su perfil para próximas contrataciones.",2018-01-01T00:00:00+01:00,2018-01-01T00:00:00+01:00,Murcia,Empleo,Discriminación directa,,https://informesdiscriminacion.gitanos.org/casos/murcia-empleo-discriminaci%C3%B3n-directa-0
"Una mujer gitana se dirigió a la Sede de la FSG en Huelva y contó el trato que estaba sufriendo en su puesto de trabajo por parte de algunas compañeras, que no se querían relacionar con ella, diciéndole: “yo contigo no me siento a comer, me siento con los míos”, le hacen preguntas sobre su higiene personal, como por ejemplo: “¿tú te lavas?”, y cuando la mujer hace preguntas relacionadas con el trabajo, no responden a sus preguntas. La mujer siente que le hacen el vacío y se siente anulada, tiene la certeza que ese trato es por ser de etnia gitana, así que puso en conocimiento de su encargada la situación que estaba viviendo. La encargada de la empresa convocó una reunión con todas las trabajadoras y cuando se acercó la mujer, le dijo: “Yo no he venido aquí por ti, he venido por unos documentos, lo primero que tienes que tener es más educación”. La encargada en la reunión tomó posición a favor de las otras trabajadoras y manifestó que ella se estaba equivocando. Al finalizar la reunión, la mujer se acercó a la encargada y ésta le aconsejo que no le echara cuenta, que dejara pasar esa situación y que le diera otra oportunidad. Como consecuencia de esta situación y del estado de ansiedad en la que se encontraba la mujer acudió a su médica, que le dio el parte de baja laboral por depresión. Asimismo, la mujer contactó telefónicamente con el director de recursos humanos exponiéndole la situación en la que se encontraba, éste muy amablemente escuchó a la mujer y le dijo que pensaría en alguna solución.  ","La técnica de igualdad entrevistó a la mujer, comprobó el parte médico de baja por depresión y el contrato de trabajo con la empresa. Desde la FSG se envió carta al director de recursos humanos de la empresa refiriendo los hechos, mostrando preocupación por la situación que estaba viviendo la mujer y solicitándole un cambio de centro de trabajo con las mismas condiciones que la mujer tenía en ese centro.","El Director de recursos humanos de la empresa contactó con la mujer y le ofreció un cambio de lugar de trabajo, le dijo que por el momento era el único lugar disponible, que se lo pensara y que si no le interesaba, porque no estaba muy cerca de su casa, esperara a que surgiera otra vacante en un sitio más cercano. Asimismo, el director de recursos humanos llamó al Departamento de Igualdad de la FSG y trasladó que haría todo lo posible para solucionar la situación, ubicando a la mujer en otro centro de trabajo. También mostró mucho interés en conocer nuestra entidad. Pasados unos meses, la mujer cambió de centro de trabajo a propuesta del director de recursos humanos y desde entonces se encuentra muy contenta en su nuevo centro. Agradece mucho el acompañamiento que se le ha dado desde la FSG.",2018-01-01T00:00:00+01:00,2018-01-01T00:00:00+01:00,Huelva,Empleo,Discriminación directa,,https://informesdiscriminacion.gitanos.org/casos/huelva-empleo-discriminaci%C3%B3n-directa-0
"Una orientadora educativa de la FSG acudió a una reunión con la directora de un colegio para solicitar un espacio para un evento. Durante la reunión, la directora preguntó si a ese evento acudirían familias gitanas y que si es así: “habrá que tener cuidado porque ya sabemos cómo son los gitanos que llevan en su sistema aprovecharse de ciertas situaciones y coger lo que tengan a su alcance, que es una práctica habitual”. La orientadora mostró sorpresa por este comentario y la directora le dijo: “no me malinterpretes, no soy racista” y añadió: “las familias funcionan por sistemas que se van transmitiendo de generación en generación, al igual que los africanos son muy respetuosos, o los árabes son muy pillos, los gitanos tienen en sus genes coger lo que no es suyo...”. La orientadora argumentó que le parecía un comentario estereotipado y prejuicioso.",Se contactó con la directora con la finalidad de abordar los estereotipos y prejuicios que padecen las personas gitanas en el ámbito educativo y se ofreció una formación al profesorado en igualdad de trato y comunidad gitana.,La directora del centro se comprometió a darnos un espacio para llevar a cabo la formación y sensibilización con el profesorado en el primer trimestre del nuevo curso escolar.,2018-01-01T00:00:00+01:00,2018-01-01T00:00:00+01:00,Murcia,Educación,Discriminación directa,,https://informesdiscriminacion.gitanos.org/casos/murcia-educaci%C3%B3n-discriminaci%C3%B3n-directa-0
"Un alumno de etnia gitana, menor de edad, sufrió comentarios vejatorios por parte de una de sus profesoras, tales como “llevas pelotillas de mierda en el ombligo”. Además, esa misma profesora inició un debate en la clase del alumno en relación a si era positivo o no que la población gitana recibiera ayudas económicas. La madre del menor contactó con la FSG para contar la situación.","Se entrevistó personalmente a la madre del menor, se asesoró a la familia de las posibles vías. Se contactó con el centro, con el equipo directivo y el departamento de orientación para aclarar lo sucedido y que se tomaran las medidas oportunas.","Finalmente, la familia cambió de centro al menor.",2018-01-01T00:00:00+01:00,2018-01-01T00:00:00+01:00,Teruel,Educación,Discriminación directa,,https://informesdiscriminacion.gitanos.org/casos/teruel-educaci%C3%B3n-discriminaci%C3%B3n-directa-0
"Una mujer de etnia gitana que estudiaba en un centro de estudios para adultos se matriculó para hacer el examen de competencias. Unos días antes del examen se murió un familiar y la mujer se vistió de luto. La mujer fue a hacer el examen al Centro y la profesora responsable del aula, sin preguntarle nada le dijo: “aquí no es, te estás equivocando”, le impidió la entrada al examen, sin conocerla, guiándose por los estereotipos. La mujer se marchó.",La mujer recibió formación en la defensa de sus derechos para futuras ocasiones.,No quiso hacer nada por la situación emocional en la que se encontraba.,2018-01-01T00:00:00+01:00,2018-01-01T00:00:00+01:00,Cáceres,Educación,Discriminación directa,,https://informesdiscriminacion.gitanos.org/casos/c%C3%A1ceres-educaci%C3%B3n-discriminaci%C3%B3n-directa-1
"La madre de una menor contó en la FSG que la profesora de su hija durante una clase, delatante de todos sus compañeros y compañeras le dijo: “los gitanos, como tú, estáis aquí por las ayudas que recibís del Estado”. Desde que escuchó este comentario, la menor está muy afectada.",Se informó y asesoró a la madre de la posibilidad de llevar a cabo alguna interlocución en el centro.,La madre no quiso llevar a cabo ninguna actuación.,2018-01-01T00:00:00+01:00,2018-01-01T00:00:00+01:00,Teruel,Educación,Discriminación directa,,https://informesdiscriminacion.gitanos.org/casos/teruel-educaci%C3%B3n-discriminaci%C3%B3n-directa
"Un participante de la FSG acudió al colegio a recoger a su hija menor de edad y se encontró con una mujer que estaba llorando y contando a otras familias lo que le había sucedido: el director del centro le había hecho algunos comentarios como: “si al fin y al cabo, tu hijo no va a estudiar”, haciendo alusión a la etnia gitana de la familia y dando a entender que no continúan los estudios. La madre contó que se había reunido con el director, precisamente, porque su hijo estaba sufriendo bullying y discriminación étnica por algunos alumnos. El resto de personas mostró pasividad ante la situación.","El participante, que había recibido formación de derechos y específicamente había asistido a alguna jornada de lucha contra la discriminación le sugirió a la mujer que fuera al dispositivo de la FSG, que tenían un Servicio de Atención a Víctimas de Discriminación. Desde la FSG contactamos con la mujer por teléfono, le asesoramos y le propusimos algunas actuaciones.",La mujer no acudió a la cita en la FSG y no quiso llevar a cabo ninguna actuación.,2018-01-01T00:00:00+01:00,2018-01-01T00:00:00+01:00,Cáceres,Educación,Discriminación directa,,https://informesdiscriminacion.gitanos.org/casos/c%C3%A1ceres-educaci%C3%B3n-discriminaci%C3%B3n-directa-0
"En una sesión de sensibilización en un instituto el formador pasó una hoja para que el alumnado expusiera qué es lo primero que piensan o qué imagen tienen de un gitano. Muchos mostraron prejuicios sobre la comunidad gitana pero uno de los alumnos era especialmente racista: expresaba a menudo frases como “los odio, son la peor especie, siempre van en manada” y en su cuartilla escribió un mensaje de odio: “Pienso que los gitanos son la peor especie que ha creado la tierra, pienso que son unos ladrones, mentirosos, holgazanes, malas personas y que no tienen nada que perder, ya que nunca pagan las deudas, viven como neandertales, son una especie subdesarrollada con la que convivo y odio. Por lo tanto, pienso lo peor de ellos, no me hace falta verlos para identificar lo malas personas que son. También me parece que son una especie machista. LOS ODIO. Cuanto menos contacto mejor.”","Como estrategia decidimos realizar más acciones de sensibilización en el instituto; contamos con la aprobación tanto del director como de los tutores, que afirmaron que les habían resultado muy efectivas las acciones de sensibilización.",Valoramos que las acciones de sensibilización han sido efectivas y hemos planteados más de cara al año que viene. Tanto el director como los tutores del centro están muy satisfechos y ven necesarias este tipo de acciones.,2018-01-01T00:00:00+01:00,2018-01-01T00:00:00+01:00,Cuenca,Educación,Discriminación directa,,https://informesdiscriminacion.gitanos.org/casos/cuenca-educaci%C3%B3n-discriminaci%C3%B3n-directa-discurso-de-odio
