hechos,intervencion,resultado,fecha_hechos,fecha_denuncia,provincia,ambito,tipo_desciminacion,reference
"Un periódico local menciona la pertenencia étnica de una pareja protagonista de un episodio de violencia doméstica que se saldó con la muerte de una joven menor de edad a manos de su pareja, tras ser torturada varios días.",,,2004-01-01T00:00:00+01:00,2004-01-01T00:00:00+01:00,Murcia,Medios de comunicación,Discriminación directa,
Un periódico de ámbito nacional publica en la sección Baleares una noticia con el siguiente titular “Cae una banda de etnia gitana dedicada a robar y traficar con aves exóticas”.,,,2004-01-01T00:00:00+01:00,2004-01-01T00:00:00+01:00,Baleares,Medios de comunicación,Discriminación directa,
"Un informativo local comenta en antena una noticia relativa a tres mujeres detenidas por presunta estafa y agresión. Desde el titular de la noticia se hace referencia a la pertenencia étnica de las implicadas, para referirse posteriormente a ellas como “las gitanas”. La FSG se pone en contacto con la cadena, que se disculpa por los hechos.",,,2004-01-01T00:00:00+01:00,2004-01-01T00:00:00+01:00,Pontevedra,Medios de comunicación,Discriminación directa,
"Con el titular de Batalla campal en La Paz, un periódico recoge, de manera inexacta, distorsionada y sensacionalista, en relación a un altercado ocurrido en un hospital madrileño tras el fallecimiento de un paciente gitano: eran unos cincuenta y quisieron llevarse el cadáver del ser querido. Especialmente denigrante era el dibujo “ilustrativo” de la versión publicada por este medio.",,,2004-01-01T00:00:00+01:00,2004-01-01T00:00:00+01:00,Madrid,Medios de comunicación,Discriminación directa,
"Tras el estacionamiento irregular de un vehículo por un usuario gitano de la FSG, dos policías municipales solicitan su identificación personal, lo que origina una breve discusión con el afectado, durante la cual uno de los agentes afirma que “el mejor de los gitanos debería estar ahorcado”.",,,2004-01-01T00:00:00+01:00,2004-01-01T00:00:00+01:00,Madrid,Servicios policiales,Discriminación directa,
"Agentes de la policía municipal detienen un vehículo solicitando la identificación de su conductor. Comprobada ésta, y a pesar de constatar la ausencia de antecedentes penales, los agentes proceden a realizar un cacheo personal y un interrogatorio en medio de la vía pública por un tiempo y con un rigor desproporcionado. El afectado interpone una reclamación en la comisaría denunciando un trato vejatorio y humillante por razón de su pertenencia étnica, pero el servicio de atención ciudadana considera la actuación sujeta a legalidad y no impone medida disciplinaria alguna.",,,2004-01-01T00:00:00+01:00,2004-01-01T00:00:00+01:00,Pontevedra,Servicios policiales,Discriminación directa,
"La inspección de trabajo determina que una empresa incumple con las medidas de seguridad preceptivas, negligencia que provocó la afección pulmonar e invalidez permanente de un trabajador gitano, tal y como certificó el tribunal médico correspondiente. Al confirmarse la negligencia empresarial, el trabajador solicita una indemnización y un incremento de su pensión de invalidez, pero su pretensión es desestimada a pesar de todas las pruebas médicas a su favor.",,,2004-01-01T00:00:00+01:00,2004-01-01T00:00:00+01:00,Salamanca,Servicios policiales,Discriminación directa,
"Un agente de la policía local acude al lugar de trabajo de una persona gitana para hacerle unas preguntas en relación al robo de una bicicleta. En una empresa situada en el mismo edificio, el agente comenta que está buscando a una chica gitana que trabaja en una lavandería, “porque está involucrada en el robo”. Al llegar a la lavandería vuelve a repetir lo mismo delante de su jefe y el resto de compañeros. El dueño de la lavandería, conocedor de la inocencia de su empleada, informa a la FSG, que interpone una queja en la comisaría.",,,2004-01-01T00:00:00+01:00,2004-01-01T00:00:00+01:00,Lugo,Servicios policiales,Discriminación directa,
"Varias mujeres gitanas acuden a la comisaría para denunciar que en una cafetería se han negado a servirles una consumición y a facilitarles el libro de reclamaciones. El agente que las atiende quita importancia a lo sucedido argumentando que no es motivo suficiente para interponer una denuncia, aunque las interesadas deciden volver a la comisaría para hacerlo.",,,2004-01-01T00:00:00+01:00,2004-01-01T00:00:00+01:00,Albacete,Servicios policiales,Discriminación directa,
"Para tramitar la corrección del primer apellido de una persona gitana de origen portugués que figuraba erróneamente en su DNI, se solicita la presentación de su partida literal de nacimiento. En ella se comprueba que, en el momento de la inscripción en el registro civil en el año 79, sus padres figuraban como ciudadanos portugueses. Por ello, se le deniega la renovación del DNI y se le exige el inicio de los trámites para solicitar la nacionalidad española, dejándole indocumentado mientras dure el proceso. Finalmente la Delegación de Gobierno de Asturias resuelve el problema en colaboración con la FSG, que realiza el acompañamiento y las gestiones administrativas.",,,2004-01-01T00:00:00+01:00,2004-01-01T00:00:00+01:00,Asturias,Servicios policiales,Discriminación directa,
"Una persona que afirma ser policía increpa a un chico gitano del barrio de Sant Adrià. Un vecino intenta mediar en la situación, pero el presunto policía le sugiere que no se meta o también se va a enterar, lo que provoca una discusión durante la cual alude a la pertenencia étnica de los afectados, insultándoles y amenazándoles, por lo que interponen una denuncia en la comisaría.",,,2004-01-01T00:00:00+01:00,2004-01-01T00:00:00+01:00,Barcelona,Servicios policiales,Discriminación directa,
En el expediente de un menor en acogida y en trámite de pre-adopción se hace constar la pertenencia étnica de su madre y se menciona la falta de adecuación del entorno cultural gitano para la correcta socialización de cualquier menor.,,,2004-01-01T00:00:00+01:00,2004-01-01T00:00:00+01:00,Pontevedra,Servicios policiales,Discriminación directa,
"Tras sufrir la negativa del dueño de un establecimiento a servirle una consumición y utilizar los lavabos, el afectado toma la decisión de denunciar los hechos, para lo que realiza una consulta al servicio de asistencia jurídica gratuita, donde una abogada le sugiere no realizar ninguna reclamación, ya que conllevan mucho papeleo.",,,2004-01-01T00:00:00+01:00,2004-01-01T00:00:00+01:00,Asturias,Servicios policiales,Discriminación directa,
"Tres agentes de la policía nacional se encuentran, fuera del ejercicio de sus funciones, en un coche particular estacionado en un barrio con numerosa población gitana. Al recibir el impacto de un ladrillo lanzado contra el vehículo desde uno de los inmuebles cercanos, uno de los agentes sale del coche insultando a todos los gitanos del barrio y haciendo referencia, de manera despectiva e insultante, a “sus muertos”, lo que provoca un enfrentamiento verbal con los vecinos. Por la noche, el mismo agente regresa al lugar de los hechos acompañado de varios compañeros, que paran e insultan a un joven de la barriada, lo que provoca un nuevo enfrentamiento con los vecinos, varios de los cuales les denuncian por insultos, amenazas y agresiones físicas.",,,2004-01-01T00:00:00+01:00,2004-01-01T00:00:00+01:00,Málaga,Servicios policiales,Discriminación directa,
"A pesar de haber comprado las correspondientes entradas, el portero de un local impide el acceso de tres jóvenes gitanos, sin ninguna justificación. Los interesados solicitan la presencia de la policía y presentan una reclamación ante la oficina de atención al consumidor, que levanta acta por irregularidades administrativas, aunque se desconoce si dichas irregularidades tienen o no que ver con los hechos denunciados.",,,2004-01-01T00:00:00+01:00,2004-01-01T00:00:00+01:00,Sevilla,Acceso a bienes y servicios,Discriminación directa,
"Tres menores gitanos, tras ser admitidos en un equipo de fútbol del barrio, reciben en su domicilio una carta, en papel original del club, en la que les comunican su expulsión por ser de etnia gitana. El club alega desconocer los hechos, y afirma que los menores no tienen ficha y, por tanto, no han podido ser expulsados. Alega, también, que en su entidad ha habido siempre personas de etnia gitana.",,,2004-01-01T00:00:00+01:00,2004-01-01T00:00:00+01:00,A Coruña,Acceso a bienes y servicios,Discriminación directa,
"Un grupo de amigas gitanas acuden a un local de Valladolid. Una vez dentro del establecimiento, la camarera les informa de que no tiene permitido servir ni a gitanos ni a personas de color. Cuando otros dos trabajadores las invitan a abandonar el local, las interesadas se niegan y solicitan una hoja de reclamaciones que no les es facilitada. Ante la amenaza de llamar a la policía, el dueño acaba presentándoles sus disculpas personalmente.",,,2004-01-01T00:00:00+01:00,2004-01-01T00:00:00+01:00,Valladolid,Acceso a bienes y servicios,Discriminación directa,
"Varias mujeres gitanas acuden a un establecimiento de moda en el que reciben un trato despectivo y humillante por parte de la dependienta, que las obliga a entrar en los probadores de una en una, gritando que no le gusta tener a gente como ellas en su tienda. Cuando solicitan el libro de reclamaciones, la dependienta se niega a entregárselo, por lo que las afectadas denuncian los hechos ante la policía.",,,2004-01-01T00:00:00+01:00,2004-01-01T00:00:00+01:00,Asturias,Acceso a bienes y servicios,Discriminación directa,
"Tras realizar su compra, una mujer gitana comprueba que el importe del ticket es superior a los productos adquiridos. Cuando reclama en el establecimiento, la cajera realiza varios comentarios ofensivos contra la comunidad gitana, acusándola de intentar engañarla. Un trabajador del supermercado confirma que no ha atendido a la víctima en la sección de charcutería, como erróneamente constaba en el comprobante de pago.",,,2004-01-01T00:00:00+01:00,2004-01-01T00:00:00+01:00,Córdoba,Acceso a bienes y servicios,Discriminación directa,
"Un matrimonio denuncia en la prensa a una clínica dental por racismo tras escuchar cómo el ayudante le dice a la odontóloga: “son las siete y cuarto y son gitanos, qué hacemos”. La clínica niega la motivación racista y alega que no se les atendió por haber llegado tarde. Los afectados no pertenecen, en realidad, a la comunidad gitana.",,,2004-01-01T00:00:00+01:00,2004-01-01T00:00:00+01:00,Murcia,Acceso a bienes y servicios,Discriminación directa,
"La dueña de una cafetería se niega a servir consumiciones a tres personas gitanas, que vuelven a entrar en el establecimiento para solicitar la hoja de reclamaciones. Ante la negativa de la dueña, las interesadas interponen una denuncia en la policía.",,,2004-01-01T00:00:00+01:00,2004-01-01T00:00:00+01:00,Albacete,Acceso a bienes y servicios,Discriminación directa,
Se celebra un juicio de faltas para tratar la denuncia de tres familias gitanas a la que se denegó el acceso a una piscina por ser gitanos y “espantar a la clientela”. El juicio se resuelve positivamente con una multa de 280 euros para el agente discriminador.,,,2004-01-01T00:00:00+01:00,2004-01-01T00:00:00+01:00,Jaén,Acceso a bienes y servicios,Discriminación directa,
"El dueño de un establecimiento se niega a servir una consumición a un cliente gitano, así como a permitir que el sobrino de éste utilice el aseo, alegando que esa es su casa y hace lo que quiere.",,,2004-01-01T00:00:00+01:00,2004-01-01T00:00:00+01:00,Asturias,Acceso a bienes y servicios,Discriminación directa,
"Una mujer gitana acude a la oficina de la seguridad social para solicitar su pensión de viudedad. La funcionaria responsable de la cita para el mes siguiente, quedándose con parte de los documentos aportados. Llegada esa fecha, un funcionario distinto atiende a la usuaria y, de manera hostil y despectiva, afirma insistentemente que ningún compañero ha guardado su documentación. Finalmente reconoce que han extraviado los informes y tramita una nueva solicitud.",,,2004-01-01T00:00:00+01:00,2004-01-01T00:00:00+01:00,Asturias,Acceso a bienes y servicios,Discriminación directa,
"Dos hermanos gitanos denuncian que, a lo largo del mes, los porteros de cinco locales diferentes les han negado la entrada a sus establecimientos por motivos étnicos.",,,2004-01-01T00:00:00+01:00,2004-01-01T00:00:00+01:00,Albacete,Acceso a bienes y servicios,Discriminación directa,
"Una ATS se corta el dedo con el mismo bisturí cuando está atendiendo a un menor gitano, por lo que solicita un análisis de sangre del mismo para comprobar que no es portador de ninguna enfermedad. El padre del menor accede, aunque recrimina a la ATS y solicita, asimismo, que a ella también se le realice un análisis. Cinco guardias de seguridad acuden al lugar de los hechos afirmando que han solicitado urgentemente su presencia para evitar que una familia gitana agrediera a una ATS. El padre del menor exige la hoja de reclamaciones correspondiente pero ningún miembro del hospital accede a facilitar la identidad de la profesional médica.",,,2004-01-01T00:00:00+01:00,2004-01-01T00:00:00+01:00,Córdoba,Salud,Discriminación directa,
"Una usuaria de la FSG solicita un cambio de centro de salud al haberse trasladado a otro domicilio. A pesar de presentar la cartilla del titular rechazan su petición afirmando, en referencia a la comunidad gitana, que siempre tienen un número demasiado elevado de beneficiarios, y que “el centro se encuentra saturado”. Finalmente acceden a tramitar el cambio gracias a la mediación de la FSG, aunque para ello solicitan la presentación de un certificado de empadronamiento, requisito que sólo suele exigirse a los miembros de la comunidad gitana.",,,2004-01-01T00:00:00+01:00,2004-01-01T00:00:00+01:00,Lugo,Salud,Discriminación directa,
"Tras el fallecimiento de un paciente gitano, se produce un altercado entre sus familiares y los servicios de seguridad del hospital, que termina con la intervención de las Unidades de Intervención Policial (antiguos antidisturbios), y varios heridos. La FSG condena la actitud de la familia, pero se dirige a los centros hospitalarios para poner de manifiesto que este tipo de incidentes podrían evitarse o disminuirse con una mejor atención a la diversidad cultural.",,,2004-01-01T00:00:00+01:00,2004-01-01T00:00:00+01:00,Madrid,Salud,Discriminación directa,
"Dos alumnos gitanos reciben una notificación de expulsión temporal y, un tercero, definitiva, por una serie de faltas cometidas en el colegio. El Director se reúne con las familias y un mediador de la FSG para exponer su postura, no compartida por otros profesionales del centro. Aunque se acuerda la celebración de una nueva reunión con el Jefe de Estudios, las familias reciben una nueva notificación de expulsión, así como la comunicación de que los hechos se pondrán en conocimiento de la policía. Finalmente, los alumnos son expulsados treinta días, por lo que deciden no regresar al centro, donde se sienten discriminados. La FSG continúa con sus labores de mediación, y consigue que la Dirección flexibilice su postura, así como la reincorporación de los alumnos.",,,2004-01-01T00:00:00+01:00,2004-01-01T00:00:00+01:00,Albacete,Educación,Discriminación directa,
"La viceconsejera de Educación de la Comunidad de Madrid declara en una entrevista sobre la inmigración a una publicación del ámbito educativo que “algo parecido ocurre con los gitanos. El niño lo que quiere es ir con su padre con la fregoneta al mercado a vender fruta”. “Luchar contra el peso de su cultura es muy difícil. Son niños que han mamado una cultura en la que ascender en la escala social por formación no goza de muy buena fama”. La FSG publica una nota de prensa condenando las declaraciones, por las que la viceconsejera pide disculpas.",,,2004-01-01T00:00:00+01:00,2004-01-01T00:00:00+01:00,Madrid,Educación,Discriminación directa,
"En el curso escolar 03/04 se incorpora a un colegio concertado de Vallecas una nueva directora. Desde ese momento, un alumno gitano comienza a tener problemas, y se ordena su traslado a un espacio independiente en el que se encuentra aislado porque, según la Directora, no aprende. Se le acusa, asimismo, de un robo que no ha cometido, como se comprueba con posterioridad. El equipo directivo solicita continuamente su traslado a otro centro en el que dispongan de un programa de educación compensatoria.",,,2004-01-01T00:00:00+01:00,2004-01-01T00:00:00+01:00,Madrid,Educación,Discriminación directa,
"Tras visitar un piso, una trabajadora de la FSG acuerda con el dueño su alquiler, para lo que se realiza el pago de la fianza correspondiente, así como el importe de la primera mensualidad. Esa misma tarde, sin embargo, la dueña del piso vuelve a contactar con ella para comunicarle que no lo puede alquilar porque un familiar suyo lo necesita.",,,2004-01-01T00:00:00+01:00,2004-01-01T00:00:00+01:00,A Coruña,Vivienda,Discriminación directa,
"Una usuaria de la FSG recibe insultos y amenazas por parte de una vecina que la culpa de la rotura de una baldosa del patio. Con expresiones como “gitana de mierda, todos los gitanos sois iguales”, la vecina intenta, sin éxito, provocar un enfrentamiento físico con la víctima. La usuaria de la FSG, que lleva más de dos años residiendo en el piso y no ha tenido problemas con el resto del vecindario, alega haber sufrido siempre un trato hostil, amenazante y vejatorio por parte de esta vecina.",,,2004-01-01T00:00:00+01:00,2004-01-01T00:00:00+01:00,Almería,Vivienda,Acoso discriminatorio,
"Una trabajadora de la FSG acude con su hijo a visitar un piso en alquiler. El dueño del inmueble le pregunta por su pertenencia étnica afirmando que, aunque él no es racista, su madre no quiere alquilar la vivienda a personas gitanas.",,,2004-01-01T00:00:00+01:00,2004-01-01T00:00:00+01:00,A Coruña,Vivienda,Discriminación directa,
"Una pareja gitana de recién casados solicita el apoyo de la FSG para alquilar una vivienda. Tras varias visitas, optan por un piso e intentan cerrar un acuerdo con el dueño telefónicamente. Ninguno tiene apariencia gitana pero, al facilitar sus datos personales, el propietario les pregunta por su pertenencia étnica y decide no alquilarles con la excusa de que el contrato laboral del marido no especifica su duración, a pesar de que la empresa había accedido a demostrar que contaban con el trabajador para los próximos dos años.",,,2004-01-01T00:00:00+01:00,2004-01-01T00:00:00+01:00,Palencia,Vivienda,Discriminación directa,
"La Plataforma vecinal contra la delincuencia de Épila acusa a la comunidad gitana de provocar inseguridad y delincuencia, razones por las cuales organiza manifestaciones de protesta, utilizando los medios de comunicación para incitar al racismo y la discriminación. Culpa a toda la comunidad gitana de los actos cometidos por cuatro jóvenes, ya identificados por la Guardia Civil, que, al igual que los responsables municipales, desmiente el incremento de actos delictivos en la localidad.",,,2004-01-01T00:00:00+01:00,2004-01-01T00:00:00+01:00,Zaragoza,Vivienda,Acoso discriminatorio,
"Un periódico nacional publica que la Alcaldesa de Manzanares El Real ha solicitado a la Delegación del Gobierno de Madrid el envío de un escuadrón de caballería para evitar la acampada de varias familias gitanas en la localidad, argumentando que deterioran el entorno, son agresivas y hacen crecer la inseguridad ciudadana.",,,2004-01-01T00:00:00+01:00,2004-01-01T00:00:00+01:00,Madrid,Vivienda,Discriminación directa,
"Una familia gitana, cuyo contrato de alquiler se aproxima al vencimiento, inicia la búsqueda de un nuevo piso con el apoyo de la organización Cáritas Diocesana de Tui-Vigo. Varios trabajadores de la entidad acuden a distintas inmobiliarias en las que se niegan a facilitarles información sobre los pisos por la pertenencia étnica de los solicitantes, ya que no quieren tener problemas con los propietarios de los inmuebles.",,,2004-01-01T00:00:00+01:00,2004-01-01T00:00:00+01:00,Pontevedra,Vivienda,Discriminación directa,
"Seis familias gitanas residen desde hace varios años en un poblado chabolista sin las mínimas condiciones higiénico-sanitarias. En el año 2002 el Ayuntamiento promete un proyecto de construcción de viviendas para alojar a estas familias, que no llega a formalizarse por presiones vecinales. En 2004 se informa a la FSG de que va a iniciarse la construcción, aunque finalmente se asignan las viviendas sólo a las quienes puedan acreditar una serie de requisitos que no cumplen ninguna de las familias del poblado chabolista.",,,2004-01-01T00:00:00+01:00,2004-01-01T00:00:00+01:00,Asturias,Vivienda,Discriminación indirecta,
"La FSG acuerda el alquiler de un local para el desarrollo de su programa Andalucía Orienta, financiado por la Junta de Andalucía. Cuando, en el momento de firmar el contrato, el propietario comprueba que la FSG es la entidad social gestora del proyecto, manifiesta su preocupación porque a los vecinos no les guste la presencia de gitanos en el barrio, a pesar de que cuenta con un alto número de miembros de esta comunidad. Finalmente afirma que no está interesado en alquilarlo, que ha hablado con su esposa y han decidido venderlo.",,,2004-01-01T00:00:00+01:00,2004-01-01T00:00:00+01:00,Jaén,Vivienda,Discriminación directa,
"Una familia gitana alquila un piso propiedad de una constructora benéfica, donde residen desde hace dos años. Sus vecinos les acusan de no cumplir con la normativa de la comunidad, principalmente en lo referente al nivel de ruidos y normas de estacionamiento, a pesar de que otros vecinos tampoco respetan dichas normas. Exigen de manera continua que se traslade a la familia a otra vivienda, criticando su manera de vivir y sus costumbres. La FSG desarrolla diversas labores de mediación y, a pesar de que la comunidad admite una clara mejora de la convivencia, acaba denunciando a la empresa constructora.",,,2004-01-01T00:00:00+01:00,2004-01-01T00:00:00+01:00,Asturias,Vivienda,Acoso discriminatorio,
"Los técnicos municipales aconsejan en el año 2003 el desalojo de la vivienda de un usuario de la FSG. El Ayuntamiento se compromete a facilitar el alquiler de un piso mientras se realiza la rehabilitación, sin que desde entonces se hayan iniciado las obras ni ofrecido un alojamiento alternativo, a pesar de que el inmueble presenta claros indicios de derrumbamiento. La empresa constructora solicita la concesión de una vivienda de emergencia en VIPASA5, organismo que valora positivamente la solicitud, pero el Ayuntamiento se opone, ya que dichas viviendas se conceden por un periodo mínimo de cinco años.",,,2004-01-01T00:00:00+01:00,2004-01-01T00:00:00+01:00,Asturias,Vivienda,Discriminación indirecta,
"La FSG adquiere una vivienda de integración social para alquilarla a una familia gitana que reside en la localidad en situación precaria. Al llegar al inmueble para instalarse, la familia y algunos trabajadores de la FSG encuentran al Alcalde y numerosos vecinos increpándoles y amenazándoles para que no ocupen la vivienda. Esa misma tarde, la FSG intenta tranquilizar los ánimos y facilitar el acceso de la familia al inmueble de su propiedad, pero encuentra la puerta bloqueada y a los vecinos y el Alcalde increpándolos nuevamente. La FSG emprende acciones legales que no se resuelven a su favor en primera instancia, por lo que se presenta un recurso pendiente todavía de resolución.",,,2004-01-01T00:00:00+01:00,2004-01-01T00:00:00+01:00,Navarra,Vivienda,Discriminación directa,
"El Ayuntamiento precinta una Iglesia Evangélica Gitana abierta veinte días atrás. El pastor de la Iglesia alega motivaciones racistas en la medida, asegurando que los vecinos han manifestado que no quieren gitanos en la zona. Aunque el portavoz municipal asegura que el local ha sido cerrado por incumplimiento de varias ordenanzas municipales, el pastor niega la mayoría de las irregularidades denunciadas.",,,2004-01-01T00:00:00+01:00,2004-01-01T00:00:00+01:00,Barcelona,Vivienda,Discriminación directa,
"El denunciante y su pareja acuden a diversas inmobiliarias de la ciudad con intención de alquilar un piso, pero en todas les dicen que no tienen nada disponible que se ajuste a sus necesidades. Al acudir por separado, la pareja del denunciante, que no tiene apariencia gitana, recibe distinta respuesta y es, incluso, citada para visitar algún piso.",,,2004-01-01T00:00:00+01:00,2004-01-01T00:00:00+01:00,Huesca,Vivienda,Discriminación directa,
"Dos jóvenes gitanos, acompañados por personal de la FSG, intentan visitar un piso que se anuncia en alquiler. Al verlos, la dueña les informa de que ya no va a alquilarlo y asegura que todavía no ha quitado el cartel anunciador porque se encuentra a la espera de que los actuales inquilinos retiren sus muebles. El piso continúa anunciándose mes y medio después.",,,2004-01-01T00:00:00+01:00,2004-01-01T00:00:00+01:00,Asturias,Vivienda,Discriminación directa,
"Alrededor de cien vecinos del pueblo de Torrox se manifiestan para impedir el presunto realojo de unas familias gitanas, desalojadas de un edificio de la localidad en estado de ruina. El realojo era, sin embargo, un rumor que los responsables municipales se apresuraron a desmentir, para evitar mayores conflictos vecinales.",,,2004-01-01T00:00:00+01:00,2004-01-01T00:00:00+01:00,Málaga,Vivienda,Discriminación directa,
