hechos,intervencion,resultado,fecha_hechos,fecha_denuncia,provincia,ambito,tipo_desciminacion,reference,link
"Una noticia publicada en el semanario digital Alba, del grupo Intereconomía Comunicación, titulada “¿Qué pasa realmente en Badalona?”, relacionada con las declaraciones realizadas por el concejal del PP en Badalona, García Albiol, muestra la persistencia de visiones prejuiciosas en los medios. La noticia, supuestamente basada en una investigación sobre los tres barrios más conflictivos de Badalona, resulta ser un conjunto de ideas estereotipadas en las que, sistemáticamente, se relaciona a las personas de etnia gitana o rumanos con hechos delictivos, entre otros. El rigor de la investigación se pone de manifiesto en fragmentos como el siguiente: “Para conocer el modo de vida de esta comunidad, basta con acercarse cualquier día a las ocho de la mañana a la plaza de Antonio Machado, en La Salud, o a la plaza de Camarón de la Isla, en San Roque. Allí se reúnen varios grupos de gitanos rumanos, en su mayoría hombres y mujeres jóvenes, para distribuirse el ‘trabajo’ del día: hurto en tiendas y supermercados, recogida de chatarra y mendicidad. […] El control sobre la productividad lo llevan los patriarcas de los distintos clanes; quien no alcance el tope que le ha sido asignado sufrirá un castigo: el resto de las personas del clan tendrán prohibido hablar con él y los maridos no podrán hacer el amor con sus mujeres.” Términos estereotipados, como patriarca y clan, se emplean a lo largo del texto produciendo una intencionada distancia entre el lector y los protagonistas de la noticia. Además, estadísticas policiales se suman a declaraciones de los vecinos, estableciendo una suerte de pirámide de convivencia en la que los “gitanos rumanos” se encontrarían en el escalón más bajo. Finalmente, a modo de conclusión, las declaraciones de un vecino, unido a la valoración del periodista, legitiman las declaraciones racistas del concejal de Badalona y censuran las críticas recibidas.",,,2010-01-01T00:00:00+01:00,2010-01-01T00:00:00+01:00,Estatal,Medios de comunicación,Sin especificar,,https://informesdiscriminacion.gitanos.org/casos/mayo-estatal-medios-de-comunicaci%C3%B3n-0
"El periódico nacional La Razón publica el artículo de opinión “Rom, gitano rumano”. La autora, en un escrito caótico que intenta abordar la polémica despertada por el panfl eto racista del candidato del PP, García Albiol, en Badalona, comienza considerando los conceptos “racismo” y “xenofobia” como “una estupidez moral”. Asimismo, señala a la Unión Europea como máxima responsable de los “movimientos de población espeluznantes” provenientes de la Europa del Este. A continuación, en un mal intento por realizar un discurso coherente y objetivo, considera que “ningún ser humano, por el simple hecho de pertenecer a una comunidad determinada, puede ser juzgado más que por sí mismo, no por los mitos y los tópicos que se le presuponen a su grupo. Decir que todos los gitanos rumanos son delincuentes es un torpe atrevimiento, además de una falacia. Pero sí parece cierto que muchos de ellos sobreviven gracias al hurto y la mendicidad, que ya son algo «cultural» en sus comunidades, un código moral y una forma de vida digna y decente a sus ojos. Nadie los quiere, ni siquiera sus compatriotas. Ni sus gobernantes”. Sin duda las consideraciones incoherentes y prejuiciosas de esta persona son cuanto menos llamativas, puesto que afirmar, tras prevenir contra las generalizaciones, que el hurto y la mendicidad es algo “cultural” de la comunidad gitana, supone una vuelta de tuerca entre las fundamentaciones racistas que generalmente se usan. Sin embargo, para esta persona, que evidencia el desconocimiento de los valores que componen la cultura gitana, la insensatez reside en los que intentamos luchar contra la discriminación y por la igualdad de trato de todos los seres humanos que conlleva a una “insensata tiranía de la corrección política”.",,,2010-01-01T00:00:00+01:00,2010-01-01T00:00:00+01:00,Estatal,Medios de comunicación,Sin especificar,,https://informesdiscriminacion.gitanos.org/casos/mayo-estatal-medios-de-comunicaci%C3%B3n
"Una página de Internet de ideología nacionalsocialista, www.milucha.org, recoge en su foro el tema Europa contra los gitanos. El foro se abre con una noticia sobre un video electoral lanzado por el Partido Nacional de la República Checa, y emitido en la televisión nacional del país durante la campaña para el Europarlamento en 2009, donde el partido político de ultraderecha propone una “solución final” contra la comunidad gitana. El foro recoge refl exiones sobre la comunidad gitana en Europa, considerada por estas personas anónimas como un peligro para Europa, debido al aumento de su población que, afirman, irá creando más tensiones interraciales en el continente. Este tipo de contenidos constituyen una clara apología del odio y la xenofobia.",,,2010-01-01T00:00:00+01:00,2010-01-01T00:00:00+01:00,Estatal,Redes sociales,Sin especificar,,https://informesdiscriminacion.gitanos.org/casos/mayo-estatal-internet
"En el periódico digital Expansión, una periodista económica analiza en su blog el papel de los políticos españoles ante la crisis y su predisposición al pacto. En la refl exión desacreditando la imagen de éstos, realiza comparaciones con la comunidad gitana. De este modo, el Congreso de los Diputados sería como el Café de Chinitas (local de fl amenco en Madrid) para la redactora que, además, hace referencia a la chulería de los políticos que “les dicen a sus ‘hermanos’ […]: “Soy más valiente que tú, más torero y más gitano...”. Esta recurrencia a estereotipos y comparaciones absurdas supone un empobrecimiento de la actividad periodística que, en ocasiones, parece alejarse de los valores, principios deontológicos de esta profesión y de los derechos constitucionales establecidos, como son la igualdad de trato y no discriminación.",,,2010-01-01T00:00:00+01:00,2010-01-01T00:00:00+01:00,Estatal,Medios de comunicación,Sin especificar,,https://informesdiscriminacion.gitanos.org/casos/abril-estatal-medios-de-comunicaci%C3%B3n-1
"Un programa matutino del canal de televisión Cuatro, trata la problemática del aumento de la población reclusa inmigrante, con numerosas alusiones negativas a la población gitana extranjera. Durante el debate entre distintos colaboradores, se insiste en la idea de que los problemas de España e Italia con la población gitana rumana tienen que ver con la rápida inserción de Rumania en la UE. Además, durante la emisión en directo, se reciben llamadas de espectadores que, de nuevo, aprovechan la oportunidad para formular comentarios como que es la comunidad gitana proveniente de Europa del Este la que tiene que adaptarse a nosotros, o subrayando la falta de higiene de estas personas, entre otros. A pesar de que en un cierto momento del programa se puntualiza que es necesario evitar generalizaciones, y que no se habla de colectivos sino de actuaciones de personas puntuales, el debate no abandona en ningún momento el tono discriminatorio, prejuicioso y estereotipado.",,,2010-01-01T00:00:00+01:00,2010-01-01T00:00:00+01:00,Estatal,Medios de comunicación,Sin especificar,,https://informesdiscriminacion.gitanos.org/casos/abril-estatal-medios-de-comunicaci%C3%B3n-0
"El uso despectivo del término “gitano” es algo frecuente, tanto a nivel nacional como internacional, a pesar de los esfuerzos que se realizan por revitalizarlo, fuera de toda connotación negativa o desfavorable. Sin embargo, este caso demuestra que dicha utilización peyorativa es común incluso en sectores insospechados. Efectivamente, un artículo del diario ABC explica como un nuevo acrónimo despectivo ha calado en los mercados financieros internacionales, GIPSY, usado para referirse a Grecia, Irlanda, Portugal, España e Italia (en sus nombres en inglés, excepto “Italy”, por su “y” final en inglés), las economías que ahora despiertan dudas sobre el futuro de la Unión Europea. En los años ochenta, para referirse a estos países (excepto Italia) acuñaron el término PIGS (cerdos) y la iniciativa tuvo un gran éxito mediático. Sin embargo los “cerdos” están siendo en la actualidad sustituidos por el club de los “gitanos” para citar a países que están bajo la presión financiera del mercado con altos niveles de deuda, todo un ejemplo de falta de sensibilidad por parte de estos supuestos expertos y profesionales.",,,2010-01-01T00:00:00+01:00,2010-01-01T00:00:00+01:00,Estatal,Medios de comunicación,Sin especificar,,https://informesdiscriminacion.gitanos.org/casos/abril-estatal-medios-de-comunicaci%C3%B3n
"Las ediciones digitales de los periódicos ofrecen la posibilidad a los lectores de añadir sus comentarios a las noticias publicadas. Este nuevo servicio, que posibilita la interactuación de la ciudadanía, puede ser, sin embargo, peligroso en ciertas ocasiones, puesto que permite la publicación de los mismos sin ningún control de los contenidos. De esta manera, puede llegar a convertirse en un instrumento óptimo para la difusión de mensajes racistas y discriminatorios. Como ejemplo de estas acciones, tenemos los comentarios surgidos en la edición digital del periódico ABC, a raíz de una noticia sobre la exclusión de los gitanos andaluces (Un 30% de gitanos andaluces sufre exclusión), comunidad autónoma con mayor número de personas de esta etnia. Al pie de esta noticia surgen comentarios donde se deja clara constancia de lo que puede ser la opinión negativa y generalizada que la sociedad española tiene respecto a las personas de etnia gitana: “Autoexclusión diría yo... y no me extraña, hasta ahora no les ha ido tan mal, viviendo del cuento y poniendo el cazo que llenamos todos los trabajadores españoles”, “Les han preguntado a ellos si quieren integrarse?”, “Llevan más d 500 años en España q les hacen creer q este dinero los va a hacer cambiar d golpe, Enteraros¡¡¡ q a todos nos gusta vivir sin currar y tener, casa, cole etc. pagados, Y si quieren integrar q también hagan pisos para ellos en barrios residenciales al lado d estos políticos tan concienciados”. Vemos, de este modo, la compleja situación existente en nuestro país, en la que impera la asociación entre comunidad gitana y exclusión social, sin discernir que son realidades diferentes y que la comunidad gitana es plural. Por ello es necesario desarrollar acciones de sensibilización para la sociedad en general.",,,2010-01-01T00:00:00+01:00,2010-01-01T00:00:00+01:00,Estatal,Redes sociales,Sin especificar,,https://informesdiscriminacion.gitanos.org/casos/abril-estatal-internet-0
"Un blog del diario digital Que!, País de gitanos. España una grande y limpia, recogía contenidos fuertemente racistas y discriminatorios, incitando al odio y la violencia, lo que acabó por convertir el foro en un enfrentamiento abierto entre payos y gitanos. Entre otros fragmentos, pudimos leer: “Bueno, ya veo que la polémica está servida, yo quisiera aportar algunos datos para que nos hagamos una idea de lo bien que nos iría en este país sin esta “banda” de palurdos neardentales. Mierda de gitanos malnacidos, bastardos que no sabéis ni hablar como una persona, solo balbuceáis vuestra mierda ininteligible. SIEG HAIL!!!”. En la actualidad no es posible acceder a esta zona de la Web, lo que puede significar una toma de conciencia por parte del medio de lo que supuso este espacio, donde el autor anónimo conserva siempre la libertad de dejar publicado lo que crea pertinente.",,,2010-01-01T00:00:00+01:00,2010-01-01T00:00:00+01:00,Estatal,Redes sociales,Sin especificar,,https://informesdiscriminacion.gitanos.org/casos/abril-estatal-internet
"Se constata el auge de Internet y sus redes sociales como instrumento difusor de ideas prejuiciosas y estereotipadas. Nuevamente encontramos en Facebook la creación de varios grupos de interés que recogen ideas y opiniones, tenaces y desfavorables, acerca de algo que parece conocerse mal, en este caso las personas pertenecientes a la etnia gitana. De este modo, detectamos el grupo Yo también creo que Marc Lenders era GITANO, con 1.630 fans y comentarios como el siguiente: “La verdad ke las greñas y el tono de tez no dejan mucho lugar a dudas.... lo ke pasa eske lleva el cuello cerrao de la camiseta, pero fijo ke lleva un cordonaco de oro de dos deos de gordo debajo”. Asimismo, el grupo Jamás he visto un gitano con gafas, con 5.291 seguidores, recoge un debate entre detractores y partidarios del mismo: “Señores payos, vosotros tan cultos y letrados. Os he dejado en el “Reviews” de esta página un foro de debate. Espero que alguno de vosotros, tenga al menos el graduado escolar para leerlo y responder con respeto y coherencia. Un gitano”. Por último, y con la misma polémica que el anterior, aparece el grupo Eres más sospechoso que un gitano haciendo footing, donde los seguidores, 11.324 personas, responden a las opiniones contrarias con argumentos como el siguiente: “Hay q ser políticamente correcto, no reírte de nada y ser un amargado jajajajajajajajaja me da a mi que tiene muxo tiempo libre estos que nos llaman racistas, necesitan all bran…”. Refl ejos, todos ellos, de la tensa discusión y la desinformación existente en nuestra sociedad en materia de igualdad de trato y no discriminación.",,,2010-01-01T00:00:00+01:00,2010-01-01T00:00:00+01:00,Estatal,Redes sociales,Sin especificar,,https://informesdiscriminacion.gitanos.org/casos/marzo-estatal-internet
"En la revista Magazine, del periódico de ámbito nacional El Mundo, se publica el artículo “Una actitud que cuesta caro. Políticamente incorrectos al ataque” que trata sobre la censura de lo políticamente incorrecto en nuestra democracia. Para ello se entrevista a toda una serie de personajes de actualidad de la sociedad española que abordan tales cuestiones. En el reportaje encontramos la siguiente acotación: “Diga usted en público que le encanta rezar, que su sueño es ser ama de casa y madre de familia numerosa, que tiene dudas sobre el cambio climático, que los americanos son un pueblo indiscutiblemente superior o que desconfía de los gitanos. En ese momento, se habrá convertido en una persona políticamente incorrecta, pecado capital que en nuestra sociedad se paga con el ostracismo o el apaleamiento verbal”. De este modo se hace una defensa del derecho a tener estereotipos y prejuicios hacia la comunidad gitana, entre otros, afirmando además en el artículo que quienes critican esas actuaciones, ideas o mal uso de los términos, no son más que censuradores e intransigentes.",,,2010-01-01T00:00:00+01:00,2010-01-01T00:00:00+01:00,Estatal,Medios de comunicación,Sin especificar,,https://informesdiscriminacion.gitanos.org/casos/marzo-estatal-medios-de-comunicaci%C3%B3n
"La cadena estatal de televisión Cuatro, emite el programa Callejeros cuyos contenidos suelen versar sobre barrios marginales de España. Se trata de zonas en riesgo de exclusión donde conviven, entre otras, personas de etnia gitana. Este tipo de programas, fijándose normalmente en los casos más llamativos de exclusión y marginalidad, contribuyen a crear una falsa imagen de la realidad social en dichos núcleos, dado que en los mismos viven ciudadanos que no se corresponden con los estereotipos negativos plasmados, sino que, muy al contrario, son familias honradas, que viven en situación de pobreza y que se han incorporado a programas de actuación para mejorar sus condiciones de vida. En particular, la cuestión de la imagen social de la comunidad gitana tiene una especial relevancia ya que el mantenimiento de determinados prejuicios y estereotipos negativos en la opinión pública, genera graves consecuencias en su acceso a los derechos ciudadanos más básicos y perpetúa su rechazo social, además de no ser una imagen que se corresponde con la realidad heterogénea de la misma.",,,2010-01-01T00:00:00+01:00,2010-01-01T00:00:00+01:00,Estatal,Medios de comunicación,Sin especificar,,https://informesdiscriminacion.gitanos.org/casos/febrero-estatal-medios-de-comunicaci%C3%B3n-0
"La cadena estatal de televisión Cuatro, emite el programa Callejeros cuyos contenidos suelen versar sobre barrios marginales de España. Se trata de zonas en riesgo de exclusión donde conviven, entre otras, personas de etnia gitana. Este tipo de programas, fijándose normalmente en los casos más llamativos de exclusión y marginalidad, contribuyen a crear una falsa imagen de la realidad social en dichos núcleos, dado que en los mismos viven ciudadanos que no se corresponden con los estereotipos negativos plasmados, sino que, muy al contrario, son familias honradas, que viven en situación de pobreza y que se han incorporado a programas de actuación para mejorar sus condiciones de vida. En particular, la cuestión de la imagen social de la comunidad gitana tiene una especial relevancia ya que el mantenimiento de determinados prejuicios y estereotipos negativos en la opinión pública, genera graves consecuencias en su acceso a los derechos ciudadanos más básicos y perpetúa su rechazo social, además de no ser una imagen que se corresponde con la realidad heterogénea de la misma.",,,2010-01-01T00:00:00+01:00,2010-01-01T00:00:00+01:00,Estatal,Medios de comunicación,Sin especificar,,https://informesdiscriminacion.gitanos.org/casos/febrero-estatal-medios-de-comunicaci%C3%B3n
"En la edición digital del Diario de Sevilla aparece un artículo de opinión, “Emigrantes y vagabundos”, donde el periodista afirma que en la California de 1936 “los emigrantes que huían de la sequía no encontraban ni escuelas ni hospitales y tenían que vivir como gitanos”. Otra desafortunada comparación que evidencia la gran interiorización de la idea negativa, aceptada comúnmente por la sociedad con carácter inmutable, sobre la comunidad gitana.",,,2010-01-01T00:00:00+01:00,2010-01-01T00:00:00+01:00,Estatal,Medios de comunicación,Sin especificar,,https://informesdiscriminacion.gitanos.org/casos/enero-estatal-medios-de-comunicaci%C3%B3n-0
"En la cadena nacional de televisión Antena 3, se emite un programa, “Pánico en el plató”, en horario de máxima audiencia. En dicha emisión se muestra la imagen de un anciano de etnia gitana, la cuál se utiliza para realizar una parodia prejuiciosa y discriminatoria contra la comunidad gitana. El humorista en cuestión dice sobre el anciano “es mi tío Calisto que lo conozco de estar preso por vender CDs falsos en el top manta”. La imagen publicada sin consentimiento del anciano, que además goza de un gran respeto y reputación entre los miembros de su comunidad, supone un atentando no solo contra su dignidad e intimidad, sino contra la de toda la comunidad gitana al producirse la difusión de una serie de estereotipos y prejuicios negativos. Desde el Área de Igualdad de Trato de la FSG, se remite una carta tanto a los responsables del programa como a la productora.",,,2010-01-01T00:00:00+01:00,2010-01-01T00:00:00+01:00,Estatal,Medios de comunicación,Sin especificar,,https://informesdiscriminacion.gitanos.org/casos/enero-estatal-medios-de-comunicaci%C3%B3n
"El portal de Internet El Mundo Today, servicio ofrecido con carácter de entretenimiento, cuyos contenidos e información son ficticios, publica una noticia bajo el titular “El gobierno abrirá cuentas de correo “gimail” para poblados gitanos. Las chabolas españolas tendrán Internet”. Esta seudo noticia, anunciando un plan del Ministerio de Ciencia y Tecnología para facilitar conexiones a Internet en zonas deprimidas, asocia a la comunidad gitana con toda una serie de conductas delictivas, entre otras: “La propuesta […] facilitará conexiones a Internet sin cables para evitar que los habitantes de las chabolas los corten para revenderlos”, “Con la idea de motivar a los usuarios, se les ha asegurado que están robando la conexión Wi-Fi del vecino”. Asimismo, se incluyen estereotipos negativos, prejuicios e injurias que dañan gravemente la dignidad e imagen de la comunidad gitana.",,,2010-01-01T00:00:00+01:00,2010-01-01T00:00:00+01:00,Estatal,Redes sociales,Sin especificar,,https://informesdiscriminacion.gitanos.org/casos/enero-estatal-internet-0
"En ocasiones en Facebook, red social virtual, se pueden encontrar páginas con contenidos en contra de la comunidad gitana que incitan al odio y la violencia. Entre otras cosas, esta red permite a sus usuarios crear grupos en torno a intereses compartidos. En este caso concreto, se localizó un grupo llamado Yo también odio a los gitanos, con casi cien seguidores. Gracias a la acción de usuarios particulares denunciando los hechos, Facebook retiró la página del mencionado grupo. Sin embargo, este tipo de contenidos siguen muy presentes en las distintas redes sociales y su detección y eliminación suele resultar complejo. La acción ciudadana particular, como en el presente caso, es un elemento clave en la lucha contra el racismo y la discriminación en la red.",,,2010-01-01T00:00:00+01:00,2010-01-01T00:00:00+01:00,Estatal,Redes sociales,Sin especificar,,https://informesdiscriminacion.gitanos.org/casos/enero-estatal-internet
"Al fi nalizar la jornada escolar, en la puerta de un colegio de la localidad, una madre llama a su hija diciéndole su nombre y primer apellido para que le prestara atención. Otra madre que estaba en la puerta del colegio lo oyó y dijo: “¡Uy, Vargas! Ese apellido es de gitanos”, a lo que la niña respondió “es que soy gitana”. La otra madre entonces le dijo: “pues no digas eso que no se te nota que eres gitana” a lo que la propia madre de la niña le contestó que no tenía por qué ocultarlo ya que su padre es gitano y la niña está orgullosa de ser gitana. No es algo para ocultar.",,,2009-01-01T00:00:00+01:00,2009-01-01T00:00:00+01:00,Huelva,Otros,Sin especificar,,https://informesdiscriminacion.gitanos.org/casos/diciembre-huelva-discriminaci%C3%B3n-por-otros-agentes
"Un matrimonio viene teniendo problemas de convivencia con un vecino. En una ocasión, el vecino dio un empujón a la hija pequeña del matrimonio y a su novio, el resto de vecinos que presenciaron la situación le dijeron que si no le daba vergüenza pegarle a una mujer, a lo que el vecino respondió: “voy a pegar cuatro tiros y voy a matar a los gitanos. De la cárcel se sale pero del cementerio no.” Vino la policía y le retuvieron en comisaría para tomarle declaración. El juicio está pendiente de celebración. Por otro lado, este señor ha tomado como hábito el presentarse en el lugar de trabajo de la hija mayor de la familia, que trabaja como cajera en un centro comercial, y cuando pasa por la caja simula llamadas de teléfono diciendo cosas como “estos asquerosos gitanos”.",,,2009-01-01T00:00:00+01:00,2009-01-01T00:00:00+01:00,Cádiz,Otros,Sin especificar,,https://informesdiscriminacion.gitanos.org/casos/noviembre-jerez-actos-racistas-0
"Una mujer de la localidad, trabajadora de la FSG, recibe una llamada de una agencia inmobiliaria ya que había estado consultando pisos en alquiler. La compañera le responde que ya no le interesa, que se ha comprado su propio piso, y la persona de la inmobiliaria le empieza a hacer preguntas sobre el piso. En un momento dado le pregunta por su localización y cuando le dice el barrio en el que está situado, la persona de la agencia le dice que muy bien, que entiende que no le haya gustado la que le habían ofrecido ellos porque la zona es conocida como “el barrio de los gitanos”.",,,2009-01-01T00:00:00+01:00,2009-01-01T00:00:00+01:00,Granada,Otros,Sin especificar,,https://informesdiscriminacion.gitanos.org/casos/noviembre-granada-manifestaciones-racistas
"Nos enteramos de este caso a través del sistema de seguimiento de prensa. Según un diario de tirada local, una peña fl amenca fue objeto de vandalismo y amaneció con pintadas, algunas de ellas de carácter racista, en concreto el diario muestra una foto de la fachada donde habían escrito “Gitanos no”.",,,2009-01-01T00:00:00+01:00,2009-01-01T00:00:00+01:00,Cádiz,Otros,Sin especificar,,https://informesdiscriminacion.gitanos.org/casos/noviembre-jerez-actos-racistas
"Entra a la sede territorial de la FSG en la localidad un vecino del inmueble donde el local está situado. Empieza a hablar de los carteles de las campañas de sensibilización “El empleo nos hace iguales”, pero el tema se desvía y el hombre empieza a hacer comentarios del tipo “todos los gitanos son iguales”, “no quieren trabajar”, los niños van descalzos y viven mal porque quieren”, “prefi eren vivir de las ayudas antes que esforzarse por estudiar y conseguir un empleo”, etc. Una de las trabajadoras de la FSG les preguntó que a cuántos gitanos conocían, porque seguro que hablaban por bocas de otros, por cosas que habían escuchado más que por su propia experiencia personal, y que esa imagen de la que hablaban era de personas que viven en la marginalidad, gitanos o no gitanos, pero que en cambio estaba asociando esa imagen a toda la comunidad gitana en general. El hombre se marchó sin más.",,,2009-01-01T00:00:00+01:00,2009-01-01T00:00:00+01:00,Jaén,Otros,Sin especificar,,https://informesdiscriminacion.gitanos.org/casos/octubre-ja%C3%A9n-manifestaciones-racistas
