hechos,intervencion,resultado,fecha_hechos,fecha_denuncia,provincia,ambito,tipo_desciminacion,reference,link
"La bolsa de ayuda a la vivienda en alquiler en la que se encuentra inscrita una mujer gitana, la cita para mantener una entrevista con uno de los propietarios de los inmuebles. De manera informal, se le comunica previamente que la futura inquilina es gitana, ante lo que se muestra reticente afirmando que teme “que se meta mucha gente en el piso, y tenga problemas con el vecindario”, aunque finalmente acaba aceptando alquilarle la vivienda. Sin embargo, cuando se intenta establecer una cita, el propietario vuelve a negarse diciendo que “no quiere tener problemas en su piso y por eso no lo va a alquilar a gitanos”. A pesar de que los trabajadores de la FSG intentan que reconsidere su decisión, el propietario mantiene su postura.",,,2005-01-01T00:00:00+01:00,2005-01-01T00:00:00+01:00,Pontevedra,Vivienda,Sin especificar,,https://informesdiscriminacion.gitanos.org/casos/vigo-pontevedra-junio-discriminaci%C3%B3n-en-la-vivienda
"La FSG concierta una entrevista de trabajo entre un usuario y el encargado de una hamburguesería de la localidad. La entrevista transcurre con total normalidad hasta que el encargado solicita sus datos personales y se interesa por su lugar de residencia. Cuando el chico le informa de que vive en un barrio que cuenta con un alto porcentaje de población gitana, el encargado de la selección le dice que lo siente, pero que el puesto ya está ocupado.",,,2005-01-01T00:00:00+01:00,2005-01-01T00:00:00+01:00,Ciudad Real,Empleo,Sin especificar,,https://informesdiscriminacion.gitanos.org/casos/ciudad-real-junio-discriminaci%C3%B3n-en-el-empleo
"Un matrimonio gitano acude a una inmobiliaria para entregar la reserva de una vivienda en alquiler, tal y como habían pactado previamente por teléfono. En la inmobiliaria les informan de la urgencia del propietario, que desea firmar el contrato cuanto antes, aunque días después, les comunican su decisión de no alquilarles la vivienda. La FSG se reúne con el director de la Inmobiliaria, que reconoce que se trata de un caso de discriminación, y se compromete a retirar dicha vivienda de su agencia, para evitar que vuelva a repetirse una situación similar.",,,2005-01-01T00:00:00+01:00,2005-01-01T00:00:00+01:00,Valencia,Vivienda,Sin especificar,,https://informesdiscriminacion.gitanos.org/casos/valencia-junio-discriminaci%C3%B3n-en-la-vivienda
"El Gobierno Vasco anuncia que va a cerrar un colegio que cuenta con un alumnado exclusivamente gitano, afirmando que posee un nivel curricular muy bajo y una concentración excesiva de población marginal, lo que genera un nivel de conflictividad de difícil manejo. Algunas asociaciones gitanas, a pesar de estar de acuerdo con la medida por tratarse de un “centro gueto” que no favorece la integración, critican las afirmaciones realizadas en el escrito del Gobierno Vasco, así como el procedimiento que va a llevarse a cabo para efectuar dicho cierre, sin suficientes garantías para los afectados.",,,2005-01-01T00:00:00+01:00,2005-01-01T00:00:00+01:00,Bizkaia,Educación,Sin especificar,,https://informesdiscriminacion.gitanos.org/casos/baracaldo-vizcaya-junio-discriminaci%C3%B3n-en-la-educaci%C3%B3n
"Una usuaria de la FSG realiza una demanda urgente de búsqueda de vivienda. Los técnicos de la entidad llevan a cabo contactos, peticiónes de citas y mediación, tanto con particulares como con inmobiliarias. Las respuestas de estos son contradictorias, ya que cuando se solicita cita por teléfono, las viviendas están listas para alquilar, pero al mandar a la usuaria en persona a las entrevistas, siempre alegan sutilmente que ya está alquilada o reconocen que “los dueños no quieren gitanos”. A pesar de los esfuerzos de la FSG, la usuaria sólo consigue acceder a una vivienda cuando modifica su manera de vestir y de expresarse, para no parecer gitana.",,,2005-01-01T00:00:00+01:00,2005-01-01T00:00:00+01:00,Zaragoza,Vivienda,Sin especificar,,https://informesdiscriminacion.gitanos.org/casos/zaragoza-junio-discriminaci%C3%B3n-en-la-vivienda
"Un joven chico gitano realizó una entrevista de trabajo para trabajar en un supermercado. El encargado le comentó que aunque cumplía bien con los requisitos, su jefe no quería gitanos en su empresa.","Tras la entrevista con la víctima y llamada telefónica al encargado averiguamos que esa persona efectivamente ha realizado la entrevista en esas fechas. Se llamó al encargado, quien explicó que ya habían escogido a otra persona, pero negó la discriminación.",La víctima no quiso realizar más acciones.,2018-01-01T00:00:00+01:00,2018-01-01T00:00:00+01:00,Jaén,Empleo,Discriminación directa,,https://informesdiscriminacion.gitanos.org/casos/ja%C3%A9n-empleo-discriminaci%C3%B3n-directa-5
"Una joven gitana trabajaba en una cafetería en un municipio de la provincia de Jaén. Tras varios conflictos con una compañera relacionados con su trabajo, esta le hizo varios comentarios muy ofensivos y racistas refiriéndose al hecho de que fuera gitana: “es gitana y todas las gitanas son guarras”, “las gitanas sois lo peor, dais asco”. La joven acusó de racista a esta persona. El jefe, que fue testigo de esos comentarios, comentó que no podía hacer nada. La compañera le pidió que eligiera entre ella o la víctima y finalmente la víctima terminó dimitiendo de su puesto de trabajo.","En la entrevista con la víctima se le comentaron las posibles opciones y que se le prestaría apoyo en todo momento. Después de pasar unos días para que la víctima decidiera qué quería hacer, comentó que no quería realizar ninguna acción por miedo a represalias laborales y personales.",Negativos. La víctima tuvo miedo a represalias.,2018-01-01T00:00:00+01:00,2018-01-01T00:00:00+01:00,Jaén,Empleo,Discriminación directa,,https://informesdiscriminacion.gitanos.org/casos/ja%C3%A9n-empleo-discriminaci%C3%B3n-directa-4
"En el marco de un programa de empleo, las técnicas del mismo se estaban preparando con los y las participantes para desarrollar las prácticas de limpieza de grandes superficies y mobiliario de edificios y locales. El día de antes de que se iniciaran, una de las técnicas comentó con la limpiadora del local con quien se realizan las prácticas, que el próximo lunes, tendría con ella a una de las participantes del programa, desarrollando prácticas. A lo que la limpiadora comenta: “Ah, ¿sí?, pero la que empieza, ¿es gitana o es normal?”","Desde la FSG se comentó con la limpiadora que el comentario que había realizado no era adecuado, ya que se producen generalizaciones que afectan a toda la comunidad gitana. Tras esto, se retractó de sus palabras y pidió disculpas.",Ha sido efectiva.,2018-01-01T00:00:00+01:00,2018-01-01T00:00:00+01:00,Murcia,Empleo,Discriminación directa,,https://informesdiscriminacion.gitanos.org/casos/murcia-empleo-discriminaci%C3%B3n-directa-3
"Una joven, de etnia gitana, decidió presentarse a una entrevista en un restaurante, que una amiga suya, que trabajaba en el restaurante de al lado, le había facilitado. La amiga le presentó a la jefa de cocina, que les atendió de manera muy amable y le dijo que le haría una prueba de dos días para ver qué tal funcionaba. La joven le entregó el curriculum y la jefa de cocina le preguntó: “¿Eres Bustamante?”, la joven respondió, “sí, ¿por qué?”, a lo que la mujer respondió “te conozco de algo, aquí trabajó un chico que tiene los mismos apellidos” y la joven preguntó “quién”, la mujer dijo “no nada, no te preocupes”. El día siguiente la joven recibió un mensaje de la jefa de cocina que decía que no necesitaba gente, que la jefa ya había conseguido a otra chica. La amiga de la joven le preguntó a la jefa de cocina por qué no había hecho la prueba a la joven y ésta respondió: “mi jefa no quiere gitanos, una vez trabajó aquí un gitano con apellido Bustamante y robaba comida” y añadió: “por mí encantada porque la chica no parece gitana, tiene habilidades, se nota que se desenvuelve, pero la jefa no quiere gitanas ni moras porque tuvo mala experiencia, lo siento”.","La joven contó el caso a la técnica de igualdad, que llamó a la amiga para corroborar los hechos. Informamos a la joven de sus derechos y de las posibilidades de actuación.","Aunque la joven supo que era una discriminación en el acceso al empleo por una motivación de su pertenencia a la etnia gitana, no quiso llevar a cabo ninguna actuación por no perjudicar a su amiga.",2018-01-01T00:00:00+01:00,2018-01-01T00:00:00+01:00,Cuenca,Empleo,Discriminación directa,,https://informesdiscriminacion.gitanos.org/casos/cuenca-empleo-discriminaci%C3%B3n-directa-0
"Una joven participante del Programa de Empleo Aprender Trabajando de la FSG de Murcia, finalizó su formación teórica y fue a una tienda de ropa a hacer las prácticas. El encargado le dijo: “Venga atiende a los clientes y saca la gitana que llevas dentro, la gitana de los mercadillos”. Además de este incidente, la joven contó otro comentario de una de las empleadas de la tienda, que le dijo: “Qué curioso, eres gitana y sabes hablar bastante bien”, a lo que la joven respondió: “las personas gitanas no somos analfabetas, claro que sabemos hablar”. La joven llegó a sentirse incómoda en algunas ocasiones.",La técnica de igualdad de la FSG entrevistó a la joven y le informó y asesoró en materia de igualdad de trato y no discriminación.,La joven no quiso llevar a cabo ninguna actuación puesto que su periodo de prácticas estaba próximo a finalizar y no quería perder oportunidades de ser contratada.,2018-01-01T00:00:00+01:00,2018-01-01T00:00:00+01:00,Murcia,Empleo,Discriminación directa,,https://informesdiscriminacion.gitanos.org/casos/murcia-empleo-discriminaci%C3%B3n-directa-2
"Una participante del programa de empleo Acceder acudió a una empresa a realizar sus prácticas como cajera. Al llegar a la empresa, la encargada le preguntó al alumnado quiénes de ellos eran gitanos, para identificarlos y desde ese momento, la actitud que tenía hacia las personas en prácticas de etnia gitana fue poco correcta.","Se informó y asesoró a la mujer de la discriminación que suponía esta identificación y el trato desigual que ejerció la encargada hacía las personas de etnia gitana, y las posibilidades de actuación.",La mujer no quiso llevar a cabo ninguna actuación.,2018-01-01T00:00:00+01:00,2018-01-01T00:00:00+01:00,Huelva,Empleo,Discriminación directa,,https://informesdiscriminacion.gitanos.org/casos/huelva-empleo-discriminaci%C3%B3n-directa-1
"Un trabajador de la FSG le contó a la técnica de igualdad que una amiga suya, de etnia gitana, que trabajaba en un bar, estaba recibiendo insultos por parte de su jefe, algunos de ellos: “eres la vergüenza de tu especie, como te vean trabajando se van a avergonzar de ti” y cuando ella pidió explicaciones por el comentario, el jefe le dijo: “es que los gitanos no trabajan, no hacen nada”. La técnica de igualdad contactó con la joven por teléfono, quien le contó que llevaba dos años trabajando allí, que en el bar había personas de otras nacionalidades y que los jefes les insultaban, no les llamaban por su nombre, sino que les decían: “negro”. En otra ocasión, la joven llevó la cuenta a una mesa, en la que estaba la hermana de uno de los jefes, que le dijo: “anda, que como eres gitana quieres robarle”.","La técnica contactó con otras jóvenes que habían estado trabajando en el bar, para contrastar información, éstas que no eran de etnia gitana no tuvieron ningún problema, pero sí habían escuchado comentarios racistas y homófobos por parte de los jefes. La técnica informó a la joven y le asesoró sobre sus derechos. Asimismo, se ofreció para llevar a cabo una interlocución con sus jefes.","La joven, que había decidido dejar el trabajo, no quiso llevar a cabo ninguna actuación por temor a represalias y a que no la volvieran a contratar en otros bares.",2018-01-01T00:00:00+01:00,2018-01-01T00:00:00+01:00,Jaén,Empleo,Discriminación directa,,https://informesdiscriminacion.gitanos.org/casos/ja%C3%A9n-empleo-discriminaci%C3%B3n-directa-3
"Una participante del Programa de Empleo Acceder quiso presentarse a una oferta de empleo en un centro de estética y entró en el centro para dejar su curriculum. La responsable del centro le dijo que encajaba perfectamente en el puesto, que fuera a la oficina y hablara con su marido, para hacerle directamente el contrato. Cuando llegó, le dijo al marido lo que había dicho su mujer y éste empezó a preguntarle de dónde era y de qué zona y finalmente le preguntó: ¿eres gitana? y ella respondió que sí. Entonces el marido dijo que él no podía contratar a una gitana porque las clientes y él no se fiarían de dejar allí los bolsos y añadió: “¿Cómo voy a contratar a alguien del Cerro?, si los gitanos se dedican todos a lo mismo y el que no te la da a la entrada, te la da a la salida”.",La técnica le asesoró sobre sus derechos y le informó de las actuaciones que se podían llevar.,La joven no quiso seguir adelante con la actuación por la vergüenza que la situación le provocaba.,2018-01-01T00:00:00+01:00,2018-01-01T00:00:00+01:00,Jaén,Empleo,Discriminación directa,,https://informesdiscriminacion.gitanos.org/casos/ja%C3%A9n-empleo-discriminaci%C3%B3n-directa-2
"Una joven vio una oferta de empleo en el escaparate de una tienda de ropa, que indicaba que podían dejar el curriculum dentro de la tienda. La joven entró, junto a un amigo a dejar el curriculum. La dependienta de la tienda le dijo “no lo dejes porque la jefa no quiere gitanos porque le han robado muchas veces” y añadió “si quieres puedes dejarlo pero lo va a romper”. La joven se marchó sin dejar su CV y no dijo nada.","La técnica de igualdad entrevistó a la joven y le asesoró e informó de las posibles actuaciones. Igualmente, la técnica de igualdad se dirigió a la tienda para saber si la oferta continuaba y podían realizar un testing. El anunció ya no se encontraba en el escaparate de la tienda ni aceptaban más currículos.",La joven no quiso llevar a cabo ninguna otra actuación.,2018-01-01T00:00:00+01:00,2018-01-01T00:00:00+01:00,Cáceres,Empleo,Orden de discriminar,,https://informesdiscriminacion.gitanos.org/casos/c%C3%A1ceres-empleo-orden-de-discriminar
"Un participante de la FSG estaba realizando un curso de camarero en un restaurante cuando el encargado, le hizo el siguiente comentario: “los gitanos no saben hablar ni expresarse para estar cara al público”. El joven trasladó el hecho a la técnica de igualdad de la FSG.",La técnica de igualdad trasladó al jefe del encargado del restaurante este hecho y la preocupación por este tipo de comentarios.,Positivo. El jefe habló con el encargado y éste se disculpó con el joven participante. Le aseguró que no volvería a repetirse.,2018-01-01T00:00:00+01:00,2018-01-01T00:00:00+01:00,Jaén,Empleo,Discriminación directa,,https://informesdiscriminacion.gitanos.org/casos/ja%C3%A9n-empleo-discriminaci%C3%B3n-directa-1
"Una mujer contactó con la FSG para explicar que tenía problemas en su trabajo, que su responsable la quería despedir alegando como motivo ausencias en el trabajo. Ella contó en la FSG que sólo había faltado en dos ocasiones, y justificadas, una de ellas era por asistencia a un examen. Sin embargo, la encargada no quería entender las explicaciones, la había tomado con ella, y que lo único que quería era que la echaran a la calle y así se lo trasladó. Ella estaba convencida que esto era por ser una mujer de etnia gitana, puesto que no había ningún motivo objetivo para tratarla de esa forma, con menosprecio y como si tuviera algo personal contra ella. Desde su incorporación al trabajo, el trato con ella fue desigual a sus compañeros y compañeras, no la incluyó en el grupo de WhatsApp donde se mencionaban las incidencias y otros asuntos laborales y la trataba con absoluta indiferencia.","Desde la FSG se comprobó la documentación y la Resolución de la administración y comprobamos que era un despido disciplinario. Sin embargo, consideramos que la actitud de la responsable con la mujer sí tenía que ver con una motivación discriminatoria. Le apoyamos a presentar unas alegaciones contra la Resolución.",Negativo. La Resolución administrativa fue negativa y no contemplaron las alegaciones presentadas.,2018-01-01T00:00:00+01:00,2018-01-01T00:00:00+01:00,Badajoz,Empleo,Discriminación directa,,https://informesdiscriminacion.gitanos.org/casos/badajoz-empleo-discriminaci%C3%B3n-directa
"Una mujer de etnia gitana que estaba trabajando como camarera de pisos sufrió un incidente discriminatorio. El último día de contrato, cuando estaba preparando el carro con los utensilios necesarios para desarrollar su trabajo, la gobernanta sacó el carro al pasillo exterior del hotel y gritando le dijo a la mujer: “Así no se puede sacar el carro, que parece un carro de gitanos”. La mujer se lo contó a la prospectora del Programa de Empleo Acceder de la FSG.",La prospectora de la FSG se reunió con el equipo directivo del hotel para informar del incidente y hablar con la gobernanta de lo ocurrido.,"Positivo. La gobernanta dijo que lo que había dicho fue sin mala intención y pidió disculpas en la reunión. Asimismo, se comprometió a pedir disculpas a la víctima.",2018-01-01T00:00:00+01:00,2018-01-01T00:00:00+01:00,Granada,Empleo,Discriminación directa,,https://informesdiscriminacion.gitanos.org/casos/granada-empleo-discriminaci%C3%B3n-directa
"El equipo de empleo de la FSG gestionó la puesta en marcha de una formación de lavado de coches con una empresa, con una propuesta de contratación en prácticas con uno de los principales clientes de la empresa en tres ciudades en las cuales esta empresa tenía oficina. Se contactó y se acordó llevar a cabo este acuerdo con una primera formación y una posterior contratación en prácticas. En el momento en que la empresa cliente se enteró que las personas en prácticas eran participantes de la FSG descartó inmediatamente las prácticas alegando que había tenido experiencias previas negativas con personas gitanas.",Desde el equipo de la FSG de Asturias se habló con la empresa interlocutora y se valoró conjuntamente la posibilidad de que desde la FSG se emprendiera alguna acción contra la empresa que se negó a aceptar alumnado en prácticas.,"Se llegó a la conclusión que por el momento era mejor no emprender ninguna acción que comprometiera a la empresa interlocutora, con la cual teníamos otros Convenios de colaboración firmados. Desde la FSG estaremos pendientes en el futuro de las actuaciones de esta empresa.",2018-01-01T00:00:00+01:00,2018-01-01T00:00:00+01:00,Asturias,Empleo,Discriminación directa,,https://informesdiscriminacion.gitanos.org/casos/asturias-empleo-discriminaci%C3%B3n-directa-0
"Un joven de etnia gitana que estaba en prácticas del Programa de empleo de la FSG Acceder, en un supermercado, un día escuchó que una trabajadora le dijo a otra “mira cómo se ríen las gitanas”, señalando a sus compañeras de trabajo. El joven se acercó a las mujeres y les dijo que eso no eran formas de hablar y que tuvieran respeto hacía sus compañeras.","El joven contactó con la responsable del Programa de empleo de la FSG para comentarle el incidente. Además, otra participante del Programa comentó también que había sentido actitudes racistas por parte de algunos trabajadores del supermercado. Desde la FSG se habló con los encargados de la empresa, comentando lo sucedido y solicitando que se tomaran medidas para que no volvieran a suceder hechos parecidos. Además, se mantuvo contacto semanal para ver cómo se desarrollaban las prácticas y si había ocurrido algún otro incidente.","La trabajadora del supermercado que había hecho el comentario pidió disculpas. Asimismo, hasta el final de las prácticas no se registró ningún otro comentario ni actitud discriminatoria hacia el alumnado en prácticas de la FSG.",2018-01-01T00:00:00+01:00,2018-01-01T00:00:00+01:00,Cuenca,Empleo,Discriminación directa,,https://informesdiscriminacion.gitanos.org/casos/cuenca-empleo-discriminaci%C3%B3n-directa
"La prospectora laboral de la FSG vio publicada en la web del Servicio Público de Empleo del Principado de Asturias (SEPEPA) una oferta de empleo en jardinería. La prospectora envió el curriculum de un participante del programa Acceder de la FSG, que cumplía los requisitos para el puesto. Después contactó por teléfono con la empresa de jardinería. El hombre que atendió la llamada de la prospectora comenzó a leer el currículum del candidato, mientras la prospectora le contaba la trayectoria formativa y profesional del joven y las buenas referencias que éste había obtenido. El hombre preguntó directamente si este joven era de etnia gitana, la prospectora respondió que sí y el hombre dijo que entonces estaba descartado porque “los clientes que tengo no quieren trabajadores de esta etnia, debido a una mala experiencia en el pasado, tampoco contrataría a inmigrantes por esa misma razón, porque mis clientes no quieren”. El hombre añadió que él no era racista, que era un requisito imprescindible que tenía que cumplir y que sus clientes demandaban.","La prospectora de la FSG explicó al hombre el buen funcionamiento de los Programas de Empleo y trató de sensibilizarle en la importancia del acceso al empleo en igualdad de condiciones y trasladó el caso a la técnica de igualdad, al tratarse de un caso claro de discriminación en el acceso al empleo. Se contactó con el joven que no había sido admitido para trasladarle la información de los hechos, y valorar con él la actuación que se podía plantear. El joven quiso que lleváramos a cabo alguna actuación desde la FSG, pero no quiso saber nada de esa empresa. Se llevaron a cabo las siguientes actuaciones: • La técnica de igualdad contactó con la Inspección laboral, para ver cuál era el procedimiento a seguir y presentar el caso. • Se envió una carta de queja al responsable de la empresa, vía email y también por correo ordinario con acuse de recibo. • Se mandó escrito de queja al SEPEPA, organismo de servicio público, en el cual se había publicado la oferta.","Negativo. El hombre pidió disculpas, diciendo que no es que él no quiera contratar, sino que no podía por su clientela. El SEPEPA, vía telefónica, respondió que no podían hacer nada, que actuáramos a través de la Inspección de trabajo. La Inspección laboral nos comunicó que no había visto vulneración de derechos de los trabajadores a no ser discriminados para el empleo o en el acceso al empleo.",2018-01-01T00:00:00+01:00,2018-01-01T00:00:00+01:00,Asturias,Empleo,Discriminación directa,,https://informesdiscriminacion.gitanos.org/casos/asturias-empleo-discriminaci%C3%B3n-directa
"Una mujer de etnia gitana acudió a la FSG y contó que se sentía víctima de discriminación por parte de la administración pública, que no le otorgaba una licencia para poner su quiosco en la vía pública. También contó que sentía racismo por parte de los propietarios de otros quioscos, que le negaban la palabra, le hablaban a ella y a su familia con desprecio y en una ocasión le llenaron de excrementos la puerta de su quiosco mientras estaba cerrado. Ella está convencida de que el trato que le dan es por ser una familia de etnia gitana, ya que es un trato desigual y de menosprecio por el resto de los propietarios de quioscos y son la única familia gitana.","Comprobamos toda la documentación relativa a la denegación de licencias y el motivo fue objetivo. No vimos ningún indicio de discriminación por parte de la administración. Sin embargo, sí que quedaría constancia del trato discriminatorio por parte de sus compañeros de quiosco. Informamos a la mujer de la solicitud de licencia y de los requisitos. Asimismo, le informamos y asesoramos de sus derechos dándole argumentos para combatir el menosprecio y la humillación por parte de los otros quiosqueros. Le ofrecimos mediación para llevar a cabo alguna actuación.","La mujer recurrió a los servicios de un abogado para demandar a la administración. En relación a los otros quiosqueros, no quiso que lleváramos ninguna actuación.",2018-01-01T00:00:00+01:00,2018-01-01T00:00:00+01:00,Córdoba,Empleo,Discriminación directa,,https://informesdiscriminacion.gitanos.org/casos/c%C3%B3rdoba-empleo-discriminaci%C3%B3n-directa
