hechos,intervencion,resultado,fecha_hechos,fecha_denuncia,provincia,ambito,tipo_desciminacion,reference,link
El Diario de Aragón publicó dos noticias sobre una agresión a una mujer en la que los presuntos agresores eran de etnia gitana. En una noticia se hizo una referencia a la etnia gitana como un grupo agresivo y peligroso.,"Desde el Departamento de Igualdad se envió un correo de queja al medio haciendo hincapié en que la mención de la etnia en este tipo de sucesos no aportaba nada a la noticia y sí en cambio incidía en la imagen negativa y violenta de la comunidad gitana. Tras la investigación de los hechos finalmente pudimos llegar a la conclusión de que realmente no sabían con certeza la pertenencia étnica de los presuntos agresores y que sin embargo, así lo destacaron.",Negativo. El medio no contestó ni se eliminó la mención a la etnia.,2018-01-01T00:00:00+01:00,2018-01-01T00:00:00+01:00,Huesca,Medios de comunicación,Discriminación directa,['http://www.diariodelaltoaragon.es/NoticiasDetalle.aspx?Id=1123620'],https://informesdiscriminacion.gitanos.org/casos/huesca-medios-de-comunicaci%C3%B3n-discriminaci%C3%B3n-directa
"El 14 de mayo de 2018, el periódico Última Hora de Palma de Mallorca, publica una noticia con indicios discriminatorios, haciendo referencia a la peligrosidad de “los okupas del clan los Extremeños” y mencionando la etnia gitana de sus componentes. Algunos de los comentarios racistas son: “familias gitanas muy agresivas”, “trabajo ilegal de familias gitanas”, “están ocasionando tensión y enfrentamientos”, “son muy violentos”, “nos quisieron agredir”, “problemas de robos”, “insultos y amenazas…”, “no saben comportarse”, “los gitanos han llenado las furgonetas de piedras”.",Enviamos carta formal de queja dirigida a la dirección del periódico con el fin de hacer saber nuestro malestar y solicitando la rectificación de la noticia con la eliminación del dato étnico. Es la primera vez que escribimos al periódico por lo que no tomaremos otras medidas.,"Positivo. No hubo respuesta del periódico a la carta, pero se eliminó la noticia.",2018-01-01T00:00:00+01:00,2018-01-01T00:00:00+01:00,Baleares,Medios de comunicación,Discriminación directa,['https://www.ultimahora.es/sucesos/ultimas/2018/05/14/1000131/alarma-son-guells-ante-amenazas-okupas-del-clan-extremenos.html'],https://informesdiscriminacion.gitanos.org/casos/palma-de-mallorca-medios-de-comunicaci%C3%B3n-discriminaci%C3%B3n-directa
"El periódico El Ideal Gallego publicó una noticia sobre una zona de A Coruña donde había problemas por tráfico de drogas. La imagen que acompañaba la noticia mostraba una vivienda en ruinas, y se vinculaba a personas de la comunidad gitana con esta situación de conflictividad social: “El ejemplo más claro es el de las viviendas de San José, cuyos propietarios nunca han podido conseguir que el clan gitano que lo habita lo abandone”.",Se envió una carta de queja al medio explicando la mala práctica de la mención a la etnia.,Negativo. No hubo respuesta del medio ni se modificó la noticia.,2018-01-01T00:00:00+01:00,2018-01-01T00:00:00+01:00,A Coruña,Medios de comunicación,Discriminación directa,['https://www.elidealgallego.com/articulo/coruna/gobierno-local-abrira-tramite-derribo-ruinascastrillon/20180426001658371544.html'],https://informesdiscriminacion.gitanos.org/casos/santiago-de-compostela-medios-de-comunicaci%C3%B3n-discriminaci%C3%B3n-directa-3
"El diario de León publicó un suceso relacionado con un hombre que presuntamente había sufrido una paliza por pedir a una familia que vivía en su bloque que bajaran el volumen de la música ya que lo tenían muy alto. El diario hizo mención a la etnia gitana de la familia, dato que no aportaba nada a la noticia y que sin embargo, incidía en la imagen negativa y en la percepción de que todas las personas gitanas son violentas e incívicas. Relacionados con la noticia se publicaron dos comentarios: 
""Siempre las mismas personas intransigentes son gitanas” ”Después se quejan de que somos Racistas...”.
",Desde el Departamento de Igualdad se envió una carta al periódico Diario de León trasladando nuestro malestar por la mención de la etnia gitana en las noticias de sucesos violentos.,"No obtuvimos respuesta del medio ni se eliminó la mención a la etnia. No obstante, sí que se eliminaron los comentarios racistas.",2018-01-01T00:00:00+01:00,2018-01-01T00:00:00+01:00,León,Medios de comunicación,Discriminación directa,['http://www.diariodeleon.es/noticias/provincia/recibe-brutal-paliza-pedirle-sus-vecinos-bajaranmusica_1244125.html'],https://informesdiscriminacion.gitanos.org/casos/le%C3%B3n-medios-de-comunicaci%C3%B3n-discriminaci%C3%B3n-directa
"El periódico ABC de Sevilla publicó una noticia referida al homicidio de una mujer a manos de su pareja, en la que se mencionaba que el agresor y la víctima estaban casados por el rito gitano, lo cual no es necesario ni determinante para el caso que se trata. Lo único que consigue es vincular a la población gitana con la violencia de género y los comportamientos agresivos y machistas, creando y reforzando así prejuicios y estereotipos negativos hacia la misma.","Se remitió un escrito a la dirección del diario en el que se transmitía la indignación y disconformidad con el trato dirigido a la comunidad gitana, resaltando los comentarios que se generan a continuación de la noticia, que deberían ser moderados por el medio. Asimismo, se les invitó a conocer la “Guía para periodistas sobre medios de comunicación y comunidad gitana” disponible en la web de la FSG y a conversar sobre el tema si ellos lo consideraran oportuno.",Negativo. No hubo respuesta del medio ni se modificó la noticia.,2018-01-01T00:00:00+01:00,2018-01-01T00:00:00+01:00,Sevilla,Medios de comunicación,Discriminación directa,['https://sevilla.abc.es/sevilla/sevi-presunto-autor-ultimo-crimen-machista-espana-esconde-sevilla-201803262156_noticia.html'],https://informesdiscriminacion.gitanos.org/casos/sevilla-medios-de-comunicaci%C3%B3n-discriminaci%C3%B3n-directa-0
"Europapress publicó una noticia sobre un apuñalamiento ocurrido en Murcia, donde indicaba en el texto que el presunto autor era de etnia gitana.",Se envió una carta de queja al medio explicando la mala práctica de la mención étnica.,Negativo. No hubo respuesta del medio ni se modificó la noticia.,2018-01-01T00:00:00+01:00,2018-01-01T00:00:00+01:00,Murcia,Medios de comunicación,Discriminación directa,['http://www.europapress.es/murcia/noticia-prision-presunto-autor-material-apunalamiento-mortalhombre-dia-bando-huerta-20180426161924.html'],https://informesdiscriminacion.gitanos.org/casos/murcia-medios-de-comunicaci%C3%B3n-discriminaci%C3%B3n-directa-1
El periódico El Comercio de Gijón publicó una noticia sobre un robo de gasoil. En el texto de la noticia se menciona que los presuntos autores son de etnia gitana.,Se envió una carta de queja al medio explicando la mala práctica de la mención étnica.,Negativo. No hubo respuesta del medio ni se modificó la noticia.,2018-01-01T00:00:00+01:00,2018-01-01T00:00:00+01:00,Asturias,Medios de comunicación,Discriminación directa,['https://www.elcomercio.es/gijon/detenidos-padre-hijo-robar-gasoil-gijon-20180425000638-ntvo.html'],https://informesdiscriminacion.gitanos.org/casos/asturias-medios-de-comunicaci%C3%B3n-discriminaci%C3%B3n-directa-0
"El periódico ABC en su edición de Andalucía publicó una noticia sobre un conflicto vecinal entre familias, donde mencionaba la etnia gitana de los implicados, con una redacción sensacionalista “corrió sangre, ley gitana, clanes rivales, destierro”, llena de estereotipos y de criminalización.",Se envió una carta de queja al medio explicando la mala práctica de la mención étnica.,Negativo. No hubo respuesta del medio ni se modificó la noticia.,2018-01-01T00:00:00+01:00,2018-01-01T00:00:00+01:00,Málaga,Medios de comunicación,Discriminación directa,['https://sevilla.abc.es/andalucia/malaga/sevi-vuelta-clan-desterrado-agita-polvorin-marbella-201804110751_noticia.html'],https://informesdiscriminacion.gitanos.org/casos/m%C3%A1laga-medios-de-comunicaci%C3%B3n-discriminaci%C3%B3n-directa-1
"El periódico La Opinión de Málaga publicó una noticia sobre un tiroteo. En el texto de la noticia especulaba que podía tratarse de un “ajuste de cuenta de clanes gitanos”, una referencia a la etnia que no aporta nada a la noticia.",Se envió una carta de queja al medio explicando la mala práctica de la mención étnica.,Negativo. No hubo respuesta del medio ni se modificó la noticia.,2018-01-01T00:00:00+01:00,2018-01-01T00:00:00+01:00,Málaga,Medios de comunicación,Discriminación directa,['https://www.laopiniondemalaga.es/sucesos/2018/04/06/hombre-critico-recibir-tiro-cabeza/998104.html'],https://informesdiscriminacion.gitanos.org/casos/m%C3%A1laga-medios-de-comunicaci%C3%B3n-discriminaci%C3%B3n-directa-0
"El perfil “Región de Murcia” de la red social Facebook, publicó el 17 de abril un post en el que se recoge la reunión que tuvo lugar esa mañana en El Palacio de San Esteban entre el Jefe del Ejecutivo Regional y el Director territorial de la Fundación Secretariado Gitano, desde su dispositivo de Murcia acompañado de trabajadores y trabajadoras de la sede. En el post se dan detalles de los contenidos de la reunión y se adjuntan dos fotografías del encuentro. El día 17 de abriñ a las 16:07h se registra el siguiente comentario del perfil “Pedro Antonio”: “Vamos no jodas, los vas a poner a trabajar en algo legal?” Tal comentario presenta tintes discriminatorios, ya que ha sido expuesto de forma peyorativa con desprecios hacia la comunidad gitana, que promueve la incitación al odio y ayuda a consolidar los estereotipos que pesan sobre la comunidad gitana.","Se envió mensaje privado desde el perfil “FSG Murcia” al perfil “Región de Murcia” pidiendo ocultar o eliminar este comentario realizado por el perfil “Pedro Antonio” el martes 17 de abril de 2018 a las 16:07 horas. Esperamos su respuesta, Fundación Secretariado Gitano, Murcia.”","Parcialmente positivo. Después de denunciar el comentario a Facebook y de ocultarlo y bloquear al perfil “Pedro Antonio” para impedir que pueda comentar en el perfil de la “FSG Murcia” y de enviar un mensaje al perfil “Región de Murcia” mostrándole nuestro descontento con el comentario publicado, se ha conseguido ocultar el comentario y que no se extienda y se muestre a más personas. No se ha obtenido respuesta del mensaje enviado a “Región de Murcia”.",2018-01-01T00:00:00+01:00,2018-01-01T00:00:00+01:00,Murcia,Redes sociales,Discriminación directa,['https://www.facebook.com/RegiondeMurciaRM/posts/10155756612043802'],https://informesdiscriminacion.gitanos.org/casos/murcia-redes-sociales-discriminaci%C3%B3n-directa-0
"El diario digital Casoaislado, que se caracteriza por publicar noticias falsas para difamar a determinados colectivos, publicó una noticia sobre una acción violenta contra la policía, donde incriminaban a personas gitanas: “Numerosos gitanos propinan una brutal paliza a varios policías en Linares e intentan asaltar un hospital para liberar a un miembro del clan”.","Se envió una carta de queja al medio, explicando la mala praxis de mencionar la etnia en la noticia. El medio respondió una carta con el siguiente contenido: 
“Mencionar la etnia, procedencia o nacionalidad de los responsables de un delito/agresión no es mala praxis periodística como ustedes mencionan. Editaremos la noticia modificando algunas de las frases que citan en la carta, pero no vamos a omitir que pertenecían a la etnia gitana, ya que nuestros lectores nos agradecen que no ocultemos datos que los principales medios de comunicación sí ocultan. Un saludo.”
",Negativo. La noticia no fue modificada en lo referente a la etnia de los implicados y además el medio aseguró que realizar tales alusiones a la comunidad gitana no es discriminatorio.,2018-01-01T00:00:00+01:00,2018-01-01T00:00:00+01:00,Estatal,Medios de comunicación,Discriminación directa,['https://casoaislado.com/numerosos-gitanos-propinan-una-brutal-paliza-varios-policias-linares-eintentan-asaltar-hospital-liberar-miembro-del-clan/'],https://informesdiscriminacion.gitanos.org/casos/estatal-medios-de-comunicaci%C3%B3n-discriminaci%C3%B3n-directa-5
"En el programa de Ana Rosa Quintana de Telecinco se comentaba un caso de una pelea, mencionando la etnia gitana de algunos de los implicados.",Se envió una carta a Telecinco explicando la mala praxis de mencionar la etnia cuando no es relevante.,"Positivo. Telecinco contestó a la carta con el siguiente mensaje: “Estimada Sra. Le transmitimos sus preocupaciones a la directora del programa y le transmito su respuesta. Hola qué tal, he leído atentamente su queja. Mis disculpas y tomaré medidas para que no ocurra. No es responsable crear estereotipos pero sé de buena fe que ni el redactor ni el colaborador lo hicieron con mala intención. Tomo nota. Reciba un cordial saludo.”",2018-01-01T00:00:00+01:00,2018-01-01T00:00:00+01:00,Estatal,Medios de comunicación,Discriminación directa,,https://informesdiscriminacion.gitanos.org/casos/estatal-medios-de-comunicaci%C3%B3n-discriminaci%C3%B3n-directa-4
La Voz de Galicia publicó una noticia sobre una redada por tráfico de drogas en Ferrol. En el cuerpo de la noticia se mencionaba la pertenencia étnica de los detenidos.,Se envió carta de queja al medio.,Negativo. No hubo respuesta.,2018-01-01T00:00:00+01:00,2018-01-01T00:00:00+01:00,A Coruña,Medios de comunicación,Discriminación directa,['https://www.lavozdegalicia.es/noticia/ferrol/naron/2018/04/14/redada-contra-trafico-drogassalda-nueve-detenidos-naron/0003_201804F14C3994.htm'],https://informesdiscriminacion.gitanos.org/casos/santiago-de-compostela-medios-de-comunicaci%C3%B3n-discriminaci%C3%B3n-directa-2
El periódico Granada Hoy publicó una noticia sobre un asesinato producido en Bilbao a una pareja de ancianos. En la noticia se mencionaba que los presuntos autores eran de etnia gitana. A raíz de esta noticia aparecen varios comentarios racistas de lectores.,Se envió carta al medio solicitando la retirada de los comentarios.,Positivo. Se retiraron los comentarios antigitanos.,2018-01-01T00:00:00+01:00,2018-01-01T00:00:00+01:00,Granada,Medios de comunicación,Discriminación directa,['https://www.granadahoy.com/sociedad/Detenidos-jovenes-asesinato-ancianos-Bilbao_0_1211279503.html'],https://informesdiscriminacion.gitanos.org/casos/granada-medios-de-comunicaci%C3%B3n-discriminaci%C3%B3n-directa
En los informativos de Telecinco se emitió una noticia de una pelea en una discoteca de Cornellá (Barcelona) en la madrugada del sábado 7 de abril de 2018. En la explicación de la noticia se mencionaba la etnia de los implicados.,Se envió carta de queja a Telecinco.,"Positivo. Tras haber mandado la carta, el director de informativos Telecinco Pedro Piqueras llamó a la Fundación Secretariado Gitano para disculparse y explicar que entiende nuestros razonamientos y va a trasladarlo al equipo con la orden de que no vuelva a ocurrir.",2018-01-01T00:00:00+01:00,2018-01-01T00:00:00+01:00,Estatal,Medios de comunicación,Discriminación directa,['https://www.telecinco.es/informativos/informativo_21_h/informativo-noche-pedro-piqueras_2_2544180260.html'],https://informesdiscriminacion.gitanos.org/casos/estatal-medios-de-comunicaci%C3%B3n-discriminaci%C3%B3n-directa-3
"El periódico El Español publicó una noticia sobre el rapto de una niña, donde menciona la etnia gitana de las familias implicadas: “El rapto de la niña Nerea: dos clanes gitanos, una cita por Facebook y acusación de agresión sexual”.","Se envió carta de queja al medio, explicando la mala praxis de la redacción de esta noticia.",Negativo. No hubo respuesta del medio.,2018-01-01T00:00:00+01:00,2018-01-01T00:00:00+01:00,Asturias,Medios de comunicación,Discriminación directa,['https://www.elespanol.com/reportajes/20180403/nerea-clanes-gitanos-facebook-acusacionagresion-sexual/296971437_0.html'],https://informesdiscriminacion.gitanos.org/casos/asturias-medios-de-comunicaci%C3%B3n-discriminaci%C3%B3n-directa
"El periódico Ideal publicó una noticia sobre un secuestro, donde se mencionaba la sospecha de los padres de la joven secuestrada de que los secuestradores pudieran ser de etnia gitana. Aparte de tratarse solo de una suposición (no era una información probada), la mención de la etnia no era relevante, y criminalizaba a toda la comunidad.","Se envió una carta de queja al medio, explicando la mala praxis.","Negativo, no ha habido respuesta del medio ni se ha eliminado la mención a la etnia.",2018-01-01T00:00:00+01:00,2018-01-01T00:00:00+01:00,Almería,Medios de comunicación,Discriminación directa,['https://www.ideal.es/nacional/aparece-menor-desaparecida-20180403132206-ntrc.html'],https://informesdiscriminacion.gitanos.org/casos/almer%C3%ADa-medios-de-comunicaci%C3%B3n-discriminaci%C3%B3n-directa-1
"El periódico Voces de Cuenca publicó una noticia sobre el día 8 de abril Día del pueblo gitano. Un lector hizo un comentario de odio contra la comunidad gitana: 
“No acabo de ver lo que ha hecho la comunidad gitana para que se la tenga que homenajear, han sido, son y serán parásitos.”
",Se escribió a este medio solicitando la retirada de ese comentario de odio.,Positivo. El periódico retiró el comentario.,2018-01-01T00:00:00+01:00,2018-01-01T00:00:00+01:00,Cuenca,Medios de comunicación,Discriminación directa,,https://informesdiscriminacion.gitanos.org/casos/cuenca-medios-de-comunicaci%C3%B3n-discriminaci%C3%B3n-directa
"El periódico ABC en su edición de Galicia menciona una noticia de un tiroteo en un hospital, con mención en el titular a la etnia de los implicados. Además, la noticia aporta valoraciones personales con un lenguaje poco riguroso para un periódico: 
“Lo tenían todo preparado: padre, hermano y sus respectivos hijos, miembros de un clan gitano, se plantaron en la puerta del hospital de Orense para acabar con la vida de un joven de una familia rival”. “Aquella medianoche de mayo a Orense se le interrumpió el sueño no solo por la magnitud del objetivo -un intento de homicidio en plena calle-, sino por el lugar elegido para ejecutar el tiroteo”.
",Se envió una carta de queja al medio explicando esta mala praxis.,Negativo. No hubo respuesta del medio ni se eliminó la mención a la etnia.,2018-01-01T00:00:00+01:00,2018-01-01T00:00:00+01:00,A Coruña,Medios de comunicación,Discriminación directa,['https://www.abc.es/espana/galicia/abci-historia-crimen-fallido-juicio-tiroteo-entre-clanes-gitanos-hospital-orense-201804011310_noticia.html'],https://informesdiscriminacion.gitanos.org/casos/santiago-de-compostela-medios-de-comunicaci%C3%B3n-discriminaci%C3%B3n-directa-1
"Dos medios de Galicia, El Correo Gallego y la Voz de Galicia publicaron sendas noticias sobre una intervención policial, donde la policía hirió a un hombre que amenazaba a una mujer. En el texto de la noticia se da a entender que el herido es gitano: 
“En el lugar de los hechos se han congregado un gran número de personas, la mayoría de etnia gitana, residentes en el barrio”.
","Se enviaron cartas de queja a ambos medios, explicando la mala praxis de la mención de la etnia.",Negativo. No hubo respuesta.,2018-01-01T00:00:00+01:00,2018-01-01T00:00:00+01:00,A Coruña,Medios de comunicación,Discriminación directa,['http://www.elcorreogallego.es/galicia/ecg/policia-hiere-ferrol-un-hombre-amenazaba-mujer/idEdicion-2018-03-29/idNoticia-1107447'],https://informesdiscriminacion.gitanos.org/casos/santiago-de-compostela-medios-de-comunicaci%C3%B3n-discriminaci%C3%B3n-directa-0
"La Opinión de Murcia publicó una noticia sobre un suceso acontecido en la pedanía de Alguazas, ubicado en la ciudad de Murcia, haciendo mención a la etnia gitana del supuesto autor y relacionándola de forma directa con hechos violentos así como con el asesinato de una persona.","Se envió una carta de queja a este medio, explicando que ese tipo de redacción supone una mala práctica periodística.",Negativo. No hubo respuesta ni se eliminó la mención a la etnia gitana.,2018-01-01T00:00:00+01:00,2018-01-01T00:00:00+01:00,Murcia,Medios de comunicación,Discriminación directa,['http://www.laopiniondemurcia.es/municipios/2018/01/01/entrega-sospechoso-alguazas/886815.html'],https://informesdiscriminacion.gitanos.org/casos/murcia-medios-de-comunicaci%C3%B3n-discriminaci%C3%B3n-directa-0
"El Mundo publicó una noticia sobre un apuñalamiento a dos jóvenes, mencionando la supuesta etnia gitana de los supuestos agresores, un dato que no aportaba nada a la noticia. La noticia dio lugar a comentarios de odio antigitano de los lectores: 
“sois la lacra que tenemos que aguantar los españoles. Siempre los mismos, con vuestra ley, robando, matando, ojo por ojo decís, pero estamos ya hartos de no poder hacer nada contra una etnia que lleva más de 50 años haciendo lo que les da la gana y sin respetar a nadie. Espero que llegue el día en el que podamos veros lejos de la sociedad”
",Se envió una nota de queja al medio.,Negativo. No se modificó la noticia ni se eliminaron los comentarios antigitanos.,2018-01-01T00:00:00+01:00,2018-01-01T00:00:00+01:00,Madrid,Medios de comunicación,Discriminación directa,['http://www.elmundo.es/madrid/2018/02/23/5a90624846163f81268b4612.html'],https://informesdiscriminacion.gitanos.org/casos/madrid-medios-de-comunicaci%C3%B3n-discriminaci%C3%B3n-directa
"Apareció publicada una noticia en el diario La Gaceta Regional de Salamanca en la que se hacía referencia al juicio que había tenido lugar con unos presuntos agresores a un médico de familia. En el desarrollo de la noticia se hizo mención a que los tres implicados, eran miembros de la misma familia y de etnia gitana. En el foro de internet relacionado con la noticia se publicaron más de 50 comentarios antigitanos. Algunos de los comentarios fueron: 
“Es muy buen médico y esta gentuza fuera de Salamanca y ayudas 0, basta ya de poner mejor a extranjeros y gitanos, mejor que a los demás para las asistentas. Tienen trato diferente al resto de mortales. Mano dura a este señor juez” “Tú, tal como ellos, un parásito” “A esta gente la tenía que ver el veterinario y no el médico. Además no un veterinario de animales de compañía si no los que atienden a los cochinos y los burros” “Lo de siempre y muy propio de esta chusma chupona de subvenciones, sin pagar un impuesto, con más derechos que una persona normal, exigiendo lo que no deben. Fuera de las ayudas y que se paguen un seguro médico. Y condenarlos no a multas, si no a trabajar con un pico y una pala y punto”.
",Desde el Departamento se envió una carta de queja al medio solicitándole la eliminación de todos los comentarios discriminatorios hacia las personas gitanas y trasladándoles su responsabilidad con respecto la administración del foro.,"Parcialmente positivo. El medio no contestó ni eliminó la mención a la etnia, aunque sí se eliminaron los comentarios.",2018-01-01T00:00:00+01:00,2018-01-01T00:00:00+01:00,Salamanca,Medios de comunicación,Discriminación directa,['http://www.lagacetadesalamanca.es/salamanca/2018/03/21/familia-agredio-medico-san-josegusta-medico-hazte-basurero/232922.html'],https://informesdiscriminacion.gitanos.org/casos/salamanca-medios-de-comunicaci%C3%B3n-discriminaci%C3%B3n-directa
