hechos,intervencion,resultado,fecha_hechos,fecha_denuncia,provincia,ambito,tipo_desciminacion,reference
"Cientos de octavillas anónimas se distribuyen en la localidad de Santa Fe incitando a la violencia contra la comunidad gitana. Tanto la FSG como el Alcalde y otras entidades ponen los hechos en conocimiento de la Fiscalía del Tribunal Superior de Justicia de Andalucía para que se abra una investigación y se identifique a los responsables, aunque el caso es archivado en agosto por falta de pruebas.",,,2004-01-01T00:00:00+01:00,2004-01-01T00:00:00+01:00,Granada,Vivienda,Acoso discriminatorio,
"El Ayuntamiento de Madrid ordena el derribo de dos Iglesias Evangélicas de fieles gitanos, en su mayoría, sin respetar el procedimiento establecido para retirar el carácter de culto a los templos, y a pesar de que la sentencia que aprobaba dicho derribo había sido recurrida y no era, por tanto, firme.",,,2004-01-01T00:00:00+01:00,2004-01-01T00:00:00+01:00,Madrid,Vivienda,Discriminación directa,
"Una familia gitana que reside en una vivienda declarada en ruina intenta alquilar un inmueble con el apoyo de la FSG. Al visitar un piso anunciado en la prensa, una vecina, pariente de la dueña, se niega a facilitarles el teléfono de la misma, afirmando que la vivienda ya se ha alquilado. Una inmobiliaria, que también gestiona el alquiler del piso, intenta mediar con la propietaria sin conseguir resultados positivos.",,,2004-01-01T00:00:00+01:00,2004-01-01T00:00:00+01:00,Asturias,Vivienda,Discriminación directa,
"Una joven comienza a trabajar como camarera en un restaurante donde todo trascurre con normalidad hasta que, unos días después, se reincorpora el dueño, que había estado enfermo. Cuando confirma la pertenencia étnica de la trabajadora, el empresario realiza numerosos comentarios despectivos y racistas, sometiéndola a un trato degradante y continuas humillaciones que motivan su renuncia voluntaria.",,,2004-01-01T00:00:00+01:00,2004-01-01T00:00:00+01:00,Cádiz,Empleo,Acoso discriminatorio,
"Una empresa de limpieza comienza a prestar sus servicios en una comunidad de propietarios. Uno de los vecinos acusa a un trabajador gitano de llevarse el panel de los anuncios del portal, y afirma que se ha producido un robo dentro de uno de los coches del garaje. La vocal de la junta de propietarios comprueba que estos hechos no son ciertos, pero la empresa decide trasladar al trabajador para evitar conflictos.",,,2004-01-01T00:00:00+01:00,2004-01-01T00:00:00+01:00,Asturias,Empleo,Discriminación directa,
"La FSG recibe una solicitud de una empresa de limpieza para cubrir una vacante de portero. Sin embargo, cuando presenta al trabajador a la comunidad de vecinos, su presidenta se niega a contratarlo, ya que se trata de un puesto “en el que hay que dar una imagen, y un gitano no es lo más apropiado”.",,,2004-01-01T00:00:00+01:00,2004-01-01T00:00:00+01:00,Cáceres,Empleo,Discriminación directa,
"La FSG se pone en contacto con un supermercado, cuyo responsable informa de la necesidad urgente de cubrir una vacante de cajera/reponedora/limpiadora, para cubrir la campaña de Navidad. La encargada de la tienda añade que no quiere ni extranjeros ni gitanos, a pesar de que el establecimiento se encuentra muy próximo a un barrio con un elevado número de población gitana que es cliente habitual.",,,2004-01-01T00:00:00+01:00,2004-01-01T00:00:00+01:00,Valencia,Empleo,Discriminación directa,
"La FSG se pone en contacto con una empresa de limpieza que solicita trabajadores en un anuncio de prensa. El responsable de la misma se muestra interesado inicialmente, pero cuando acude a las oficinas de la entidad y comprueba la etnia de los trabajadores propuestos, cambia de actitud y comenta que sus empresas colaboradoras no quieren gitanos, aunque luego afirma que no va a contratarlos porque en realidad no necesita cubrir ese personal.",,,2004-01-01T00:00:00+01:00,2004-01-01T00:00:00+01:00,Cáceres,Empleo,Discriminación directa,
"Una tienda de artículos musicales solicita a la FSG dos jóvenes como mozos de carga y descarga para hacer una mudanza. Los trabajadores son seleccionados y se concierta una entrevista con la dueña del establecimiento, que les exige la presentación de su documento nacional de identidad, alegando que ve difícil su contratación porque lo tienen caducado. Posteriormente, la empresaria comunica a la FSG que sólo contratará personal “que no tenga apariencia gitana”.",,,2004-01-01T00:00:00+01:00,2004-01-01T00:00:00+01:00,Zaragoza,Empleo,Discriminación directa,
"La FSG contacta con una empresa de construcción para negociar la posibilidad de realizar un contrato de formación para un usuario. El dueño de la empresa se muestra, en principio, favorable, pero finalmente rechaza la oferta alegando que tiene miedo a las represalias de la familia, en el caso hipotético de que tuviera que despedir al trabajador.",,,2004-01-01T00:00:00+01:00,2004-01-01T00:00:00+01:00,Cáceres,Empleo,Discriminación directa,
"La FSG se pone en contacto con un local que ofrece un puesto de camarero, poniendo a su disposición la bolsa de empleo de la entidad, en la que se encuentra un joven que cumple con los requisitos exigidos. El dueño del local afirma que no quiere gitanos porque no se fía de ellos, aunque finalmente se muestra receptivo a darle una oportunidad al trabajador. Al día siguiente, sin embargo, afirma que su hijo se ha opuesto a contratar al candidato seleccionado, porque el bar se llenaría de gitanos.",,,2004-01-01T00:00:00+01:00,2004-01-01T00:00:00+01:00,Salamanca,Empleo,Discriminación directa,
"Una importante empresa, colaboradora habitual de la FSG, solicita un trabajador para cubrir una vacante de expendedor de gasolina en una estación de servicio. La candidata de la FSG realiza una primera entrevista de manera satisfactoria, aunque le informan de que la decisión final debe tomarla la propia estación. Cuando la trabajadora se presenta a una segunda entrevista, el encargado le comunica que el puesto ya ha sido cubierto, aunque la FSG comprueba que no es cierto.",,,2004-01-01T00:00:00+01:00,2004-01-01T00:00:00+01:00,Zaragoza,Empleo,Discriminación directa,
"Una empresa de trabajo temporal solicita de la bolsa de empleo de la FSG un peón de construcción. Un usuario de la entidad realiza un primer servicio, y, más adelante, le demandan un segundo, aunque no llega a presentarse en el puesto por un malentendido con la empresa. Uno de los responsables de la ETT contacta con la FSG para protestar, insultando al trabajador y haciendo comentarios despectivos sobre los usuarios de la bolsa de empleo.",,,2004-01-01T00:00:00+01:00,2004-01-01T00:00:00+01:00,Salamanca,Empleo,Discriminación directa,
"Una usuaria de la FSG trabaja en una empresa de limpieza que presta sus servicios en distintos locales, uno de los cuales solicita que la sustituyan por otra trabajadora. La FSG se interesa por los motivos de la sustitución, sin que exista alguno aparente. Aunque no reconoce que sea el caso, la responsable de la empresa admite que, en ocasiones, los clientes han solicitado un cambio de limpiadora por ser ésta gitana.",,,2004-01-01T00:00:00+01:00,2004-01-01T00:00:00+01:00,Valencia,Empleo,Discriminación directa,
"Una empresa de trabajo temporal solicita de la bolsa de empleo de la FSG dos trabajadoras con conocimientos en corte y confección y experiencia en la utilización de máquinas de coser de tipo industrial. Las usuarias inician un periodo de prueba bajo la supervisión de un encargado que se muestra en todo momento conforme con su labor. Tras un cambio de turno, sin embargo, el nuevo encargado les exige tareas desproporcionadas, ordenando a las trabajadoras, de manera hostil, ofensiva y humillante, y en presencia de sus compañeros, que abandonen su puesto por carecer de preparación.",,,2004-01-01T00:00:00+01:00,2004-01-01T00:00:00+01:00,Jaén,Empleo,Acoso discriminatorio,
"Un usuario de la FSG acude a una empresa para interesarse por una vacante de repartidor anunciada en la prensa. El encargado le informa de que la plaza ya está cubierta, pero un trabajador no gitano de la FSG solicita información telefónica sobre dicha vacante, y consigue concertar una entrevista de trabajo.",,,2004-01-01T00:00:00+01:00,2004-01-01T00:00:00+01:00,Huesca,Empleo,Discriminación directa,
"El Tribunal Superior de Xustiza de Galicia confirma la sentencia contra el encargado del parque móvil del Ayuntamiento de La Coruña, a quien un trabajador gitano denunció por continuos comentarios insultantes, despectivos y humillantes en relación a su pertenencia étnica.",,,2004-01-01T00:00:00+01:00,2004-01-01T00:00:00+01:00,A Coruña,Empleo,Acoso discriminatorio,
"Un usuario de la FSG recibe del INEM una oferta para ingresar en una escuela taller de pintura una vez concluido el plazo para formalizar la solicitud. Cuando acude a la oficina del INEM para explicar lo sucedido, un funcionario le comunica despectivamente que no puede ayudarle, que reclame ante la oficina de correos y le deje trabajar en paz. El afectado, acompañado por personal de la FSG, regresa a la oficina y solicita hablar con el Director, que se disculpa por lo sucedido, y se compromete a enviar una carta a la escuela taller para que su solicitud se curse dentro de plazo.",,,2004-01-01T00:00:00+01:00,2004-01-01T00:00:00+01:00,Córdoba,Empleo,Discriminación directa,
"Una empresa de trabajo temporal se pone en contacto con el dispositivo de la FSG de la zona para solicitar montadores de escenarios para un concierto. Los trabajadores propuestos cumplen con todos los requisitos exigidos pero, cuando el personal de la ETT comprueba que son gitanos, aseguran que ya han cubierto el cupo y no necesitan ningún trabajador más.",,,2004-01-01T00:00:00+01:00,2004-01-01T00:00:00+01:00,Jaén,Empleo,Discriminación directa,
"La FSG mantiene una entrevista con el dueño de una pastelería que ofrece un puesto de trabajo, para recomendar a una trabajadora gitana. En el transcurso de la misma, una mujer extranjera se interesa por la vacante, que el empresario asegura ya haber cubierto. La usuaria de la FSG acude a la entrevista al día siguiente pero apenas dura unos minutos, ya que el empresario le informa de que está pendiente de que otra persona le dé su conformidad. Finalmente no es contratada.",,,2004-01-01T00:00:00+01:00,2004-01-01T00:00:00+01:00,Huesca,Empleo,Discriminación directa,
"Un usuario del programa de empleo de la FSG solicita información sobre el proceso de selección y las condiciones de trabajo de una oferta publicada en prensa. El responsable de la empresa le pregunta si es gitano, y ante su respuesta afirmativa, le excluye del proceso de selección alegando que no le gustan los gitanos, que ya ha tenido dos, y se la han jugado.",,,2004-01-01T00:00:00+01:00,2004-01-01T00:00:00+01:00,Jaén,Empleo,Discriminación directa,
"Varias usuarias de la FSG participan en una acción formativa en una empresa de restauración que presta sus servicios a un hospital. El responsable de la empresa contacta con varias de ellas para proponerles una sustitución temporal por vacaciones. Las usuarias aceptan pero el contrato no llega a formalizarse porque algunos representantes del hospital manifiestan su oposición, ya que el trabajo implica la atención directa a pacientes y familiares, lo que, en su opinión, podría generar problemas por su pertenencia étnica.",,,2004-01-01T00:00:00+01:00,2004-01-01T00:00:00+01:00,Burgos,Empleo,Discriminación directa,
"Una joven gitana realiza una entrevista de trabajo tras la cual le proponen la realización de una prueba como limpiadora-cocinera. Sin embargo, antes de concluir la entrevista, la Directora se fija en sus apellidos, le pregunta si es gitana y, ante su respuesta afirmativa, le comenta que tiene que consultarlo con sus superiores. Cuando la joven contacta con la empresa al día siguiente, le comunican que no van a realizarle la prueba porque quieren buscar otro perfil.",,,2004-01-01T00:00:00+01:00,2004-01-01T00:00:00+01:00,Palencia,Empleo,Discriminación directa,
"Una usuaria del programa de empleo de la FSG se interesa por un puesto de cocinera-limpiadora y es citada en una cafetería céntrica de la ciudad para realizar una entrevista de trabajo. El seleccionador, que se identifica como el hijo del propietario del restaurante que ofrece el puesto, comunica a la candidata que su padre no quiere contratar gitanos porque “a la clientela local no le gusta”.",,,2004-01-01T00:00:00+01:00,2004-01-01T00:00:00+01:00,Burgos,Empleo,Discriminación directa,
"El propietario de una empresa de la construcción solicita de la bolsa de empleo de la FSG un aprendiz de albañil para reformar una vivienda particular. Se selecciona un usuario del programa de empleo que reúne las características requeridas, pero es rechazado por el empresario, que afirma que su cliente no lo admitiría, dada su pertenencia étnica.",,,2004-01-01T00:00:00+01:00,2004-01-01T00:00:00+01:00,Pontevedra,Empleo,Discriminación directa,
"Un empresario solicita a la FSG la preselección de una trabajadora para cubrir una vacante de camarera. Tras entrevistar a la candidata, el empresario le ofrece un contrato de tres meses y solicita su incorporación esa misma tarde, mostrándose en todo momento muy satisfecho con su trabajo. Cuando tres personas de etnia gitana entran en la cafetería para saludar a la camarera, cambia de actitud y se escuda en la inexperiencia de la joven para no formalizar el contrato. Posteriormente reconoce que el verdadero motivo es que no quiere que a su cafetería acudan gitanos “que puedan espantar a la clientela”.",,,2004-01-01T00:00:00+01:00,2004-01-01T00:00:00+01:00,Toledo,Empleo,Discriminación directa,
"Una empresa de limpieza se niega a contratar a trabajadores gitanos, salvo para el acondicionamiento del local de la FSG, tarea para la que iba a ser contratada por la entidad. Sin embargo, gracias a las labores de mediación del dispositivo de la localidad, la FSG logra tres contrataciones de personas gitanas.",,,2004-01-01T00:00:00+01:00,2004-01-01T00:00:00+01:00,Lugo,Empleo,Discriminación directa,
"La FSG se pone en contacto con una empresa de trabajo temporal para informarse sobre las condiciones de una oferta de empleo y apoyar en el proceso de selección a una usuaria interesada en el mismo. La ETT informa de que ni ella, ni la empresa a la que ofrecen sus servicios, una fábrica de magdalenas, están dispuestas a contratar gitanos, debido a una mala experiencia previa con otros trabajadores de esta etnia.",,,2004-01-01T00:00:00+01:00,2004-01-01T00:00:00+01:00,Huesca,Empleo,Discriminación directa,
"La FSG contacta con una empresa para solicitar información sobre una vacante publicada en la prensa. Una usuaria de la bolsa de empleo que cumple con los requisitos exigidos acude a una entrevista en la que, al comprobar su pertenencia étnica, le comunican que, contrariamente a lo que habían hablado con anterioridad, el puesto ofrecido no es de peonaje, sino de reparación de maquinaria. Un encargado le confirma, sin embargo, que ha sido excluida del proceso de selección por motivos étnicos, ya que, en referencia a los gitanos, “cuando no está malo el primo, está enferma la abuela”.",,,2004-01-01T00:00:00+01:00,2004-01-01T00:00:00+01:00,Huesca,Empleo,Discriminación directa,
"Una empresa de transporte y mensajería publica en la prensa una oferta de repartidor. La FSG se pone en contacto con la misma para ofrecerle su bolsa de empleo, ya que hay diversos trabajadores que cumplen con el perfil solicitado. El responsable de personal manifiesta que no quieren trabajadores gitanos porque no se fía de ellos, ya que el trabajo implica transportar mercancías valiosas, y “podrían robarlas”.",,,2004-01-01T00:00:00+01:00,2004-01-01T00:00:00+01:00,Huesca,Empleo,Discriminación directa,
"Una empresa de jardinería solicita un trabajador con experiencia en el manejo de máquinas cortacésped. La FSG envía un candidato con el que la empresa se muestra inicialmente conforme, aunque comenta “que es morenote”, y que los gitanos “tienen fama”. A pesar de la recomendación de la FSG, el usuario no es contratado.",,,2004-01-01T00:00:00+01:00,2004-01-01T00:00:00+01:00,Valencia,Empleo,Discriminación directa,
"La FSG recibe una propuesta de formación en una empresa de fabricación de cocinas, en el marco de un proyecto EQUAL4. A pesar de presentar un currículo que cumple con todos los requisitos exigidos, la empresa no se pone en contacto con el candidato. Una gerente del proyecto comunica a la FSG que en la empresa han comentado al responsable de recursos humanos que el candidato “vive en una zona donde residen muchos gitanos y que, por su apellido, debe ser uno de ellos”.",,,2004-01-01T00:00:00+01:00,2004-01-01T00:00:00+01:00,Asturias,Empleo,Discriminación directa,
El Correo publicó una noticia relacionada con una agresión en un hospital. En el contenido de la noticia se menciona la etnia de las personas involucradas: “un numeroso grupo de miembros de etnia gitana que se congregó en el edificio”.,Se envió una carta de queja al periódico.,No hubo respuesta.,2018-01-01T00:00:00+01:00,2018-01-01T00:00:00+01:00,Álava,Medios de comunicación,Discriminación directa,['https://www.elcorreo.com/bizkaia/rompe-nariz-vigilante-20181022204335-nt.html']
"El diario Salamancatvaldia.es publicó una noticia con el siguiente titular: “denuncian la suciedad dejada por unos jóvenes de etnia gitana en el Barrio Nuevo”. Concretamente el medio hizo mención a una “quincena de jóvenes de etnia gitana”, quienes supuestamente estuvieron en el lugar a plena luz del día y lo ensuciaron todo.",Desde el Departamento de Igualdad se escribió al medio trasladándole que la mención de la etnia en este tipo de noticias no aportaba nada a la noticia y sí en cambio mantenía prejuicios y estereotipos hacia las personas gitanas relacionados con actos incívicos.,El medio no contestó ni eliminó la mención a la etnia gitana.,2018-01-01T00:00:00+01:00,2018-01-01T00:00:00+01:00,Salamanca,Medios de comunicación,Discriminación directa,['https://salamancartvaldia.es/not/191732/denuncian-suciedad-dejada-unos-jovenes-etnia-gitanabarrio-nuevo/']
"El Correo Gallego publicó una noticia sobre una redada antidroga en un pueblo gallego. En ella se mencionaba la etnia gitana de los implicados. 
“En la operación contra el tráfico de drogas participan un centenar de agentes, confirmaron a Efe fuentes de la Guardia Civil, e indicaron que han hallado grandes cantidades de droga en posesión de un miembro de uno de los clanes familiares que residen en ese poblado, habitado por miembros de la comunidad gitana”.
  ",Se envió una carta de queja al periódico.,No hubo respuesta.,2018-01-01T00:00:00+01:00,2018-01-01T00:00:00+01:00,Pontevedra,Medios de comunicación,Discriminación directa,['https://www.elcorreogallego.es/galicia/ecg/decomisan-cocaina-heroina-un-amplia-redada-poblado-vao/idEdicion-2018-10-03/idNoticia-1140207/']
"El diario digital Salamanaca24horas.com publicó una noticia relacionada con una operación llevada a cabo por la Guardia Civil contra el tráfico de drogas y de estupefacientes; el periodista que la redactó hizo mención hasta en cuatro ocasiones a la etnia gitana a la que presuntamente pertenecía uno de los dos detenidos 
“Al menos dos personas, una de ellas un varón de etnia gitana, han sido detenidas en la mañana de este miércoles en una redada simultánea llevada a cabo por numerosos agentes de la Guardia Civil…”
 A lo largo de la noticia aparecieron términos como “clan”, expresión que se relaciona con el tráfico de drogas y la delincuencia. Relacionados con el suceso fueron publicados más de noventa comentarios en el foro. Un ejemplo de ello: “puta raza que no se extermina; solo hacen el mal, no hay ninguno bueno! Como les permiten hacer de todo... venden la droga, la policía lo sabe, y pasan de todo..¡así va el país!”","Desde el Departamento de Igualdad se envió una carta de queja al medio trasladándole nuestro malestar por la mención de la etnia gitana en este tipo de publicaciones relacionadas con este tipo de sucesos delictivos y violentos. Además, se le emplazó a que eliminara todos los comentarios de rechazo y discriminación hacia la comunidad gitana.",Negativo. El medio no contestó ni eliminó las menciones estereotipadas a la etnia gitana.,2018-01-01T00:00:00+01:00,2018-01-01T00:00:00+01:00,Salamanca,Medios de comunicación,Discriminación directa,['https://www.salamanca24horas.com/texto-diario/mostrar/1193638/menos-detenidos-redadasimultanea-pisos-calles-vegas-virgen-carmen-santa-marta']
Una asociación de vecinos de Arroyomolinos abrió una cuenta de change.org en la que vinculan a los gitanos del pueblo con la delincuencia.,Se envió una carta de queja a change.org.,No hubo respuesta. No han quitado la mención a la etnia gitana de la petición.,2018-01-01T00:00:00+01:00,2018-01-01T00:00:00+01:00,Madrid,Redes sociales,Discriminación directa,['https://www.change.org/p/agencia-de-vivienda-social-ayto-de-arroyomolinos-defensor-delpueblo-de-la-comunidad-de-madrid-desalojo-de-okupas-de-la-calle-almer%C3%ADa-en-arroyomolinos?recruiter=282414701&utm_source=share_petition&utm_medium=facebook&utm_campaign=sign_checkbox.lightning_share_checkbox_quote.control&utm_term=petition_show']
Se localizó en Instagram un video de una chica que publicaba un comentario que estigmatizaba la imagen del pueblo gitano y las personas con discapacidad. “...lo entendería hasta un gitano con sindrome de down. que por cierto nunca he visto uno...”,Se envió una carta de queja a la autora explicando el sesgo discriminatorio.,Positivo. La autora eliminó el video.,2018-01-01T00:00:00+01:00,2018-01-01T00:00:00+01:00,Estatal,Redes sociales,Discriminación directa,
Europapress publicó una noticia sobre un tiroteo producido en Huesca. En la noticia se refiere a los autores como “dos clanes gitanos”.,Se envió una carta de queja al periódico.,Negativo. No hubo respuesta ni se eliminó la mención a la etnia.,2018-01-01T00:00:00+01:00,2018-01-01T00:00:00+01:00,Huesca,Medios de comunicación,Discriminación directa,['https://www.europapress.es/andalucia/huelva-00354/noticia-policia-nacional-investiga-tiroteotorrejon-dos-clanes-gitanos-heridos-20180920113859.html']
"El programa “Equipo de Investigación” de la Sexta emitió un reportaje sobre Linares. En este programa se criminalizaba a los gitanos del pueblo, acusándoles de cometer actos delictivos, con intervenciones como las siguientes: “en fin, han llegado un montón de gitanos, nos han rodeado ... Qué hijos de puta nos han tirado hasta piedras, han pegado varios tiros a Navarrete…” o como muestran los testimonios de algunos vecinos: “y vinieron todos los gitanos… tuvo que llamar a la policía porqué los gitanos le iban a matar” “vinieron 7 de etnia gitana y me dieron una paliza para matarme” “se cagaron en sus muertos” entonces, según la Ley gitana, se liaron a tiros” … Además, durante el desarrollo del Programa se menciona varias veces “Clanes familiares” y “clanes gitanos” “leyes gitanas” “reyertas”, etc. toda una serie de denominaciones y estereotipos muy asociados mediáticamente a la etnia gitana.","Se envió una carta de queja a la Dirección y a la producción de Equipo de investigación, mostrando preocupación por la imagen estereotipada y negativa que daba el Programa de las personas gitanas y solicitando que se hicieran reportajes que reflejaran la diversidad y realidad de la Comunidad gitana.",No hubo respuesta por parte de La Sexta.,2018-01-01T00:00:00+01:00,2018-01-01T00:00:00+01:00,Jaén,Medios de comunicación,Discriminación directa,
Diario Jaén subió a Youtube un vídeo con declaraciones de dos personas de etnia gitana en la que expresaban que ellos no pagaban luz y que “lo tienen todo enganchado”. Este video generó comentarios de odio como: “pena que Hitler no terminase el trabajo”; “Todos metidos en un container y a la fosa Laurentina”; “Encima se descojonan. PARASITOS”.,"Se hizo captura de esos comentarios, y se envió queja a Youtube y a Diario de Jaén pidiendo que los retiraran.",No ha dado resultado. Ni youtube ni Diario Jaén retiraron los comentarios.,2018-01-01T00:00:00+01:00,2018-01-01T00:00:00+01:00,Jaén,Medios de comunicación,Discriminación directa,['https://www.youtube.com/watch?v=7rb2pM3M5LM']
"En el Diario de Jerez se publicó una noticia sobre un secuestro, donde se indicaba que los autores del mismo eran de etnia gitana.","Se envió una carta de queja por el tratamiento de la noticia, explicando que la referencia a la etnia fomenta una imagen social negativa de toda la comunidad gitana, ya que asocia la pertenencia a la etnia gitana con delincuencia, robo, abusos, etc.",Negativo. No hubo respuesta del medio ni se eliminó la mención a la etnia.,2018-01-01T00:00:00+01:00,2018-01-01T00:00:00+01:00,Cádiz,Medios de comunicación,Discriminación directa,['https://www.diariodejerez.es/jerez/Aparece-Andujar-joven-anos-marcho_0_1284171776.html']
