hechos,intervencion,resultado,fecha_hechos,fecha_denuncia,provincia,ambito,tipo_desciminacion,reference,link
"En un colegio de Cádiz, la madre de una alumna insultaba a menudo a una niña gitana a la entrada del colegio, con frases como: “niña loca, enferma mental, estás mintiendo, gitana”. La madre de la víctima puso una denuncia ante la policía, en la que relataba los hechos. Ambas niñas coincidieron en la misma clase en cursos anteriores, no encontrándose ahora en la misma clase, pero la menor aprovechaba cualquier ocasión en la que coincidan para insultarla ante el resto de compañeros. El director del centro llamó a la madre de la menor para saber qué ocurría entre ambas jóvenes y solucionar el problema entre ellas.","Se tuvo una entrevista con la madre de la víctima para recabar toda la información posible. Se comprobó que las dos niñas tenían una rencilla desde hace dos años, y que este curso escolar la situación había empeorado. Se presentaron ambas denuncias por ambas partes; se celebró un juicio rápido y se dictaminó que no había delito. El centro educativo aplicó el protocolo de acoso.","Por decisión de la víctima el caso, se controlará a través de la inspección educativa de la provincia. Recientemente hemos conocido que en el colegio se vuelven a repetir los insultos por parte de la menor. El caso está en manos de la Consejería de educación.",2018-01-01T00:00:00+01:00,2018-01-01T00:00:00+01:00,Cádiz,Educación,Acoso discriminatorio,,https://informesdiscriminacion.gitanos.org/casos/c%C3%A1diz-educaci%C3%B3n-discriminaci%C3%B3n-directa-acoso
"Una chica de etnia gitana era discriminada por sus compañeros/as de clase. Desde el año pasado, la mayor parte del alumnado hacía comentarios racistas acerca de la comunidad gitana, tales como: “los gitanos venden droga”, “llevan armas encima”, “las casas de los gitanos están muy sucias”, “los padres de las niñas gitanas no las dejan estudiar”, etc. La chica víctima de esta situación estaba cansada de escuchar esta clase de comentarios, sus compañeros/as sabían que ella era gitana y ella ha tratado de hacerles saber que tienen una imagen errónea y estereotipada de la comunidad gitana; aun así, no cambiaban su comportamiento y su manera de pensar hacia ella y hacia las personas de etnia gitana. También se encontraba incómoda porque le hacían preguntas de ámbito privado, como por ejemplo por la práctica del pañuelo.","Se hizo una llamada telefónica al centro con la intención de contactar con la profesora de la chica y poder conocer más acerca de las situaciones. Durante la llamada la profesora confirmó que era cierto que varias alumnas y alumnos mostraban cierto rechazo hacia la etnia gitana. Finalmente realizamos una acción de sensibilización sobre derechos y no discriminación con el alumnado. Durante la jornada algunos alumnos y alumnas hicieron ciertos comentarios en los cuales manifestaban su desacuerdo con los contenidos que los técnicos de la FSG estaban exponiendo, quedando latente cierta reticencia hacia las personas gitanas.","Positivo. Actualmente la chica hace las prácticas del ciclo superior y dice que desde la jornada, no volvió a escuchar comentarios despectivos hacía las personas gitanas. Igualmente, el centro llamó a la técnica de igualdad para participar en su propio programa de radio, para hablar de la comunidad gitana y seguir colaborando con la FSG.",2018-01-01T00:00:00+01:00,2018-01-01T00:00:00+01:00,Almería,Educación,Acoso discriminatorio,,https://informesdiscriminacion.gitanos.org/casos/almer%C3%ADa-educaci%C3%B3n-acoso-discriminatorio
En un centro educativo de Guipúzcoa se separaba al alumnado gitano del no gitano en el comedor escolar.,"Ante esta segregación con un claro matiz de discriminación étnica, hablamos con el centro mostrando nuestro malestar. El centro educativo reconoció el error y dejó de separar al alumnado gitano. Actualmente comen todos y todas juntos, gitanos y no gitanos.",Positivo. La interlocución con el centro dio resultado.,2018-01-01T00:00:00+01:00,2018-01-01T00:00:00+01:00,Bizkaia,Educación,Discriminación directa,,https://informesdiscriminacion.gitanos.org/casos/san-sebasti%C3%A1n-educaci%C3%B3n-discriminaci%C3%B3n-directa
"Una joven estaba como alumna en una clase del Máster de Acceso a la Abogacía en la Universidad de Cáceres. En dicha clase se estaba tratando el tema de la minuta que debe recibir un abogado. El profesor puso de ejemplo un caso: “una mujer de Las Minas (barrio segregado de Cáceres) me llama a las 3 de la tarde porque habían detenido a su marido por tráfico de drogas”. Imitaba a la mujer con lo que se supone que es un “acento gitano”. Después de contar los hechos el profesor añadió: “cuidado con estas personas a la hora de pagar. Tengo un cliente gitano, que ese sí te paga muy bien porque es el patriarca”.","La joven decidió no realizar ninguna medida de actuación debido a la relación de poder en la que se encuentra frente al agente discriminador, siendo éste profesor y ella alumna. Una vez finalizada la asignatura que éste imparte, la víctima propone transmitirle su malestar por los comentarios realizados en clase.",A la espera del fin de la asignatura.,2018-01-01T00:00:00+01:00,2018-01-01T00:00:00+01:00,Cáceres,Educación,Discriminación directa,,https://informesdiscriminacion.gitanos.org/casos/c%C3%A1ceres-educaci%C3%B3n-discriminaci%C3%B3n-directa
"Una alumna explicó a la FSG que estaba realizando un grado medio de auxiliar de enfermería y que en clase uno de sus profesores se dirigía a ella como “la gitana”; “que responda la gitana”. Además, suspendió esa asignatura ese curso, lo que le ha obligado a estar dedicando todo el año a esa asignatura y no poder seguir con la asignatura del 2º curso. Se trata de la asignatura que impartía este profesor, que se jubilaba ese curso.","Tras contactar con la víctima, esta nos comentó que el profesor ya se había jubilado y que ya no quería realizar ningún trámite. Realizamos asesoramiento para que sepa reconocer una situación de discriminación si le vuelve a ocurrir y le informamos acerca del estatuto de la víctima y los derechos sobre igualdad de trato y no discriminación.",La víctima no quiso realizar ninguna acción.,2018-01-01T00:00:00+01:00,2018-01-01T00:00:00+01:00,Málaga,Educación,Discriminación directa,,https://informesdiscriminacion.gitanos.org/casos/m%C3%A1laga-educaci%C3%B3n-discriminaci%C3%B3n-directa-0
"Una niña gitana que estaba estudiando 2º de la ESO ha vivido situaciones discriminatorias por parte del centro. La niña todavía no disponía de libros puesto que no le habían concedido la beca escolar; una profesora de lengua le gritó por no llevar los libros y le dijo: “total para qué necesitas los libros, si no sacáis la ESO”. El suceso que agravó la situación fue cuando la tutora le requisó el móvil varios días. En jefatura de estudios, la niña pidió al jefe de estudios poder llamar a sus padres, pero recibió la amenaza de que se callara o que de lo contrario, se llamaría a la policía. Tras enterarse la familia, los padres acudieron al centro para poner en conocimiento que no le parecían adecuadas las formas y actitudes que se habían dado hacia su hija. Pero desde el centro no se les prestó ninguna atención. La familia consultó a la FSG para tomar medidas.","Derivamos el caso a la Oficina aragonesa contra la discriminación con la intención de que, como se trataba de un posible caso de discriminación en un ámbito público, la organización lo investigara. La Oficina aragonesa contra la discriminación se reunió con la FSG, para plantear las actuaciones necesarias. Nos reunimos con la directora y el secretario del centro como vía de actuación, y fue muy positivo. El centro admitió su culpabilidad, se comprometió a trabajar mejor por las familias y a dar formación para el profesorado en materia de discriminación.","Positivo. El compromiso del centro a mejorar, y el reconocimiento de errores satisfizo a la familia de la niña.",2018-01-01T00:00:00+01:00,2018-01-01T00:00:00+01:00,Zaragoza,Educación,Discriminación directa,,https://informesdiscriminacion.gitanos.org/casos/zaragoza-educaci%C3%B3n-discriminaci%C3%B3n-directa-0
"La FSG tuvo conocimiento de que no se había aplicado el protocolo de un centro escolar en un caso de problemas de hábitos de higiene de un alumno gitano. El centro tiene establecido que debería ser el tutor o tutora del menor quien debe notificar a los padres el problema y abordarlo desde ahí. Sin embargo, este caso lo estaba llevando la orientación del centro con terceros, sin comunicárselo directamente a la familia. Este trato diferente parecía discriminatorio.","Desde orientación educativa de la FSG se estableció una estrategia de investigación para verificar el protocolo. Vimos que es una familia que no ha tenido ningún problema con el centro y que la relación es buena, tanto con dirección como con el profesorado, por lo que no habría ningún motivo de conflicto previo para no informarla. En otros casos, el tutor o tutora lo comunica a la familia, pero en este caso no se ha aplicado. Se detectó buena intención por parte del centro que quería evitar que el menor pudiera sentirse discriminado, pero al no aplicar el protocolo como en el resto de casos el trato fue discriminatorio. Se propuso que se informara a la familia y seguir el protocolo establecido para estos casos. Desde el centro se citó a la familia y se ofreció acompañamiento.",Positivo. Se da una comunicación normal entre el centro y la familia.,2018-01-01T00:00:00+01:00,2018-01-01T00:00:00+01:00,A Coruña,Educación,Discriminación directa,,https://informesdiscriminacion.gitanos.org/casos/coru%C3%B1a-educaci%C3%B3n-discriminaci%C3%B3n-directa
"Una madre de Valverde de Leganés (Badajoz) nos explicó que sus hijos de 8 y 9 años, y sus primos de 9 y 13 años, todos ellos gitanos, venían sufriendo desde edades más tempranas rechazo de sus compañeros y compañeras de clase. No se querían sentar con ellos porque son gitanos y afirmaban que tienen piojos, en el recreo les dejaban solos a los cuatro menores. Esta situación ha llevado a su fracaso escolar y a que no quieran ir al colegio. La madre reclamó la atención del profesorado para llevar a cabo actividades de integración en clase o en el centro, pero no respondieron.",Intentamos contactar con la directora del centro para mediar en la situación. Mientras esperábamos respuesta la madre decidió cambiar a sus hijos de centro.,No hubo más acciones dado que los niños ya no están en el centro.,2018-01-01T00:00:00+01:00,2018-01-01T00:00:00+01:00,Badajoz,Educación,Discriminación directa,,https://informesdiscriminacion.gitanos.org/casos/badajoz-educaci%C3%B3n-discriminaci%C3%B3n-directa-0
En un centro educativo de Mérida se presentó la campaña “Partir de Cero “y la mayoría del profesorado le manifestó a la dirección del centro de manera directa que eran ellos (refiriéndose a las personas gitanas) quienes no se querían integrar.,Se sensibilizó al profesorado del centro y se colocó una campaña de sensibilización de la FSG en la puerta del colegio.,La dirección del centro mantuvo la campaña en el portal del centro educativo y durante todo el tiempo estuvo pendiente del desarrollo de la campaña y su impacto.,2018-01-01T00:00:00+01:00,2018-01-01T00:00:00+01:00,Badajoz,Educación,Discriminación directa,,https://informesdiscriminacion.gitanos.org/casos/m%C3%A9rida-educaci%C3%B3n-discriminaci%C3%B3n-directa-0
"Una joven gitana nos trasladó que estaba viviendo una situación constante de acoso en el aula por parte de la profesora. La joven confesó que en más de una ocasión se dirigió a ella de manera despectiva por ser gitana. De hecho, le dijo: “tú cállate que va a venir un gitano que te va hacer un bombo y luego te va a dejar”.",Desde la FSG se solicitó una reunión con la dirección del centro educativo y la familia para pedir explicación y denunciar el comportamiento y comentarios discriminatorios de la profesora con respecto a la joven.,La profesora se disculpó diciendo que estaba pasando por un momento personal muy malo y que lo pagó con la joven.,2018-01-01T00:00:00+01:00,2018-01-01T00:00:00+01:00,Badajoz,Educación,Discriminación directa,,https://informesdiscriminacion.gitanos.org/casos/m%C3%A9rida-educaci%C3%B3n-discriminaci%C3%B3n-directa
"En un instituto de educación secundaria de Salamanca, la jefa de estudios mandó como castigo al despacho de dirección a un alumno gitano de 1º de ESO. Allí se presentaron varios profesores/as y le dijeron al menor que tenía piojos a la vez que le miraban la cabeza. El centro decidió mandar al joven a su casa a la 13.30 horas de la tarde (antes de finalizar las clases) diciéndole que estaba expulsado por tener piojos. El menor acudió a su casa llorando y le dijo a sus padres que se sintió muy ofendido y avergonzado. Los padres inmediatamente acudieron al centro de salud para que un facultativo dictaminase si realmente su hijo tenía piojos. El facultativo les dio un informe en el que reflejaba que su hijo no tenía piojos. Al día siguiente, el padre llamó al centro y pidió hablar con la persona responsable que dijo que su hijo tenía piojos pero no le pasaron con ella. Solicitó el nombre y apellidos de la profesora o el profesor que acusó a su hijo de tener piojos y que además le envió a casa sin motivo alguno, para interponer una denuncia.",Se asesoró al padre acerca de las vías de reclamación disponibles y se intermedió con el centro.,El centro se disculpó y la familia las acepto. Manifestaron que estarían pendientes para que no volviera a ocurrir.,2018-01-01T00:00:00+01:00,2018-01-01T00:00:00+01:00,Salamanca,Educación,Discriminación directa,,https://informesdiscriminacion.gitanos.org/casos/salamanca-educaci%C3%B3n-discriminaci%C3%B3n-directa
"Una mujer contó la situación que estaba pasando su hija de seis años. Durante los primeros meses de colegio la niña recibió insultos por su condición étnica por parte de sus compañeros de clase en varias ocasiones. La madre contó que ella tuvo sospechas, que confirmó porque otra madre fue testigo de cómo le decían a la niña “gitana sucia” y otros descalificativos.","Se entrevistó a la madre, que contó que en el colegio no hay más alumnos gitanos y, según la madre, hay bastantes prejuicios hacía la comunidad gitana. El tutor estaba al corriente de lo que pasaba, pero no le daba importancia y decía que eran cosas de niñas y que no se integraba con sus compañeros. Se le ofreció hacer una mediación desde la FSG. La madre prefirió esperar porque le iban a cambiar de tutor. Se hizo seguimiento periódico de la situación de la niña. Le asignaron otra tutora. Finalmente, se acompañó a la madre a la tutoría para comentar la situación de discriminación que había vivido la niña con el objetivo de prevenir y evitar que se volvieran a repetir los hechos.","Positiva. La tutora se mostró muy atenta, receptiva e interesada tanto por la situación específica de la niña, como por el programa de atención a víctimas de discriminación racial o étnica. Además de prevenir a la tutora para que estuviera pendiente sobre el tema, desde la FSG se ofreció la posibilidad de realizar talleres de sensibilización con padres y madres o alumnado si lo considerase necesario. Desde entonces, la situación de la niña ha mejorado.",2018-01-01T00:00:00+01:00,2018-01-01T00:00:00+01:00,Sevilla,Educación,Discriminación directa,,https://informesdiscriminacion.gitanos.org/casos/sevilla-educaci%C3%B3n-discriminaci%C3%B3n-directa
"Un joven que estaba en un curso para inserción laboral fue acusado de robar de las taquillas tabaco y tarjetas del bus por parte de algunos compañeros del curso y del responsable. El propio encargado del curso le comentó que no acudiera más al mismo, sin tener autorización alguna. Finalmente, la víctima tuvo que dejar el curso debido al acoso que estaba sufriendo. La víctima explicó el caso a la FSG Zaragoza, sentía que le acusaban de robar por ser gitano.","Consultamos el caso con las mediadora de empleo que había preparado el curso. Esta persona comentó el caso con la empresa, que al principio no daba mucho crédito a la versión del joven gitano. Hablamos con la empresa y finalmente cambiaron de actitud, al no haber prueba ninguna de la autoría del hurto, y comprometiéndose a ofrecer plazas para inserción laboral.","Positivo. Ha sido un caso eficaz: la estrategia de actuación relacionada con la mediación, ha favorecido la respuesta positiva y el compromiso de reparar los daños ocasionados.",2018-01-01T00:00:00+01:00,2018-01-01T00:00:00+01:00,Zaragoza,Educación,Discriminación directa,,https://informesdiscriminacion.gitanos.org/casos/zaragoza-educaci%C3%B3n-discriminaci%C3%B3n-directa
"Un periódico publica un artículo alertando sobre las bandas juveniles de “rumanos y gitanos”, que se dedican a robar a los turistas. El artículo hace especial hincapié en que los niños y mujeres implicados “son todos de nacionalidad rumana y etnia gitana”, realizando una serie de comentarios cargados de prejuicios y estereotipos contra esta comunidad.",,,2005-01-01T00:00:00+01:00,2005-01-01T00:00:00+01:00,Madrid,Medios de comunicación,Sin especificar,,https://informesdiscriminacion.gitanos.org/casos/madrid-junio-discriminaci%C3%B3n-en-los-medios-de-comunicaci%C3%B3n
"La FSG recibe información sobre una oferta de empleo para poder cubrir una vacante por vacaciones para un puesto de limpiadora. Se envía el currículum de tres usuarias que cumplen el perfil y pueden aportar buenas referencias de otras empresas en las que han trabajado con anterioridad. Sin embargo, la empresa solicitante se niega a contratar gitanos, aduciendo que han tenido una mala experiencia anterior. Finalmente, gracias a la mediación de la FSG y una empresaria con la que se colabora habitualmente, se acaba contratando a una de las usuarias propuestas.",,,2005-01-01T00:00:00+01:00,2005-01-01T00:00:00+01:00,Huesca,Empleo,Sin especificar,,https://informesdiscriminacion.gitanos.org/casos/huesca-junio-discriminaci%C3%B3n-en-el-empleo
"Se publica en un diario un artículo escrito por un particular, en el que se incluyen una serie de comentarios prejuiciosos hacia la comunidad gitana, así como ciertas recriminaciones a la FSG sobre su fin social. La Fundación se pone en contacto con el autor, así como los responsables del medio, para recordarles la prohibición legal de difundir informaciones de carácter racista o discriminatorio.",,,2005-01-01T00:00:00+01:00,2005-01-01T00:00:00+01:00,Toledo,Medios de comunicación,Sin especificar,,https://informesdiscriminacion.gitanos.org/casos/talavera-de-la-reina-toledo-junio-discriminaci%C3%B3n-en-los-medios-de-comunicaci%C3%B3n
"La FSG firma un convenio de prácticas con un supermercado para formar a siete chicas como cajeras. Antes de finalizar el período de formación se decide contratar a dos de ellas, pero al recibir los responsables del supermercado una llamada anónima que acusa a las mismas de haber estado pasando carros sin cobrar y llevándose dinero de las cajas, deciden no hacerlo, a pesar de que se comprueba la falsedad de todas las informaciones, y de que las chicas cuentan con el apoyo de la Jefa de Cajeras y la FSG.",,,2005-01-01T00:00:00+01:00,2005-01-01T00:00:00+01:00,Barcelona,Empleo,Sin especificar,,https://informesdiscriminacion.gitanos.org/casos/sabadell-barcelona-junio-discriminaci%C3%B3n-en-el-empleo
"A raíz del fallecimiento de una mujer gitana, su familia interpuso una denuncia contra los médicos del hospital por presunta negligencia médica. Durante el procedimiento, uno de los médicos denunciados realizó una serie de declaraciones refiriéndose a la actitud de la familia de la fallecida que, según su versión, amenazó de muerte, insultó e intentó agredir al personal del centro hospitalario. Los familiares aludidos, entre los que se encuentra un trabajador de la FSG, niegan rotundamente los hechos, por lo que la entidad escribe una carta al Director del Centro solicitando más información al respecto, aunque dicha carta no recibe contestación alguna.",,,2005-01-01T00:00:00+01:00,2005-01-01T00:00:00+01:00,Madrid,Salud,Sin especificar,,https://informesdiscriminacion.gitanos.org/casos/madrid-junio-discriminaci%C3%B3n-en-los-servicios-sanitarios
"En el Foro de ONG preparatorio de la Conferencia Internacional de la OSCE en Córdoba, se incluye un espacio de análisis y debate sobre discriminación y comunidad gitana. En su discurso de clausura, el Presidente de la Junta de Andalucía menciona las diferentes formas de discriminación posibles, al igual que los principales grupos sociales que las padecen, olvidando sólo a los gitanos. Al concluir su intervención, representantes de la FSG y otras asociaciones gitanas le muestran su descontento, por lo que el Presidente pide disculpas.",,,2005-01-01T00:00:00+01:00,2005-01-01T00:00:00+01:00,Sevilla,Acceso a bienes y servicios,Sin especificar,,https://informesdiscriminacion.gitanos.org/casos/sevilla-junio-discriminaci%C3%B3n-en-los-bienes-y-servicios
"Cuando tres mujeres gitanas acuden a desayunar a una cafetería, la camarera les exige la tarjeta de la seguridad social como requisito para servirles la consumición. Al no tenerla, deciden abandonar el establecimiento, pero antes intentan comprar una bolsa de patatas. La camarera afirma no tener ese producto, aunque detrás del mostrador hay una estantería repleta. La FSG escribe una carta al establecimiento informando de que ese tipo de prácticas son discriminatorias e ilegales, tras lo cual no vuelve a producirse ningún incidente.",,,2005-01-01T00:00:00+01:00,2005-01-01T00:00:00+01:00,Albacete,Acceso a bienes y servicios,Sin especificar,,https://informesdiscriminacion.gitanos.org/casos/hell%C3%ADn-albacete-junio-discriminaci%C3%B3n-en-los-bienes-y-servicios
"Se publica en un periódico una noticia referente a la actuación de un policía local que tuvo que intervenir en una pelea que involucraba a más de quince personas. Tanto en el titular como en la descripción del suceso, de marcado contenido violento, se especifica que “todas ellas eran de raza gitana”.",,,2005-01-01T00:00:00+01:00,2005-01-01T00:00:00+01:00,Ourense,Medios de comunicación,Sin especificar,,https://informesdiscriminacion.gitanos.org/casos/orense-junio-discriminaci%C3%B3n-en-los-medios-de-comunicaci%C3%B3n
"Una pareja de jóvenes gitanos contactan por teléfono con una agencia inmobiliaria y acuerdan la visita a un piso disponible en alquiler. Cuando la empleada con la que habían contactado telefónicamente comprueba que son gitanos, niega que el piso esté libre y les comunica que su precio es tres veces superior al que les había mencionado con anterioridad. Tras una breve discusión, termina reconociendo que muchos de sus clientes no quieren alquilar sus viviendas a personas gitanas.",,,2005-01-01T00:00:00+01:00,2005-01-01T00:00:00+01:00,Huesca,Vivienda,Sin especificar,,https://informesdiscriminacion.gitanos.org/casos/huesca-junio-discriminaci%C3%B3n-en-la-vivienda
"Una niña, totalmente integrada en la dinámica escolar, comienza a sufrir acoso (insultos, peleas, etc.) por parte de sus compañeros cuando declara que es gitana. A pesar de que el centro pone en marcha diversas medidas para solucionar el problema, la familia acaba solicitando el traslado, por expreso deseo de la menor, que se encuentra muy afectada, y cuyas calificaciones se ven muy resentidas tras los incidentes.",,,2005-01-01T00:00:00+01:00,2005-01-01T00:00:00+01:00,Jaén,Educación,Sin especificar,,https://informesdiscriminacion.gitanos.org/casos/ja%C3%A9n-junio-discriminaci%C3%B3n-en-la-educaci%C3%B3n
"Una familia gitana organiza con frecuencia en su domicilio reuniones de carácter religioso a las que acuden otras familias gitanas. Un vecino, que siempre se había mostrado reacio a las reuniones, insultando y haciendo comentarios racistas sobre los asistentes, presenta una denuncia por injurias y amenazas, tras discutir con varios de ellos. Los afectados interponen también una denuncia ante la Guardia Civil, aunque el enfrentamiento termina resolviéndose de manera amistosa mediante conciliación judicial.",,,2005-01-01T00:00:00+01:00,2005-01-01T00:00:00+01:00,Granada,Vivienda,Sin especificar,,https://informesdiscriminacion.gitanos.org/casos/granada-mayo-discriminaci%C3%B3n-en-la-vivienda
"Con ocasión de la Feria de Córdoba, un grupo de mujeres gitanas es expulsado de una caseta por uno de los camareros, que alegaba que su Jefe “le había ordenado echarlas por ser gitanas”. Las mujeres, asesoradas por la FSG, interponen denuncia ante la Policía Nacional. A pesar de abrirse diligencias, la Audiencia Provincial de Córdoba resuelve desfavorablemente y cierra la investigación por no disponer de pruebas suficientes que justifiquen los hechos denunciados.",,,2005-01-01T00:00:00+01:00,2005-01-01T00:00:00+01:00,Córdoba,Acceso a bienes y servicios,Sin especificar,,https://informesdiscriminacion.gitanos.org/casos/c%C3%B3rdoba-mayo-discriminaci%C3%B3n-en-los-bienes-y-servicios
