hechos,intervencion,resultado,fecha_hechos,fecha_denuncia,provincia,ambito,tipo_desciminacion,reference
"El propietario de una vivienda informa a un matrimonio gitano, con los que había firmado un contrato de alquiler hacía unos días, de que dicho contrato no es válido, por lo que tienen que devolver las llaves de la vivienda. Los afectados acuden a la FSG, que contacta con el propietario para pedir explicaciones. El propietario confiesa que, al ser un piso de protección oficial, y no haber transcurrido el tiempo necesario para alquilarlo, habló con los vecinos, pero estos se opusieron, y amenazaron con denunciarlo, si alquilaba la vivienda a personas gitanas.",,,2006-01-01T00:00:00+01:00,2006-01-01T00:00:00+01:00,Lugo,Vivienda,Sin especificar,
"Una trabajadora gitana de la FSG acude a una tienda de ropa, coincidiendo en la puerta con un grupo de cinco jóvenes que salen del establecimiento. En ese momento, la alarma de seguridad suena, y la dependienta se dirige, rápidamente y de malas maneras, hacia la mujer gitana, a quien registra el bolso sin encontrar ningún artículo, puesto que ni siquiera había entrado en la tienda. Las cinco jóvenes no gitanas abandonan el establecimiento sin problemas.",,,2006-01-01T00:00:00+01:00,2006-01-01T00:00:00+01:00,Zaragoza,Acceso a bienes y servicios,Sin especificar,
"Una juez dicta orden de registro en varios domicilios de diferentes puntos de España por existir indicios sobre un presunto delito contra el patrimonio, por falsificación de obras de arte. Sólo en los domicilios pertenecientes a una misma familia gitana, la policía judicial actúa de una manera improcedente, haciendo uso desproporcionado de la fuerza y provocando lesiones a los miembros de la familia, contra quienes dirigen insultos de marcado contenido racista. La FSG presenta, junto a la denuncia del abogado de la familia, un informe que valora los hechos en virtud de la normativa anti-discriminatoria. El caso sigue pendiente de resolución.",,,2006-01-01T00:00:00+01:00,2006-01-01T00:00:00+01:00,Córdoba,Servicios policiales,Sin especificar,
"El propietario de una vivienda en alquiler, cuando se percata del origen étnico de la familia que va a entrar a vivir en la misma, les exige disponer de contrato de trabajo indefinido, a sabiendas de que no disponen del mismo. Además, se trata de un requisito que, según la agencia inmobiliaria, no se ha exigido a nadie más. Para arreglar la situación, la FSG propone a la agencia inmobiliaria que el propietario hable directamente con el jefe del trabajador gitano que quiere alquilar el piso, y que accede a recomendarle, pero el propietario no cede. Finalmente, la familia decide no iniciar ninguna actuación legal y consigue alquilar otra vivienda.",,,2006-01-01T00:00:00+01:00,2006-01-01T00:00:00+01:00,Murcia,Vivienda,Sin especificar,
"Siete personas gitanas y ocho no gitanas se presentan a una prueba de selección del Ayuntamiento de la localidad para acceder a un puesto de trabajo de señalización viaria. Reuniendo todos los presentes los mismos requisitos para ser seleccionados, en la lista de admisión figuran solamente los ocho no gitanos, siendo los candidatos gitanos los únicos excluidos. Tras serles denegado el derecho a revisar la prueba realizada, los aspirantes gitanos acuden a la FSG en busca de asesoramiento. Finalmente, a pesar de los intentos de mediación realizados por los trabajadores de la entidad, los trabajadores deciden no seguir adelante por miedo a posibles represalias de cara a contrataciones futuras.",,,2006-01-01T00:00:00+01:00,2006-01-01T00:00:00+01:00,Lugo,Empleo,Sin especificar,
"Un empresario gitano acude a solventar un conflicto creado entre un empleado suyo y la policía local, por un camión mal aparcado. En ese momento, aparecen seis patrullas que acaban arrestando al empresario. Una vez en el calabozo, recibe una paliza en medios de insultos racistas como “gitanos de mierda, que os habéis creído”, que le provoca un esguince cervical y lesiones en el brazo donde tenía colocada una prótesis. Tras ser puesto en libertad, la víctima acude a la FSG solicitando asesoramiento, pero finalmente decide no denunciar los hechos por miedo a posibles represalias.",,,2006-01-01T00:00:00+01:00,2006-01-01T00:00:00+01:00,Alicante,Servicios policiales,Sin especificar,
"Cuando un usuario de la FSG acude a una empresa para comenzar su primer día de trabajo como repartidor de publicidad, tal y como había acordado telefónicamente, le informan de que el puesto ha sido cubierto por otra persona. Tanto el propio interesado como la FSG comprueban que no es cierto, y que la vacante se cubre varias horas después. Los intentos de mediación de la FSG no producen resultados favorables, por lo que se escribe una carta a la dirección de la empresa exigiendo que adopte las medidas necesarias para acabar con este tipo de prácticas discriminatorias. La empresa pide disculpas por las molestias ocasionadas al trabajador por lo que considera un malentendido, pero sigue negando la existencia de discriminación.",,,2006-01-01T00:00:00+01:00,2006-01-01T00:00:00+01:00,Alicante,Empleo,Sin especificar,
"Tres jóvenes gitanas realizan un curso de dependiente de comercio en el marco del Programa de empleo Acceder de la FSG. Sin embargo, en el momento de realizar sus prácticas, encuentran problemas en dos comercios con los que la FSG había firmado un convenio de colaboración que el año anterior se había desarrollado con normalidad. En una de las tiendas afirman que “la clientela es muy pija y no les molesta ver a este tipo de chicas limpiando, pero no quieren que les atiendan”. En la otra, se argumenta que “venden pantalones de 150 a 190 €, y la imagen que da la muchacha perjudica el negocio”. La FSG inicia una mediación que concluye sin resultado satisfactorio y, tras informar a la propietaria por escrito de las consecuencias legales de la discriminación, no emprende otras medidas por expreso deseo de las víctimas.",,,2006-01-01T00:00:00+01:00,2006-01-01T00:00:00+01:00,Valencia,Empleo,Sin especificar,
