hechos,intervencion,resultado,fecha_hechos,fecha_denuncia,provincia,ambito,tipo_desciminacion,reference,link
"Con motivo de la presentación de la campaña de sensibilización “Partir de Cero” de la FSG, el periódico digital Salamanca24horas publicó una noticia que generó un foro en torno a la campaña en el que se registraron y publicaron un total de 25 comentarios en su gran mayoría discriminatorios y racistas hacia las personas gitanas. Algunos de los comentarios fueron: 
“Discriminación?, desventaja? Pero eso de donde lo habéis sacado,desventaja tenemos los que tenemos que estar todo el día currando,y ganamos 1000 euros,ellos eso lo tienen de ayudas,y 4 bragas en el rastro y a vivir,abramos los ojos de una vez.Cuantos trabajan? Y es porque no quieren. “Me rio yo de la discriminación: PENSIONES SIN COTIZAR. SUBVENCIONES A PUNTA PALA. ASISTENCIA SANITARIA ENCIMA DE NO HABER COTIZADO NI UN PUTO EURO EXIGIENDO Y ABUSANDO. ETC.” “Siempre me he preguntado qué hace tanto gitano en Salamanca con lo poco que se los quiere y el frío que hace, con lo bien que estarían en Andalucía, por poner un ejemplo” “Estoy harto de mantenerlos. Mientras yo me planteo si puedo tener otro hij@ porque no sé si podré mantenerlo, ellos tienen al menos cinco, porque se los mantengo yo, yo con mi trabajo, mis once o doce horas diarias de trabajo como autónomo, mientras que ellos solo se preocupan de que la asistenta social les solucione las paguitas y alquileres sociales, pero yo todso el dia pelando la pava...así nos va. Vagos. Antisociales, insolidarios...tan solo unos adjetivos amables para describir a cierto colectivo” “El 99% de las personas sabemos que esto de la integración gitana es el cuento más grande que te pueden contar. Ese debe ser el cuento a leer. Decía un maestro mío que a los gitanos no les interesaba la integración, porque tendrían que ganarse el pan que su sudor. No nos contéis más películas PP PSOE PODEMITAS”.
","Desde el Departamento de Igualdad de la FSG se envió un correo de queja al medio solicitándole que eliminase los comentarios reportados, ya que claramente incitaban a la discriminación y al odio hacia la comunidad gitana.",No se obtuvo respuesta del medio ni se eliminaron los comentarios antigitanos.,2018-01-01T00:00:00+01:00,2018-01-01T00:00:00+01:00,Salamanca,Medios de comunicación,Discriminación directa,['http://www.salamanca24horas.com/texto-diario/mostrar/1034088/partir-cero-jornada-ponerfoco-sobre-discriminacion-sufren-personas-gitanas'],https://informesdiscriminacion.gitanos.org/casos/salamanca-medios-de-comunicaci%C3%B3n-e-internet-discriminaci%C3%B3n-directa
La Voz de Galicia publicó una noticia sobre una detención policial en un barrio de Lugo. En el cuerpo de la noticia se mencionaba que los delincuentes eran de etnia gitana.,Se envió carta de queja al medio.,Negativo. No hubo respuesta ni modificaron la noticia online.,2018-01-01T00:00:00+01:00,2018-01-01T00:00:00+01:00,Lugo,Medios de comunicación,Discriminación directa,['https://www.lavozdegalicia.es/noticia/lugo/2018/03/08/apedrean-carqueixo-patrulla-policia-nacional-iba-detener-requisitoriado/00031520545634401681590.htm'],https://informesdiscriminacion.gitanos.org/casos/lugo-medios-de-comunicaci%C3%B3n-discriminaci%C3%B3n-directa-3
"La Voz de Galicia publicó una noticia sobre nuevos vigilantes en los mercadillos de Vigo. En la noticia se menciona un caso antiguo de violencia entre familias, donde se menciona la etnia de las mismas: “El tiroteo de 29 octubre del 2015 entre dos clanes gitanos enfrentados por el control de los mercadillos de la ciudad transformó de forma radical la venta ambulante en la ciudad.",Se envió carta de queja al medio.,Negativo. No hubo respuesta.,2018-01-01T00:00:00+01:00,2018-01-01T00:00:00+01:00,Pontevedra,Medios de comunicación,Discriminación directa,['https://www.lavozdegalicia.es/noticia/vigo/vigo/2018/03/11/concello-pondra-vigilantes-mercadillos-ciudad/0003_201803V11C2991.htm'],https://informesdiscriminacion.gitanos.org/casos/vigo-medios-de-comunicaci%C3%B3n-discriminaci%C3%B3n-directa-0
En la noticia publicada en Noticias de Álava con el titular “Liberadas dos menores rumanas tras ser vendidas por su familia por 20.000 euros” aparecía la mención a la etnia gitana de la familia sujeto de esta noticia.,"Se envió carta de queja al medio, haciendo llegar nuestro malestar, por las consecuencias negativas que éste tipo de publicación hace a la comunidad gitana.",Negativo. No hubo respuesta del medio.,2018-01-01T00:00:00+01:00,2018-01-01T00:00:00+01:00,Álava,Medios de comunicación,Discriminación directa,['http://www.noticiasdealava.eus/2018/03/04/sociedad/liberadas-dos-menores-tras-ser-vendidaspor-20000-euros'],https://informesdiscriminacion.gitanos.org/casos/%C3%A1lava-medios-de-comunicaci%C3%B3n-discriminaci%C3%B3n-directa
En la noticia publicada en Diario de Almería en fecha del 7 de marzo de 2018 con el título: “Liberadas dos menores rumanas tras ser vendidas por su familia por 20.000 euros” aparecía la mención a la etnia gitana de la familia sujeto de esta noticia.,"Se envió una carta al director del periódico. Su contestación ha sido la siguiente: 
“Estimada Sra.: Lamento enormemente la redacción de la información. No está en nuestro ADN dar nacionalidades en temas de sucesos, pero hay ocasiones que se nos pasan. Creemos en las personas y no nos importa ni su raza, ni su credo, ni su religión. Espero que no vuelva a producirse. Afectuosamente. Un saludo”.
",Positivo. Se enviaron disculpas y se cambió la redacción de la noticia.,2018-01-01T00:00:00+01:00,2018-01-01T00:00:00+01:00,Almería,Medios de comunicación,Discriminación directa,,https://informesdiscriminacion.gitanos.org/casos/almer%C3%ADa-medios-de-comunicaci%C3%B3n-discriminaci%C3%B3n-directa-0
"El Ideal Gallego publicó una noticia sobre una venta de menores por parte de una familia. En la noticia se mencionaba que los padres eran gitanos rumanos: “clanes de etnia gitana y nacionalidad rumana a los que pertenecían los implicados” Además, tanto el titular como los comentarios aludían a esto como una práctica habitual. El titular, la imagen de la supuesta detención y los términos como “matrimonio forzado” o “clanes”, resultaban sensacionalistas y perpetuaban la estigmatización de toda la comunidad.",Se envió carta vía correo electrónico al medio,Negativo. No hubo respuesta.,2018-01-01T00:00:00+01:00,2018-01-01T00:00:00+01:00,A Coruña,Medios de comunicación,Discriminación directa,['https://www.elidealgallego.com/articulo/sociedad/liberan-menores-ser-vendidas-20000-euroshermana-casarlas/20180303215113366823.html'],https://informesdiscriminacion.gitanos.org/casos/santiago-de-compostela-medios-de-comunicaci%C3%B3n-discriminaci%C3%B3n-directa
"La Voz de Galicia publicó una noticia sobre un robo. En el cuerpo de la noticia, debajo del titular, como subtítulo aparecía nombrado el poblado gitano llamado Carqueixo. A continuación en la noticia se mencionaba que los presuntos autores del robo eran gitanos.",Este día se envió una carta de recomendaciones al personal responsable y a dirección. En ella se recomendaba el uso de una buena praxis periodística en la cual no se nombre la etnia o la nacionalidad de las personas implicadas porque dañan la imagen de la comunidad en general.,Negativo. No se ha modificado la noticia.,2018-01-01T00:00:00+01:00,2018-01-01T00:00:00+01:00,Lugo,Medios de comunicación,Discriminación directa,['https://www.lavozdegalicia.es/noticia/lugo/castroverde/2018/03/08/roban-nave-castroverdepleno-dia-delante-propietarios/0003_201803L8C7995.htm'],https://informesdiscriminacion.gitanos.org/casos/lugo-medios-de-comunicaci%C3%B3n-discriminaci%C3%B3n-directa-2
"Noticia publicada por agencia EFE y difundida en Alto Aragón, Deia, Diario de Álava, Diario de Sevilla, El Día de Córdoba, El Diario de Almería, El diario de Cádiz, El diario de Jerez, El diario de Pontevedra, El diario Vasco, El Heraldo de Aragón, El Ideal Gallego, El Norte de Castilla, Granada Hoy, Huelva información, La mañana diari de ponent, La Tribuna de Albacete, Málaga Hoy. El titular de la noticia era “Liberadas dos menores tras ser vendidas por su hermana por 20.000 euros”. En el desarrollo de la noticia se aludía en varias ocasiones a la nacionalidad rumana y a la etnia gitana de las personas que vendieron a las menores, así como a quienes se las vendieron, infiriéndose que las menores también eran gitanas rumanas. Por lo que se vinculaba la nacionalidad y la etnia a un acto delictivo sin que esto añada ninguna información relevante a la noticia. Al hilo de la noticia se publicaron comentarios de este tipo; “Hay que respetar sus tradiciones??”, “¿Cómo es posible que un alcalde español, pueda decir que esos individuos se encuentran integrados?......Si no trabajan, ¿de que viven? ¿de robar? ¿de mendigar? ¿De recibir subvenciones?......” Fomentando el discurso de odio hacia la comunidad gitana.","Se enviaron cartas a estos medios. El Director del Diario de Cádiz contestó que ya se había quitado la noticia de las cabeceras de los diarios y el Director del Diario de Jerez contestó que se ha reenviado la carta a los responsables de EFE. Igualmente, se envió carta a la Agencia de Noticias EFE, como fuente original y por la repercusión que la noticia había tenido a nivel nacional y el impacto negativo en la Comunidad gitana. Se recibió mensaje del Director de la Agencia: “Acuso recibo de su carta, que estudiaremos con atención”.",Positivo. Se eliminó la referencia a la etnia en todos los medios.,2018-01-01T00:00:00+01:00,2018-01-01T00:00:00+01:00,Estatal,Medios de comunicación,Discriminación directa,,https://informesdiscriminacion.gitanos.org/casos/estatal-medios-de-comunicaci%C3%B3n-discriminaci%C3%B3n-directa-2
"Un usuario de FOROCOCHES, comenzó un hilo con el título “Por qué ALGUNOS GITANOS son tan ESCORIA”, contando una mala experiencia con una persona de etnia gitana. A raíz de esto, se desataron una serie de comentarios discriminatorios que incitaban claramente al odio contra la comunidad gitana. Algunos de los comentarios: -Todos quemados en la hoguera y los moros igual -Hitler limpió un poco pero… -Los gitanos... si a tito Adolf le hubieran dejado hacer su trabajo no te hubiera pasado esto -Ahora resulta que la basura gitana es una raza… -Hitler tenía razón con ellos. -Hoy Alemania es mucho mejor país, no como nosotros. -Llamarles seres humanos es pasarse ya, no compares a los humanos con esos subseres. -A la hoguera todos. -Y para evitar que se reproduzcan habría que castrar. -Los gitanos son basura sin excepción.","Presentamos la denuncia de los hechos ante la fiscalía provincial de Albacete, junto con las capturas de los comentarios y el nombre de los usuarios que realizan dichos comentarios.",La Fiscalía ofició a la policía nacional para localizar la página web y a los usuarios de dichos comentarios. Estamos esperando resolución del Juzgado.,2018-01-01T00:00:00+01:00,2018-01-01T00:00:00+01:00,Albacete,Redes sociales,Discriminación directa,['https://m.forocoches.com/foro/misc.php?do=page&template=Info&tid=6183602'],https://informesdiscriminacion.gitanos.org/casos/albacete-redes-sociales-discriminaci%C3%B3n-directa
"La Voz de Galicia publicó una noticia sobre un atropello en el cual las víctimas son dos mujeres gitanas, quienes fueron auxiliadas por dos policías de paisano que, al darse cuenta de que son de familias gitanas, toman precauciones para proteger al conductor que ocasionó el accidente. La noticia narra que aparecieron 12 personas y las nombra como clan gitano que increpa al conductor.",Se recogió el enlace de la noticia como prueba y se envió al medio una carta de recomendaciones y un correo dirigido a la persona que lo firmaba ya que se ha comprobado que esta persona suele redactar de esta forma las noticias referidas a personas gitanas.,Negativo. No hubo respuesta.,2018-01-01T00:00:00+01:00,2018-01-01T00:00:00+01:00,Lugo,Medios de comunicación,Discriminación directa,['https://www.lavozdegalicia.es/noticia/lugo/lugo/2018/03/01/tres-policias-locales-fuera-servicioauxilian-dos-gitanas-evitan-trifulca/00031519938294472112534.htm'],https://informesdiscriminacion.gitanos.org/casos/lugo-medios-de-comunicaci%C3%B3n-discriminaci%C3%B3n-directa-1
Valencia. Medios de comunicación. Discriminación directa. Este medio se caracteriza por publicar noticias falsas criminalizando a la comunidad gitana.,Se envió una carta de queja al medio en cuestión.,Negativo. No retiran la noticia y se limitan a publicar textualmente la carta que se les remitió desde la FSG.,2018-01-01T00:00:00+01:00,2018-01-01T00:00:00+01:00,Valencia,Medios de comunicación,Discriminación directa,['https://www.mediterraneodigital.com/sociedad-y-tiempo-libre/ultimas-noticias-sociedad-ytiempo-libre/st2/condenado-un-clan-de-gitanos-que-provocaba-accidentes-con-ninos-para-estafar-a-losseguros.html'],https://informesdiscriminacion.gitanos.org/casos/valencia-medios-de-comunicaci%C3%B3n-discriminaci%C3%B3n-directa
"Los periódicos ABC Andalucía, ABC Córdoba y ABC Sevilla y en El Español publicaron una noticia de Chilluévar (Jaén) por la violación de un niño de 9 años por parte de otros menores entre 12 y 14 años. En la noticia se menciona directamente la etnia de los menores supuestos agresores son gitanos. En ABC Andalucía citan lo siguiente “Junto al Ayuntamiento, un anciano y una mujer de mediana edad hablan del tema del día: la presunta violación de un niño de 9 años, de origen magrebí, perpetrada por un grupo de cuatro menores de etnia gitana en el colegio público donde estudian los cinco”. Y en la noticia de El Español citan textualmente “Según cuenta R., a los cuatro menores, todos de etnia gitana, se les acusa de acosar, pegar, insultar, escupir y agredir sexualmente dentro del centro educativo a un niño de nueve años cuya familia reside en el pueblo y es de origen extranjero”. En la noticia de ABC Andalucía se pueden observar comentarios racistas por parte de los lectores “Cuatro acosadores, de etnia gitana, luego los políticamente correctos dirán que es un hecho aislado (otro más), que no hay que estigmatizar zonas y etnias, y demás engaños que impiden tomar medidas eficaces contra la violencia y el acoso escolar”. Y otro comentario “no entiendo por qué no publican el origen de los menores… si ese es el origen… el de siempre”.",Se envió una carta de queja al director del periódico ABC Andalucía y al periódico “El Español” explicando la mala praxis de mencionar la etnia en estas noticias.,Negativo. No hubo respuesta de los medios.,2018-01-01T00:00:00+01:00,2018-01-01T00:00:00+01:00,Jaén,Medios de comunicación,Discriminación directa,,https://informesdiscriminacion.gitanos.org/casos/ja%C3%A9n-medios-de-comunicaci%C3%B3n-discriminaci%C3%B3n-directa-0
"El periódico La Voz de Galicia publicó una noticia sobre una recogida de perros maltratados, donde mencionaba en el titular que se trataba de “un poblado gitano”. Esta referencia a la etnia no aportaba nada a la noticia, pero estigmatizaba al pueblo gitano identificándolo con el maltrato animal y con la pobreza.",Se envió una carta de queja al medio explicando la mala práctica de dicho titular.,"Negativo, no se obtuvo respuesta del medio ni se retiraron las menciones a la etnia.",2018-01-01T00:00:00+01:00,2018-01-01T00:00:00+01:00,Lugo,Medios de comunicación,Discriminación directa,['https://www.lavozdegalicia.es/noticia/galicia/2018/02/09/policia-local-lugo-recoge-nueve-perros-maltratados-poblado-gitano-carqueixo/0003_201802G9P8993.htm'],https://informesdiscriminacion.gitanos.org/casos/lugo-medios-de-comunicaci%C3%B3n-discriminaci%C3%B3n-directa-0
"El medio Noticias de Vigo publicó en enero de 2018 una noticia sobre una violación, en la que mencionaba la pertenencia étnica gitana del presunto violador.","Se envió carta de queja a dicho medio, explicando la mala praxis de incluir la etnia, y el daño que eso hace a la imagen de la comunidad gitana. A los pocos días respondieron del medio pidiendo disculpas y retiraron la referencia a la etnia.","Positivo, la versión on line fue modificada y se eliminó la pertenencia étnica.",2018-01-01T00:00:00+01:00,2018-01-01T00:00:00+01:00,Pontevedra,Medios de comunicación,Discriminación directa,['https://www.noticiasvigo.es/detenido-retener-casa-una-mujer-mes-violarla/'],https://informesdiscriminacion.gitanos.org/casos/vigo-medios-de-comunicaci%C3%B3n-discriminaci%C3%B3n-directa
"La Fundación Secretariado Gitano desde el dispositivo de Murcia, fue etiquetada con su perfil en la red social Facebook, en un vídeo en el que se representaba una boda gitana en un desfile celebrando el día de carnaval en una pedanía de la Región. Dicho vídeo reproducía, escenificando a través de personas reales, prácticas ancestrales relacionadas con la celebración de una boda gitana. Tal representación presentaba tintes discriminatorios, ya que ha sido representada de forma peyorativa, con burlas hacia la comunidad gitana y hacia algunos rasgos que conforman la cultura ancestral del pueblo gitano.","Solicitamos la retirada de la etiqueta FSG Murcia en el perfil en Facebook, y en efecto fue desetiquetada del vídeo. Seguidamente se ha reportó a Facebook la publicación del vídeo, como delito que incita al odio, pero Facebook no retiró el video.","Negativo, ya que aunque se retiró la etiqueta, el vídeo se mantiene en la red.",2018-01-01T00:00:00+01:00,2018-01-01T00:00:00+01:00,Murcia,Redes sociales,Discriminación directa,,https://informesdiscriminacion.gitanos.org/casos/murcia-redes-sociales-discriminaci%C3%B3n-directa
"El periódico Diario Sur publicó una noticia sobre una pelea en Coín, señalando la pertenencia étnica de las personas implicadas, algo que no era necesario para la comprensión de la noticia.",Desde la FSG de Málaga se envió una carta de queja solicitando la retirada de la noticia de la web.,"Positivo, la noticia fue retirada de la web.",2018-01-01T00:00:00+01:00,2018-01-01T00:00:00+01:00,Málaga,Medios de comunicación,Discriminación directa,['https://www.diariosur.es/interior/investigan-violenta-pelea-20181001142348-nt.html'],https://informesdiscriminacion.gitanos.org/casos/m%C3%A1laga-medios-de-comunicaci%C3%B3n-discriminaci%C3%B3n-directa
El 22 de enero en la edición en papel del periódico El Mundo publicó la noticia del doble crimen en Bilbao. En la noticia se podía leer la pertenencia a la etnia gitana de los detenidos.,"Se envió carta de queja a dicho medio, explicando la mala praxis de incluir la etnia, y el daño que eso hace a la imagen de la comunidad gitana.",Negativo. Ni se respondió a la carta ni se eliminó la mención a la etnia gitana.,2018-01-01T00:00:00+01:00,2018-01-01T00:00:00+01:00,Bizkaia,Medios de comunicación,Discriminación directa,,https://informesdiscriminacion.gitanos.org/casos/bilbao-medios-de-comunicaci%C3%B3n-discriminaci%C3%B3n-directa
"En enero de 2018 en los medios de comunicación Diario de Navarra y Diario de Noticias de Navarra se publicó una noticia sobre el asesinato de dos ancianos en Bilbao. En la noticia aparecían la mención a la etnia gitana de dos jóvenes menores, presuntos autores del hecho, algo que perjudica la imagen del pueblo gitano y que es irrelevante.","Se enviaron cartas de queja a ambos medios. Diario de Noticias de Navarra llamó a la sede de FSG en Navarra para informar que iban a eliminar la mención a la etnia. Posteriormente, se comprobó que se había hecho efectivo.","Positivo, se retiró la referencia a la etnia de los acusados.",2018-01-01T00:00:00+01:00,2018-01-01T00:00:00+01:00,Navarra,Medios de comunicación,Discriminación directa,,https://informesdiscriminacion.gitanos.org/casos/pamplona-medios-de-comunicaci%C3%B3n-discriminaci%C3%B3n-directa
"A partir del asesinato de unos ancianos en Bilbao, se publicaron noticias en diferentes medios de comunicación y redes sociales que aludían a la etnia gitana de los menores supuestos homicidas. Esta mención étnica colabora a la creación y mantenimiento de estereotipos que relacionan directa o indirectamente a la comunidad gitana con el crimen y la violencia.","Se investigaron redes sociales y noticias publicadas en diferentes medios de comunicación para comprobar posibles comentarios discriminatorios y se comprobó que en varios de ellos había comentarios de odio antigitano. Destacaba en especial la página Facebook del medio “Caso Aislado”, donde aparecieron comentarios en relación a la noticia que podrían suponer un delito de odio, ya que se trataba de comentarios graves que incitaban a la violencia contra las personas gitanas, además de deshumanizarlas, atentando contra su dignidad. En relación a los comentarios vertidos en el Facebook del medio Caso Aislado, se redactó una denuncia por discurso de odio que se presentó ante la Fiscalía, tras lo cual se abrieron Diligencias Previas por parte de un Juzgado de instrucción.",Pendiente. El procedimiento penal sigue abierto.,2018-01-01T00:00:00+01:00,2018-01-01T00:00:00+01:00,Toledo,Redes sociales,Discurso de odio,['https://www.facebook.com/CasoAislado.noticias/videos/2012705495651664/'],https://informesdiscriminacion.gitanos.org/casos/talavera-de-la-reina-medios-de-comunicaci%C3%B3n-y-redes-sociales-discurso-de-odio
"En enero de 2018 en La Tribuna de Cartagena se publicó una noticia sobre el asesinato de dos ancianos en Bilbao. En la noticia aparece la mención a la etnia gitana de dos jóvenes menores, presuntos autores del hecho, algo que perjudica la imagen del pueblo gitano y que es irrelevante.","Se envió una carta a la Dirección del periódico. En dicha carta, se les señaló que la noticia recogida en su diario el día 22/01/2018 constituía una mala praxis periodística, ya que mencionar la etnia en una noticia de este tipo, no aporta nada de información relevante a la noticia, realizando una descripción de los jóvenes que promueve el discurso de odio.","Positivo, la noticia fue retirada de la versión on line.",2018-01-01T00:00:00+01:00,2018-01-01T00:00:00+01:00,Murcia,Medios de comunicación,Discriminación directa,,https://informesdiscriminacion.gitanos.org/casos/murcia-medios-de-comunicaci%C3%B3n-discriminaci%C3%B3n-directa
"En enero de 2018 en El Diario de Jerez y El Diario de Cádiz se publicó una noticia sobre el asesinato de dos ancianos en Bilbao. En la noticia aparecía la mención a la etnia gitana de dos jóvenes menores, presuntos autores del hecho, algo que perjudica la imagen del pueblo gitano y que es irrelevante. A partir de esta publicación además aparecían on line comentarios de odio antigitano por parte de algunos lectores.","Se enviaron sendas cartas de queja a ambos medios explicando el daño que hace ese tipo de menciones étnicas y pidiendo la retirada de esos comentarios. Con fecha 24 de enero, ambos directores respondieron a los correos de la siguiente manera: Diario Cádiz: Buenas tardes, ya está arreglado en los 9 periódicos del Grupo, no sólo en Diario de Cádiz. Efectivamente, lo recogimos de un teletipo de la Agencia EFE, y por tanto se reprodujo la noticia igual en todos los medios de nuestro Grupo (Grupo Joly, que edita Diario de Cádiz y de Jerez, entre otros.) Le pedí a la responsable de nuestra web en Sevilla que lo retirasen y me comentan que ya está eliminada esa mención, que, como bien dices, no aporta nada. También estamos eliminando los comentarios en estos momentos, pero eso nos lleva algo más de tiempo. Estará esta tarde, hay que ir uno por uno. Un abrazo. Diario de Jerez: 1º mensaje: “Buenas tardes. Como ya sabes, esa noticia tiene su fuente y origen en la agencia EFE, de la que se editó desde la sección de Sociedad del Grupo Joly en Sevilla, sin omitir esa referencia a la etnia gitana, como debería haberse hecho. Remito tu escrito de queja tanto a la citada sección como a los responsables de la edición digital. Sintiendo lo ocurrido, te envío un fuerte abrazo. 2º mensaje: “Hola de nuevo. Me confirman desde la edición digital que ya están eliminados los enlaces. Un abrazo.”  ","Positivo, por la respuesta de ambos medios y la retirada de los mensajes de odio on line.",2018-01-01T00:00:00+01:00,2018-01-01T00:00:00+01:00,Cádiz,Medios de comunicación,Discriminación directa,,https://informesdiscriminacion.gitanos.org/casos/jerez-de-la-frontera-medios-de-comunicaci%C3%B3n-discriminaci%C3%B3n-directa
"En enero de 2018 en El Diario de Sevilla se publicó una noticia sobre el asesinato de dos ancianos en Bilbao. En la noticia aparece la mención a la etnia gitana de dos jóvenes menores, presuntos autores del hecho, algo que perjudica la imagen del pueblo gitano y que es irrelevante.","Se envió una carta de queja al medio, explicando la mala praxis.",Positivo. No se contestó a la carta pero se eliminó toda mención a la etnia.,2018-01-01T00:00:00+01:00,2018-01-01T00:00:00+01:00,Sevilla,Medios de comunicación,Discriminación directa,['https://www.diariodesevilla.es/sociedad/Detenidos-jovenes-asesinato-ancianos-Bilbao_0_1211279503.html'],https://informesdiscriminacion.gitanos.org/casos/sevilla-medios-de-comunicaci%C3%B3n-discriminaci%C3%B3n-directa
