hechos,intervencion,resultado,fecha_hechos,fecha_denuncia,provincia,ambito,tipo_desciminacion,reference
"Con el titular “Detenido un violento ladrón tras fugarse del juzgado” aparece publicada una noticia en un periódico de ámbito local en la que se hace referencia, en repetidas ocasiones, al origen étnico del presunto autor del delito. Además, en la descripción de los hechos, se incide en que para su detención fue necesaria la intervención de un grupo de Operaciones Especiales de la Policía Nacional, y se relata detalladamente su “largo historial de delitos”.",,,2006-01-01T00:00:00+01:00,2006-01-01T00:00:00+01:00,Zaragoza,Medios de comunicación,Sin especificar,
Una joven llamó por teléfono a la FSG para denunciar que había visto una pintada en un barrio que decía: “QUEMAROS PUTOS GITANOS”,"Se comprobó que estaba la pintada y se envió carta al Superintendente de la policía local, en la que se explicaba que había una pintada con un contenido de odio hacia las personas gitanas y que era necesario que investigasen los hechos y que eliminasen la pintada, que estaba produciendo un impacto en la población del barrio, mayoritariamente de etnia gitana. Igualmente, se realizó una llamada al Subinspector de la policía nacional y se informó.",Positivo. Retiraron la pintada rápidamente y se nos informó que harían una investigación policial sobre la pintada por si se tratara de algún grupo organizado.,2018-01-01T00:00:00+01:00,2018-01-01T00:00:00+01:00,Ciudad Real,Otros,Discriminación directa,
"Una de las técnicas del Ayuntamiento contactó con la FSG para trasladar el contenido antigitano que había visto en una web de anuncios de alquiler de viviendas, que decía literalmente: 
“La población de etnia gitana no supone en esta zona ninguna amenaza para la seguridad ya que están integrados desde hace más de 20 años”.
",Se comprobó el enlace y el contenido antigitano del anuncio. Se escribió carta a la web idealista para que retirara el contenido del anuncio por vulnerar la Ley que regula la Ley General de Publicidad. Se envió carta de queja a las inmobiliarias que publicitaban este anuncio.,Parcialmente positivo. Se obtuvo respuesta inmediata de la web idealista que retiró el anuncio. No hubo respuesta por parte de las inmobiliarias.,2018-01-01T00:00:00+01:00,2018-01-01T00:00:00+01:00,Madrid,Vivienda,Discriminación directa,
"Desde la FSG se detectó un anuncio en la página web de milanuncios.com en el que se especificaba: “no se aceptan gitanos bajo ningún concepto, sean rumanos, españoles o de cualquier procedencia…”.",La técnica de igualdad de Valencia interpuso una carta de queja ante el responsable de la página web de anuncios solicitando la retirada inmediata de ese anuncio por ser contrario a las normas de uso del portal y por la posibilidad de incurrir en discriminación al denegar el derecho a vivienda a una determinada población por su etnia.,Positivo. Se obtuvo una respuesta inmediata por parte del responsable de la página de anuncios indicando que el anuncio ya no estaba activo.,2018-01-01T00:00:00+01:00,2018-01-01T00:00:00+01:00,Valencia,Vivienda,Discriminación directa,
En la página web Mil anuncios se publicó una oferta de trabajo de una constructora que decía: “Se busca gente para contratar no gitanos”.,La técnica de igualdad llevó a cabo varias actuaciones:,Nadie respondió a las llamadas de teléfono que venía en el anuncio. La página web nos informó que borró la oferta rápidamente. Desde el Ayuntamiento nos informaron que con los pocos datos que teníamos no pudieron localizar a la empresa.,2018-01-01T00:00:00+01:00,2018-01-01T00:00:00+01:00,Barcelona,Empleo,Discriminación directa,
"Una mujer de etnia gitana sufrió acoso laboral por parte de sus compañeras. Le hicieron un contrato eventual por causas de producción, como auxiliar de limpieza en un restaurante y la despidieron durante el periodo de prueba. Cuando empezó a trabajar, los primeros días no tuvo ningún problema, sin embargo, a raíz de que su compañera de trabajo supo que era gitana y vivía en un barrio de población gitana, empezaron los cambios en el comportamiento hacía ella. Le hacían comentarios como: “los gitanos vienen en pijama”, o bien: “los gitanos dejan las mesas muy sucias “ya vienen los Gipsy Kings”. Además, algunas de sus compañeras dejaron de hablarle. Un día, el jefe le pidió que recogiese la carta de despido, ya que su contrato se había terminado. Ella le preguntó por qué y le dijo que no estaba conforme, que esas no eran formas de comunicarle el despido. Se dirigieron al departamento de recursos humanos, ella preguntó el motivo del despido y el jefe de sala respondió que no era porque no hiciera bien su trabajo sino porque no se había adaptado a las compañeras.","La técnica entrevistó a la mujer, el relato de los hechos era coherente y consistente, además escuchó unos audios de una conversación de WhatsApp en los que una compañera del trabajo le dijo a la mujer que la habían despedido por ser gitana. Se informó y asesoró a la mujer, que presentó una denuncia en la Inspección Provincial de Trabajo y Seguridad Social, alegando que el despido había sido motivado por su pertenencia a la etnia gitana. Al cabo de unos días, le llamaron desde la inspección para declarar y le trasladó los hechos a la inspectora, que le aseguró que investigarían los hechos.","La Inspección de Trabajo realizó una investigación, pero no tuvo en consideración la motivación antigitana del acoso sufrido. Se asesoró a la mujer en otras posibles actuaciones, pero no quiso seguir adelante porque le había salido otro trabajo y quería estar tranquila.",2018-01-01T00:00:00+01:00,2018-01-01T00:00:00+01:00,Valencia,Empleo,Discriminación directa,
La tía de un niño menor de edad nos envió un informe de la orientadora del centro escolar en el que se aludía a la etnia gitana de una menor en un informe psicopedagógico del centro.,"Desde la FSG enviamos una carta a la orientadora recordándole la importancia de preservar datos de especial protección, como es la etnia y que este informe podría vulnerar la ley de datos de carácter personal de especial protección.",Positivo. La orientadora retiró inmediatamente la mención a la etnia gitana del menor y nos envió el informe modificado.,2018-01-01T00:00:00+01:00,2018-01-01T00:00:00+01:00,Navarra,Educación,Discriminación directa,
"Algunas familias gitanas contactaron con la orientadora educativa de la FSG para solicitar apoyo de la FSG en una situación que estaban viviendo en el colegio al que iban sus hijos/as (prácticamente el 100% del alumnado en este colegio es de etnia gitana) y a la que, según las familias, las autoridades no habían dado respuesta adecuada. Las familias contaron que en las instalaciones del colegio al que iban sus hijos merodeaba y pernoctaba, desde hacía casi un año, un hombre que tenía antecedentes penales por delitos muy graves, situación que se remontaba a unos ocho años antes. Las familias lo pusieron en conocimiento de la directora, que hizo todo lo posible para solucionarlo, lo comunicó a la Dirección provincial de educación. A pesar de que entendían la preocupación de las familias, no se pudo solucionar la situación. Muchas de las familias de etnia gitana dejaron de llevar a sus hijos/as al colegio por miedo ante esta situación.",Desde la FSG comprobamos la situación de riesgo en la que se encontraba el alumnado del colegio y la poca prioridad de las autoridades para abordar esta situación tan grave. Se llevaron a cabo diversas actuaciones:,"Positivo. En la reunión con el Ayuntamiento se expusieron las medidas que llevaran a cabo como instalación de cámaras de videovigilancia de forma extraordinaria, dispositivos de seguridad al personal de limpieza y total colaboración con la dirección del centro educativo. Asimismo, ofrecieron disponibilidad para acudir en cualquier momento al centro y voluntad de coordinación con la Subdelegación. Se recibió respuesta escrita por la Subdelegación del Gobierno en la que informó que efectivos de la policía local y nacional habían desalojado a esta persona del colegio y que estaban realizando vigilancia periódica sobre el colegio y sus inmediaciones, durante todos los turnos y se pusieron a disposición de la Directora y el equipo docente para cualquier cuestión que requirieran. Además se comprometieron a tomar todas las medidas necesarias para prevenir o solucionar situaciones similares. Finalmente, se aseguró la colaboración entre administraciones.",2018-01-01T00:00:00+01:00,2018-01-01T00:00:00+01:00,Valladolid,Educación,Discriminación directa,
"Un joven gitano que estaba buscando un perro para que se lo regalasen, entró en la página web de compra y venta de animales. Uno de los anuncios, decía “Se regala macho american Stanford por falta de tiempo… muy bueno obediente no agresivo con personas o animales. Solo gente seria y responsable amante de la raza; por favor abstenerse gitanos, sudamericanos, chulos de barrio etc.”",La técnica de igualdad de Huelva envió carta de queja a la página de mil anuncios en la que se solicitaba la retirada inmediata del anuncio por vulnerar los derechos de igualdad y dignidad de las personas gitanas.,Positivo: El día siguiente al envío de la carta recibimos respuesta del responsable del portal de anuncios en el que nos indicaba que se había retirado el anuncio.,2018-01-01T00:00:00+01:00,2018-01-01T00:00:00+01:00,Cuenca,Acceso a bienes y servicios,Discriminación directa,
"El diario Norte Express publicó una noticia sobre el aumento de Vitoria de hechos delictivos. La noticia utilizó la bandera gitana como imagen de dicha noticia, lo cual asocia a la delincuencia a la comunidad gitana, ya que ésta es el símbolo de dicho.",Se envió una carta de queja al periódico.,"Positivo. Inmediatamente respondieron: “Tenéis toda la razón, ha sido un error de utilización de fotos de archivo de la Ertzaintza. Lo corregiré inmediatamente.”",2018-01-01T00:00:00+01:00,2018-01-01T00:00:00+01:00,Álava,Medios de comunicación,Discriminación directa,['https://nortexpres.com/delincuencia-crecen-las-denuncias-por-delitos-penales-en-vitoria/']
"El Norte de Castilla publicó una noticia sobre un presunto caso de inducción a la prostitución de una menor. En la noticia se mencionaba la etnia de esta joven, y de la familia implicada en el caso.",Se envió una carta de queja al periódico.,Parcialmente positivo. No se cambió la noticia pero sí que se publicó nuestra carta en la sección de Cartas al Director.,2018-01-01T00:00:00+01:00,2018-01-01T00:00:00+01:00,Valladolid,Medios de comunicación,Discriminación directa,['https://www.elnortedecastilla.es/valladolid/investigan-circulo-familiar-20181105210927-nt.html']
"Se publicó una noticia relacionada con el tráfico de marihuana en el País Cataluña, con el siguiente titular: “Veinte detenidos en un macrooperativo de la Guardia Civil contra el tráfico de marihuana en Girona”. Y en el ABC con el siguiente titular “El golpe contra la marihuana de Gerona acaba con 20 detenidos”. En ambos periódicos se hacía mención a la etnia gitana de las personas involucradas en el caso.",Se enviaron cartas a los dos periódicos.,No hubo respuesta de ninguno de los dos periódicos y tampoco retiraron la mención a la etnia gitana.,2018-01-01T00:00:00+01:00,2018-01-01T00:00:00+01:00,Girona,Medios de comunicación,Discriminación directa,['https://elpais.com/ccaa/2018/10/17/catalunya/1539764095_850337.html']
"El día 8 de julio de 2018 una concejala de un partido político publicó en su perfil de Facebook el siguiente contenido “Quiero informar a todos los gitanos/rumanos... Los radares de la DGT, tienen 2 kilos de cobre. Ahí lo dejo”. A partir de esa publicación, hubo algunos comentarios discriminatorios: “Muy Bueno... y a quien le pique, que se rasque... es como decir que el cielo es azul... es así y no se puede cambiar”. “a mí solo me han atracado con navaja gitanos, así que es divertido sí”.","La FSG envió una carta de queja, tanto a la concejala como al partido político, ya que al tratarse de un cargo público ese tipo de comentarios tienen un mayor impacto.",Positivo. La concejala fue suspendida de su cargo por su partido y se eliminó el contenido de Facebook.,2018-01-01T00:00:00+01:00,2018-01-01T00:00:00+01:00,Sevilla,Redes sociales,Discriminación directa,
El periódico Málaga Hoy publicó una noticia con el titular “Liberadas dos menores rumanas tras ser vendidas por su familia por 20.000 euros” en los que aparecía mención a la etnia gitana.,"Se envió carta de queja al medio, haciendo llegar nuestro malestar, por las consecuencias negativas que éste tipo de publicación hace a la comunidad gitana.",Positiva. Se publicó la carta de queja de la FSG y se eliminó la noticia.,2018-01-01T00:00:00+01:00,2018-01-01T00:00:00+01:00,Málaga,Medios de comunicación,Discriminación directa,
"Una joven que caminaba con sus primos menores de edad, todos de etnia gitana, se pararon en un semáforo, cuando una mujer se dirigió a ella y le dijo: “Vaya gitanerío más malo, no se pueden comportar en ningún sitio, sólo molestando”. La chica en cuestión se quedó paralizada en ese momento, sólo se dirigió a ella para decirle: “señora que son niños”.","La joven contó en la FSG lo ocurrido y expresó que, a pesar de tener las herramientas para responder, se quedó bloqueada. Se trabajó con la joven las distintas situaciones que se podían dar y las respuestas.",La joven agradeció la formación en materia de derechos.,2018-01-01T00:00:00+01:00,2018-01-01T00:00:00+01:00,Almería,Otros,Discriminación directa,
"Una participante del Programa Calí dejó a su hijo en un espacio infantil de un centro comercial. Una conocida de la mujer le avisó que una mujer estaba agrediendo a su hijo. La participante se acercó a la mujer para pedir explicaciones de lo ocurrido y la mujer le contestó que había pegado a su hijo porque había arañado al suyo. La mujer le dijo que eso no podía ser y que si era así no podía pegar a su hijo. En ese momento, el hombre que estaba con la mujer le dijo: “Todas las gitanas son unas embusteras” y la mujer añadió: “tu hijo está asalvajado”. La mujer, que había recibido formación en derechos, llamó a la policía, que se personó en el lugar y tomó acta de la situación. La policía no recogió la denuncia de la mujer, le dijeron que fuera el día siguiente a la comisaría a interponerla.","La mujer acudió a la FSG y contó lo sucedido. Se asesoró y acompañó en la denuncia ante el Juzgado. Asimismo, la técnica de igualdad se reunió con la Fiscal Provincial de delitos de odio y discriminación para trasladarle el caso.","El juzgado absolvió a la mujer por “falta de prueba de cargo suficiente de los hechos”. A pesar de ello, la mujer está satisfecha con las acciones realizadas y con el aprendizaje en la defensa de sus derechos. Asimismo, desde la FSG se estableció una línea futura de coordinación con la Fiscalía para futuros casos.",2018-01-01T00:00:00+01:00,2018-01-01T00:00:00+01:00,Cáceres,Otros,Discriminación directa,
"Se produjeron varias concentraciones frente al Ayuntamiento de Daimiel convocadas por algunos vecinos y vecinas, a través de las redes sociales, pidiendo la expulsión de una familia de etnia gitana, acusándoles de un incidente violento que se había producido en el pueblo días antes. Asimismo, se estaban recogiendo firmas para “pedir justicia y echar a la familia del pueblo”.","Desde la FSG se envió un escrito al Alcalde de Daimiel expresando nuestra preocupación por estos hechos, manifestando que atentaban con la legalidad y los principios que rigen nuestro Estado de Derecho, y pidiendo la actuación de las autoridades y la Justicia. Igualmente, solicitamos al Alcalde que investigara los hechos, ya que atentaban contra el derecho a la Igualdad y de no discriminación de esta familia, y que garantizara que no se repitieran.","Positivo. El Alcalde contactó con la FSG y aseguró que estaba pendiente, que no había autorizado ninguna manifestación ni concentración de las que se habían producido. El Alcalde explicitó, por un lado, que el vecindario llevaba tiempo quejándose y tenía miedo, y por otro lado, aseguró que estaba de acuerdo con la carta que enviamos desde la FSG para prevenir el racismo. Se puso a disposición de la FSG para tratar estos problemas.",2018-01-01T00:00:00+01:00,2018-01-01T00:00:00+01:00,Ciudad Real,Otros,Discriminación directa,['http://www.lanzadigital.com/provincia/daimiel/centenar-vecinos-piden-la-expulsion-una-familiadaimiel-tras-provocar-varias-agresiones/']
"Una joven gitana fue a hacer la compra acompañada de su hija de 12 años y su sobrina de ocho. Mientras compraban, el vigilante de seguridad no dejó de seguirlas en todo momento.","La participante, que había recibido una formación de derechos y de igualdad de trato, reaccionó ante la situación. Se dirigió al vigilante de seguridad que les estaba siguiendo y le preguntó por qué les estaba siguiendo, que estaban realizando la compra y las estaba intimidando.","El vigilante no reconoció que las estaba siguiendo, dijo que era por casualidad.",2018-01-01T00:00:00+01:00,2018-01-01T00:00:00+01:00,Badajoz,Otros,Discriminación directa,
"Una mujer, de etnia gitana, estaba sufriendo un trato discriminatorio por parte de su ex marido, que no es de etnia gitana, lo que está afectando a los hijos de ambos. La mujer cuenta cómo al ir a recoger a sus hijos su ex marido se negaba a entregárselos y cuando ella protestaba, en una ocasión salió gritando, ante los transeúntes, de manera pública: “perdonad, es que ella es gitana y ya sabemos cómo son los gitanos, si es que gitana tenías que ser, que ni comportarte sabes” y añadió: “mira, te los voy a dejar porque no quiero que mis vecinos vean que mis hijos además de tener una madre gitana es también una loca”. Además, cuando entrega a los niños, suele decirles frases como: “venga niños, pasadlo bien y ya sabéis, si veis que hay droga o alguien drogándose a vuestro alrededor, retiraros y luego cuando vengáis, me lo decís”. La mujer está muy afectada ante esta situación.",Se informó y asesoró a la mujer en las distintas actuaciones que se pueden llevar a cabo y sobre sus derechos en materia de igualdad de género y trato.,"La mujer por motivos personales decidió no realizar ninguna acción, aunque está muy agradecida por el asesoramiento y se siente acompañada por si algún día decide llevar a cabo alguna actuación.",2018-01-01T00:00:00+01:00,2018-01-01T00:00:00+01:00,Almería,Otros,Discriminación directa,
"En una cafetería, mientras una de las trabajadoras de la FSG tomaba un café, se levantó viento y escuchó cómo en la mesa de al lado, una mujer le decía a su madre: “ven aquí que te voy a peinar, que pareces una gitana con esos pelos”.","La trabajadora de la FSG, de manera conciliadora, se dirigió a ellas diciendo que el comentario que acababa de hacer era estereotipado y despectivo hacía las mujeres gitanas. La trabajadora había sido formada en lucha contra la discriminación y en el ejercicio y defensa de derechos previamente.",Positivo. La sensibilización funcionó y las mujeres dieron la razón a la trabajadora de la FSG.,2018-01-01T00:00:00+01:00,2018-01-01T00:00:00+01:00,Almería,Otros,Discriminación directa,
"En un curso sobre prevención de violencia de género, una mujer comentó que en su trabajo hay niños que ejercen este tipo de violencia contra los niñas, y que “lo traen aprendido de sus casas” debido a su cultura y pertenencia a la etnia gitana.","Se mantuvo una conversación con la persona que hizo los comentarios discriminatorios en el curso, comentándole que no se puede generalizar de esa forma, que la violencia no tiene nada que ver con la cultura gitana. La chica se disculpó y comentó que no quería ofender a nadie, que simplemente había contado lo que ella vive desde su experiencia.",Positivo. La joven replanteó su actitud por la mediación.,2018-01-01T00:00:00+01:00,2018-01-01T00:00:00+01:00,Sevilla,Otros,Discriminación directa,
"La víctima, una mujer gitana, explicó que estando con su amiga en las puertas de un bar cercano a su casa, mientras fumaban, se les acercaron dos hombres y uno, en referencia a ellas, dijo al otro en actitud burlesca: “mira, dos gitanas en un bar y fumando”. Las víctimas expresaron su rechazo respondiendo: “somos gitanas con mucho orgullo”, “usted es un racista”, “si usted sigue riéndose de nosotras e intimidándonos por ser gitanas vamos a llamar a la policía”. Los agresores verbales no respondieron a estas palabras y se fueron.","Las víctimas tenían herramientas con las que enfrentarse a situaciones discriminatorias. En este caso, una de las víctimas había recibido una sesión de sensibilización sobre discriminación e igualdad de trato. Dicha mujer comentó que gracias a tener ésta información, se sintió con fuerzas para enfrentarse al agresor adecuadamente.","Positivo. Consideramos que se trata de un caso de discriminación interseccional, porque probablemente no le hubieran hecho un comentario de ese tipo a un hombre gitano. Ser mujer y ser gitana fueron dos factores que influyeron en el acoso verbal.",2018-01-01T00:00:00+01:00,2018-01-01T00:00:00+01:00,Cádiz,Otros,Discriminación directa,
En un pueblo de Jaén (Andújar) se creó una asociación que ayuda a personas en exclusión y que estaba recogiendo material escolar. Una chica fue a donar unas mochilas y le dijo a la voluntaria que si eran para personas de etnia gitana que no quería donarlas. La voluntaria le dijo que no había ninguna familia de etnia gitana; la chica afirmó que “no quería donar a gitanos/as porque les daban muchas subvenciones”.,"Nos pusimos en contacto con la asociación de Andújar, quienes confirmaron el caso. Se mostraron dispuestos/as a asistir a un taller para conocer mejor la realidad de la comunidad gitana y saber cómo responder ante estas situaciones, y tener además un protocolo de actuación.","Después de preparar el taller y hablar con la responsable de la asociación, llamamos en varias ocasiones para organizar el taller y no respondieron a las llamadas. Por ello se procedió al cierre del caso.",2018-01-01T00:00:00+01:00,2018-01-01T00:00:00+01:00,Jaén,Otros,Discriminación directa,
"El correo general de la Fundación Secretariado Gitano recibió un email amenazador y contra el pueblo gitano. 
“Vosotros los gitanos sí que sois ODIO puro, no hacéis más que matarnos robarnos VAIS A PAGAR”
",Se envió mensaje al usuario advirtiéndole que ese tipo de mensajes es un delito de odio y que la próxima ocasión tomaríamos las acciones legales oportunas.,"No hubo respuesta, pero no se volvieron a recibir mensajes de este tipo.",2018-01-01T00:00:00+01:00,2018-01-01T00:00:00+01:00,Estatal,Otros,Discriminación directa,
"A partir de una noticia publicada en Miciudadreal sobre un conflicto armado entre dos familias, el Concejal de Régimen Interior y Seguridad Ciudadana hizo una referencia en rueda de prensa a la etnia de estas familias.","Se envió una carta al concejal, para ponerle de manifiesto nuestra preocupación por la mención específica a la etnia gitana, explicando que eso no aportaba nada a la noticia y sin embargo alimentaba los prejuicios y estereotipos que pesan sobre la comunidad gitana.","Positivo. El concejal David Serrano envió un mail de respuesta, disculpándose por lo sucedido, y comprometiéndose a no hacer ese tipo de menciones en el futuro.",2018-01-01T00:00:00+01:00,2018-01-01T00:00:00+01:00,Ciudad Real,Otros,Discriminación directa,
"Un joven gitano que trabajaba instalando fibra óptica en viviendas, escuchó varios comentarios antigitanos en varias de las casas, durante su trabajo: “Si pero mira, el otro día en el médico, había unos gitanos que le reclamaban a la mujer que da las citas que hiciese las cosas como ellos querían, exigiendo y exigiendo, cuando los gitanos son los que menos cotizan, no tienen derechos”, “yo no sirvo, mi marido es más gitano para eso”, y otros parecidos.","El joven había asistido a un taller sobre defensa de derechos y no discriminación que recibió por parte de la FSG, y gracias a él fue capaz de contestar a estas familias explicando el daño que hacen ese tipo de comentarios. Varias de las personas se disculparon y cambiaron de actitud.",Positivo. Se ve la eficacia de este tipo de formaciones sobre igualdad y no discriminación.,2018-01-01T00:00:00+01:00,2018-01-01T00:00:00+01:00,Cádiz,Otros,Discriminación directa,
"Una compañera de la FSG de Jerez estaba en la playa de Chiclana de la Frontera cuando una mujer que estaba a su lado le pidió que vigilara sus cosas mientras iba a pasear con su marido, porque “no se fiaba de esa familia”, señalando a una familia gitana que estaba a su lado. La técnica de la FSG le recriminó su actitud racista a esta mujer, quien abandonó el sitio. La familia gitana fue testigo del conflicto pero prefirió no intervenir.","La intervención fue realizada in situ por la propia técnica, que tenía recursos suficientes para argumentar y criticar esa actitud antigitana.",Positivo.,2018-01-01T00:00:00+01:00,2018-01-01T00:00:00+01:00,Cádiz,Otros,Discriminación directa,
