hechos,intervencion,resultado,fecha_hechos,fecha_denuncia,provincia,ambito,tipo_desciminacion,reference
Nos hacemos eco de este caso a través de un artículo aparecido en un diario de tirada local. En él aparece una casa con el letrero: “Se vende. Sólo a gitanos”. Además recoge las declaraciones de la dueña del inmueble que explica: “porque mis vecinos son unos sinvergüenzas que no me dejan vivir. Yo no hago daño a nadie vendiéndoselo a los gitanos”; “yo considero a los gitanos otras personas más. Si ellos son racistas es su problema”; “se lo daría a un gitano por 30 millones antes que dárselo a un vecino que me pagase 100”. Vemos cómo se utilizan los prejuicios y estereotipos negativos hacia la comunidad gitana a la que en este caso han convertido en un medio para vengarse de los vecinos de su inmueble.,,,2009-01-01T00:00:00+01:00,2009-01-01T00:00:00+01:00,Pontevedra,Vivienda,Sin especificar,
"Mujer joven se traslada de localidad para trabajar en la FSG. Durante unos días busca alquiler en la localidad y visita varios pisos. Llama por teléfono a la propietaria de un piso en alquiler y ésta le empieza a hacer preguntas. En un momento dado le pregunta por la empresa en la que iba a trabajar y cuando responde que en la Fundación Secretariado Gitano la propietaria le dice que no alquila su piso a gitanos. La compañera le intenta hacer ver que eso carece de importancia pero la propietaria pone punto y fi nal a la conversación diciendo que le parece todo muy bien pero que no alquila ni a inmigrantes ni a gitanos. Ejemplo claro de la discriminación en vivienda, ya no sólo hacia personas de etnia gitana sino también hacia todas aquellas que tengan algo que ver con dicha etnia, en este caso trabajar para una entidad como la FSG.",,,2009-01-01T00:00:00+01:00,2009-01-01T00:00:00+01:00,Jaén,Vivienda,Sin especificar,
"Mujer joven usuaria del programa de acceso al empelo Acceder acude a agencia inmobiliaria para alquilar un piso en la localidad. Eligen un piso, acude a verlo con la persona de la agencia y otro día con el propietario. Éste le dice que no tendría ningún problema en alquilarle el piso pero que en la comunidad de propietarios se llegó al acuerdo de no alquilarlo a gitanos. Ejemplo claro de orden de discriminar que según las Directivas y la ley de transposición se considera igualmente discriminación y conllevaría la misma respuesta que un caso de discriminación directa.",,,2009-01-01T00:00:00+01:00,2009-01-01T00:00:00+01:00,Huesca,Vivienda,Sin especificar,
"Un matrimonio gitano del municipio busca una vivienda de alquiler y solicitan acompañamiento en el proceso de búsqueda a la técnica de la FSG en la localidad, solicitando una labor de mediación con las personas propietarias de las viviendas. La mujer, que no presenta rasgos físicos normalmente atribuidos al fenotipo de la comunidad gitana, acude junto con la técnica de la FSG a visitar un piso que reúne los requisitos que busca la familia. El piso se ajusta a lo que buscan y así se lo hace saber a la propietaria quien, muy amablemente, le indica que se lo guarda y quedan para fi rmar el contrato y entregar ya la fi anza la mañana siguiente. A la mañana siguiente cuando la propietaria ve al marido (quien sí presenta los rasgos físicos normalmente atribuidos a la comunidad gitana) rectifi ca y les dice que lo siente mucho pero que la tarde anterior ya alquiló el piso. La mujer no queda muy convencida y al día siguiente vuelve a la agencia inmobiliaria que tramitaba el alquiler del piso y pregunta por su disponibilidad, a lo que el empleado de la agencia le responde que sigue estando disponible. Ejemplo típico de la discriminación en el acceso a la vivienda que siguen sufriendo muchos miembros de la comunidad gitana y que está prohibido por la Directiva 2000/43/CE y su ley de transposición.",,,2009-01-01T00:00:00+01:00,2009-01-01T00:00:00+01:00,Asturias,Vivienda,Sin especificar,
"Una bolsa pública de vivienda en alquiler de la localidad valora la posibilidad de alojar a una familia gitana en una de las viviendas. En el momento de ir a fi rmar, el propietario al ver a la familia se niega a hacerlo indicando que no le gusta esa familia. Se trata de un ejemplo común de discriminación en la vivienda por motivos étnicos, algo que está totalmente prohibido según la Directiva 2000/43/CE y su ley de transposición.",,,2009-01-01T00:00:00+01:00,2009-01-01T00:00:00+01:00,Pontevedra,Vivienda,Sin especificar,
"Familia en Programa de Erradicación del Chabolismo. El alcalde de una localidad de la provincia consigue una vivienda a través de un contacto. La vivienda no cuenta con todos los permisos, de hecho al propietario le paralizaron la obra de reforma. En ese tiempo los vecinos se enteraron de que la vivienda iba a ser para una familia gitana y comenzaron a manifestar que no querían gitanos allí así como a alertar de que la obra no era legal. Hay que tener en cuenta que muchos de estos vecinos también tienen sus casas de forma ilegal, por lo que pedían para otros lo que ellos mismos no cumplían. Los vecinos llamaron a la prensa y pusieron carteles en las marquesinas de los autobuses en contra de los realojos de gitanos. Una madrugada un grupo de personas no identifi cadas entraron en la vivienda y la destrozaron entera, cortando incluso el suministro de luz y de agua. Desde el ayuntamiento se puso una denuncia.",,,2009-01-01T00:00:00+01:00,2009-01-01T00:00:00+01:00,A Coruña,Vivienda,Sin especificar,
"Una familia de etnia gitana de Sestao es realojada en un piso de La Arboleda. Los vecinos de la zona se niegan a ello alegando que “no quieren tener entre ellos al patriarca” que “tiene más de 50 causas pendientes”, y por ello han reunido 5.000 fi rmas para conseguir impedir el realojo. El Ayuntamiento de destino del realojo, Trápaga-Trapagaran, ha denegado el certifi cado de empadronamiento al matrimonio y a los cinco hijos. Durante el realojo la familia tuvo que ser acompañada por cuatro trabajadores de servicios sociales y escoltada por una patrulla de la Ertzaina.. Finalmente la familia tuvo que abandonar la casa en su primer día de ocupación por falta de seguridad. Como consecuencia, la situación de discriminación se ha extendido a otros municipios y cuatro municipios vascos apoyaron la medida de denegar el empadronamiento a gitanos. En septiembre del 2009, y ante la posición del Ararteko, el Ayuntamiento procedió a empadronar a la familia. El realojo se produjo de manera efectiva en fecha 12 de mayo de 2009, contando con la protesta masiva de la sociedad civil del pueblo. Por otra parte los medios de comunicación que siguieron la noticia publicaron titulares discriminatorios presumiendo el carácter delictivo de la familia.",,,2009-01-01T00:00:00+01:00,2009-01-01T00:00:00+01:00,Bizkaia,Acceso a bienes y servicios,Sin especificar,
"Nos hacemos eco de este caso a través del seguimiento de las noticias de prensa. La edición gallega de El País publicó en marzo el siguiente artículo: “SIN ALQUILER POR SER GITANA. Las obras de la Tercera Ronda de A Coruña ya han comenzado y, con ellas, el derribo de chabolas en el poblado gitano de Penamoa. La próxima puede ser la de Mercedes García, apodada Lola por su cante y su baile al estilo de la matriarca de los Flores. Pero nadie quiere alquilarle una casa a la que mudarse con los tres hijos y la sobrina con los que convive. “Al principio, los propietarios me dicen que sí, pero cuando ven que soy gitana me ponen disculpas”. El anuncio de un piso rezaba: “No perros, ni gitanos””.",,,2009-01-01T00:00:00+01:00,2009-01-01T00:00:00+01:00,A Coruña,Vivienda,Sin especificar,
"Mujer de etnia gitana con deuda con su comunidad de vecinos. La mujer propone hacerse cargo de la limpieza del bloque con el fi n de ir subsanando su deuda a cambio de trabajo, tal y como se había hecho con otras vecinas en ocasiones anteriores. A pesar de que la mayoría de los vecinos lo aceptaban, hubo varios que no quisieron aplicarle la misma facilidad. Por otro lado, tiene desperfectos en la vivienda pero la comunidad se niega a hacerse cargo de ello con la excusa de la deuda, a pesar de no ser la única que debe dinero y a pesar de que al resto sí se les realizan las reparaciones. Parece que la única explicación es la mala opinión que tienen algunos vecinos de la comunidad gitana.",,,2009-01-01T00:00:00+01:00,2009-01-01T00:00:00+01:00,Toledo,Vivienda,Sin especificar,
"Una mujer gitana usuaria de la sede de la FSG en Granada fue a alquilar una vivienda a un pueblo de Granada. Habló con la inmobiliaria en cuestión y quedaron para enseñarle la casa. Una vez visitada y al ajustarse a sus necesidades, la mujer decide quedársela. Entonces la persona de la inmobiliaria le pregunta si es gitana y ella no lo niega, le dice que tiene el dinero y que puede hacer frente perfectamente al gasto del alquiler. Entonces la persona de la inmobiliaria le dice que no puede alquilársela porque “en Ogíjares, los gitanos, como que no…”, es decir, le niega el alquiler por el único motivo de ser gitana: discriminación directa en el acceso a la vivienda por razón de etnia prohibido por la Directiva 2000/43/CE y la ley de transposición (L 62/2003).",,,2009-01-01T00:00:00+01:00,2009-01-01T00:00:00+01:00,Granada,Vivienda,Sin especificar,
"Familia realojada en Caritel siguiendo el Plan de Erradicación del Chabolismo tras los derribos del Vao, lleva un año viviendo en su nuevo domicilio. Durante ese año no han dejado de sucederse, todos los sábados, manifestaciones delante de su hogar por parte de los vecinos de la plataforma antirealojo. La situación se agrava aún más cuando acusan al padre de la familia de una supuesta agresión a un vecino, ignorando por completo la presunción de inocencia. El denunciado acude por voluntad propia a las dependientas de la Guardia Civil en la localidad para prestar declaración. Una vez terminada le pide una copia al Sargento pero éste se niega a dársela pero le hace otro escrito para que lo fi rme. El padre se niega a fi rmarlo al no comprender lo que se refl eja en ese escrito. La familia está cansada de que tanto los vecinos como los agentes de la autoridad les estén acosando constantemente debido a su condición social y a su pertenencia étnica.",,,2009-01-01T00:00:00+01:00,2009-01-01T00:00:00+01:00,Pontevedra,Vivienda,Sin especificar,
"A través de la prensa nos hacemos eco de este caso de discriminación. Un hombre gitano fue a cambiar de casa porque la suya estaba destrozada, cumplimentó todos los trámites oportunos y al ir a fi rmar le dijeron directamente que no alquilarían el piso a un gitano. Volvió a la agencia a través de la cual lo había encontrado y allí le dijeron que no iban a hacer nada, que estaban allí para ganar dinero y no para otras cosas. La propia víctima dice cosas como: “Estas cosas desembocan en odios por las dos partes y luego no es de extrañar que a veces todo esto acabe con problemas mayores”; “yo no quiero vivir en un gueto, no soy distinto al resto de la gente”. Ejemplo claro de discriminación directa en vivienda, acción prohibida por la Directiva 2000/43/CE y su ley de transposición.",,,2009-01-01T00:00:00+01:00,2009-01-01T00:00:00+01:00,Asturias,Vivienda,Sin especificar,
"Nos hacemos eco de este caso a través del sistema de alertas de prensa. Se trata de un caso en el que una asociación de vecinos lleva a cabo movilizaciones contra los realojos de familias procedentes del poblado chabolista de Penamoa. En febrero tenían previstas tres manifestaciones. Este tipo de manifestaciones se han visto anteriormente en otros casos donde las víctimas son sometidas a un auténtico acoso por parte de todo el vecindario, llegando incluso a las amenazas y coacciones. No van dirigidas a personas concretas con características determinadas sino a todo un conjunto de población con un único denominador común: la pertenencia étnica. De ahí que la FSG lo considere un acto de acoso por razón étnica (acoso racista).",,,2009-01-01T00:00:00+01:00,2009-01-01T00:00:00+01:00,A Coruña,Vivienda,Sin especificar,
"Mujer embarazada se pone de parto y llama al servicio de taxi para que la llevasen hasta el hospital. La telefonista que la atendió le dijo que por las noches los taxis no recogían gente en esa zona, que se fuera a otro barrio cercano para recogerla.",,,2009-01-01T00:00:00+01:00,2009-01-01T00:00:00+01:00,Huelva,Acceso a bienes y servicios,Sin especificar,
"Joven gitano que intenta entrar a una discoteca de la localidad un sábado por la noche. Cuando se acerca a comprar las entradas, el guardia jurado le dijo directamente que no podía entrar a la discoteca ya que no dejaban entrar a gitanos, y añadió: “son órdenes del jefe”. Ejemplo claro de las órdenes para discriminar frecuentemente sufridas por los jóvenes de etnia gitana en el acceso a bienes y servicios.",,,2009-01-01T00:00:00+01:00,2009-01-01T00:00:00+01:00,Jaén,Acceso a bienes y servicios,Sin especificar,
"Como parte de un programa de vivienda desarrollado en la Comarca de Valdejalón por la FSG, se llevan a cabo una serie de reformas y construcciones. Cuando se intenta adquirir material de construcción, la responsable de ventas de una empresa dedicada al suministro de este tipo de material, se niega a vendérselo. Ante la insistencia en la necesidad de esos materiales dicen acceder a la venta pero solicitan una serie de documentación que garantice el pago (que no se solicita al resto de compradores), realizan investigaciones bancarias a la FSG en busca de garantías, y, fi nalmente, la única opción que dan es el pago efectivo de una mercancía que ascendía a 6000 euros. La actitud de la responsable de la empresa fue de clara desconfi anza hacia la FSG por la comunidad a la que representa. Finalmente la FSG tuvo que comprar los materiales a otra empresa quien sí los vendió tras recibir buenas referencias en cuanto a solvencia de otra empresa de suministros de otro tipo a la que solicitaron información.",,,2009-01-01T00:00:00+01:00,2009-01-01T00:00:00+01:00,Zaragoza,Acceso a bienes y servicios,Sin especificar,
"Nos hacemos eco de este caso a través de un mail de denuncia enviado al correo general de la FSG donde se contenía un artículo de periódico sobre el caso. Según el artículo, la madrugada del 20 al 21 de noviembre, entre las 3.30 y las 3.56, al hombre de etnia gitana y algunos de sus acompañantes (el resto ya había entrado) se les negó el acceso a la discoteca a pesar de cumplir con los requisitos de la sala en cuanto a vestimenta y calzado, sin embargo “desde el pinganillo le habían indicado que tras verle desde dentro de la cámara le dijeron que éste no entraba”. El grupo completó y fi rmó una hoja de reclamaciones y al dársela al portero, éste la enrolló y se la quedó sin fi rmarla. Finalmente, al insistirle a fi rmarla, y tras amenazar con llamar a la policía, terminó accediendo y la fi rmó. Claro ejemplo de la discriminación directa en el acceso a bienes y servicios. No se tiene conocimiento de posteriores acciones de la Administración contra la discoteca.",,,2009-01-01T00:00:00+01:00,2009-01-01T00:00:00+01:00,Cádiz,Acceso a bienes y servicios,Sin especificar,
"En el Municipio de San Javier, a un hombre de etnia gitana se le impide la entrada en una discoteca. Un supuesto protocolo, según expresa el portero de la misma, le impide dejar entrar “a ciertas personas”. Ante la petición de más explicaciones por parte de la víctima y la negativa del portero, solicitó la hoja de reclamaciones, que también le fue negada. Acto seguido, intentó presentar denuncia en la comisaría de Santomera, pero le dijeron que lo hiciera al día siguiente en su municipio, en lo que fue una actuación de la policía de esa localidad que no fue la de defender los derechos de la víctima. Finalmente, la víctima ha presentado la correspondiente denuncia en el Municipio de San Javier, sin que se tenga conocimiento de que se haya iniciado ningún procedimiento sancionador contra el establecimiento.",,,2009-01-01T00:00:00+01:00,2009-01-01T00:00:00+01:00,Murcia,Acceso a bienes y servicios,Sin especificar,
"El usuario junto a dos familiares pretendían acceder a una discoteca en la zona de Puerto Marina. Antes de llegar a la puerta del local, uno de los porteros del local los miró e hizo un comentario en voz baja a su compañero. Al intentar acceder al local, los porteros les impidieron la entrada, alegando que el establecimiento tenía reservado el derecho de admisión. Uno de los chicos gitanos pidió de forma educada que le mostrara algún documento donde se reconociera dicho derecho, puesto que en la entrada del local no había ningún cartel que lo indicara. A continuación los chicos pidieron hablar con el gerente del local. Tras conversar brevemente con él, y explicarle lo sucedido, éste les pidió perdón por el excesivo celo de los encargados de la vigilancia y les ofreció una invitación, reconociendo que el local no tenía reservada la admisión. Los chicos rehusaron entrar en el establecimiento y se marcharon.",,,2009-01-01T00:00:00+01:00,2009-01-01T00:00:00+01:00,Málaga,Acceso a bienes y servicios,Sin especificar,
"Mujer joven gitana, trabajadora de la FSG, acude con una amiga a una piscina pública de la localidad. Accede con normalidad pero estando en el césped notan que el socorrista fi ja de manera constante la mirada sobre ellas. La amiga sale a comprar un refresco al bar de la piscina y en ese momento, de camino, se le acerca el encargado de las instalaciones y le dice que tiene a una persona encargada que las está vigilando a las dos, y le advierte: “como falte algo de las mochilas de la gente, os vais a enterar…”. La compañera se acerca a la conversación y el encargado de la piscina se reafi rma: “como falte algo de las mochilas de la gente os vais a enterar…”. La compañera le pregunta al encargado que si ha visto algo sospechoso o raro para argumentar dicha advertencia. El encargado dice que no pero vuelve a repetir la misma frase, esta vez en voz más alta y apuntando con el dedo. La compañera dice que va a avisar a la policía y el encargado no dice nada, así que delante de él llama a la policía quienes se presentan allí a los cinco minutos. Toman declaración a ambas partes y les dicen a las chicas que lo sienten y que pueden seguir en la piscina, además les aconseja poner una denuncia. Las jóvenes, decepcionadas, están un ratito más en la piscina para no llamar demasiado la atención y evitar los comentarios que podrían surgir de su salida tras la llegada de la policía, pero al poco tiempo se van y acuden a la comisaría a poner la denuncia. A fecha de la redacción de este informe, la denunciante no ha tenido noticia alguna del proceso desarrollado a raíz de la denuncia.",,,2009-01-01T00:00:00+01:00,2009-01-01T00:00:00+01:00,Valladolid,Acceso a bienes y servicios,Sin especificar,
"Mujer joven, trabajadora de la FSG en la localidad, acude a la piscina municipal de una localidad cercana acompañada de su sobrino y una amiga. Al pedir las entradas les preguntaron si estaba empadronada en el municipio y al contestar que no le dijeron que no podía tener entrada. En ese momento salían dos personas de la piscina y la joven les preguntó si a ellos les habían preguntado por el empadronamiento y le contestaron que no. Ante eso, la joven pidió la hoja de reclamaciones pero le contestaron que no tenían, pide la normativa de la piscina y también se la niegan, así que solicita que llamen al encargado. Cuando llega el encargado la respuesta es la misma, no hay hojas de reclamación, y añade: “no es por no dejaros entrar a vosotras, es que si os dejo se me va a llenar esto”. La joven le pregunta: “de qué se te va a llenar esto, ¿de gitanos?”, y el encargado le responde que sí. En ese momento la joven llama a la Guardia Civil pero le indican que no pueden enviar un indicativo por no tenerlos disponibles, informándole de que procediera a efectuar denuncia en la comisaría de Valladolid. A los dos días la joven fue a la Ofi cina Municipal de Información al Consumidor y tramitó la correspondiente hoja de reclamación, además, fue a comisaría e interpuso una denuncia. En octubre tuvo lugar el Juicio de Faltas donde se absuelve al demandado ya que los hechos no se consideran acreditados al no haberse practicado prueba objetiva alguna que permita determinar lo ocurrido. Se trata de un claro ejemplo de la discriminación directa en el acceso a bienes y servicios que sufre de forma constante la comunidad gitana, y de lo difícil que resulta probar estas situaciones ante un Juzgado. Esto hace que las víctimas se sientan desprotegidas pero es más, esto desalienta a otras víctimas a denunciar las situaciones de discriminación que han sufrido.",,,2009-01-01T00:00:00+01:00,2009-01-01T00:00:00+01:00,Valladolid,Acceso a bienes y servicios,Sin especificar,
"Con fecha 27 de mayo un grupo de jóvenes de etnia gitana se acercan a un chiringuito de playa de la localidad y tiene problemas para acceder, son disuadidos con el requerimiento de pago de 20 euros por persona cuando la entrada era gratuita, por lo que deciden acudir a una asociación de la zona para contar lo sucedido.  Algunas de las personas de esta asociación acuden posteriormente a dicho local para corroborar este hecho y comprueban que es cierto ya que les vuelven a prohibir la entrada a pesar de ver que no había problemas de aforo, ya que el bar estaba medio vacío. Comprobaron también que a nadie se le pedía el DNI ni los 20 euros por entrar excepto a ellos. Decidieron completar una hoja de reclamaciones e interponer la correspondiente denuncia. Como consecuencia de esta denuncia, la Junta de Andalucía ordenó el cierre cautelar del chiringuito.",,,2009-01-01T00:00:00+01:00,2009-01-01T00:00:00+01:00,Almería,Acceso a bienes y servicios,Sin especificar,
"Un joven de etnia gitana se matricula para la obtención del carné de conducir de la categoría C (camiones). El curso es gratuito, a excepción de una de 80 euros que se pagaba al inicio, y considerando que el número de prácticas y las oportunidades de presentarse al examen son limitadas (una vez agotadas unas y otras sí que habría que pagar). En una fecha determinada, el joven tenía que haberse presentado por primera vez al examen práctico en la pista de Tráfi co, pero la persona encargada de avisarle por parte de la autoescuela no lo hizo: la autoescuela, unilateralmente y sin consultar con el usuario, le inscribió días antes para realizar un examen sin comunicarle nada. Como resultado, y al no comparecer, suspendió, agotando así una de las dos convocatorias gratuitas de las que disponía. En la segunda ocasión, la víctima escuchó al propietario de la autoescuela decir “estoy harto de los gitanos porque no pagan”, a pesar del carácter gratuito del examen y de que la víctima había abonado las correspondientes cantidades requeridas. En el momento del examen, el profesor, a diferencia de cómo ocurriera con el resto de convocados al examen, se marchó dejando solo a la víctima con el examinador. Esta diferencia de trato afectó a la víctima, que suspendió el examen y tuvo que volver a pagar sus derechos de examen. El comentario que pudo escuchar, así como la diferencia de trato frente a los alumnos no gitanos, son las dos características que determinan la existencia de discriminación.",,,2009-01-01T00:00:00+01:00,2009-01-01T00:00:00+01:00,Cuenca,Acceso a bienes y servicios,Sin especificar,
"Un grupo de chicas de etnia gitana y menores de edad acudieron a la tienda de ropa “Blanco” de Jaén para echar un vistazo a la ropa de la nueva temporada. Notaron como desde un primer momento una dependienta del comercio estaba especialmente atenta a ellas y cuando ya se marchaban la dependienta fue a revisar las prendas que habían estado mirando encontrando una prenda en el bolsillo de una chaqueta, sin más se dirigió a ellas pidiéndoles que les enseñaran los bolsos y las bolsas que llevaban en las manos (bolsas con los nombres visibles de otros comercios en los que sí habían comprado). Las chicas se sintieron avergonzadas de que la dependienta las llamara delante de todo el mundo, cuando ellas habían cruzado el umbral de la puerta y ninguna alarma había sonado, ni tenía motivo alguno para hacerles pasar esa vergüenza delante de toda la gente que estaba en la tienda. A pesar de ello accedieron a ser registradas y demostraron que no llevaban absolutamente nada. Salieron de la tienda y lo comentaron con la familia ya que se habían sentido muy molestas porque, además, ellas compran habitualmente en esa tienda y nunca les había pasado algo así. Volvieron y pusieron una hoja de reclamaciones contra el trato recibido por la dependienta. Se trata de un ejemplo típico de discriminación en acceso a bienes y servicios por razón de etnia que, además, suele ser especialmente sufrido por las mujeres, quienes son objeto frecuentemente de medidas de vigilancia desproporcionada en los comercios por el único motivo de su pertenencia étnica.",,,2009-01-01T00:00:00+01:00,2009-01-01T00:00:00+01:00,Jaén,Acceso a bienes y servicios,Sin especificar,
