hechos,intervencion,resultado,fecha_hechos,fecha_denuncia,provincia,ambito,tipo_desciminacion,reference
"A raíz de un tiroteo en Cáseda (Navarra) en el que murieron tres hombres de la misma familia, se detectó en varios medios de comunicación (El Diario de Navarra, El Correo, El ABC, El Español, La Voz de Galicia, etc.), la mención a la etnia gitana de los implicados. Algunos de los contenidos de las noticias: 
“Una discusión en plena calle entre dos familias de etnia gitana terminó este martes por la tarde en Cáseda en un violento tiroteo que se cobró la vida de tres miembros de una misma familia” “Un enfrentamiento entre dos familias gitanas acaba con un tiroteo y tres muertos en Cáseda (Navarra) La guerra de los Jiménez continúa: el incierto futuro de Amparo, la esposa vengada por su padre. El origen del conflicto fue una discusión de pareja entre un matrimonio con un miembro de cada familia”. Los tres presuntos autores del crimen, que al igual que las víctimas pertenecen a una familia de etnia gitana, han sido detenidos por la Policía Local” “Un enfrentamiento entre dos familias gitanas acaba con un tiroteo y tres muertos en Cáseda (Navarra)” “La Guardia Civil asegura que el detonante de los hechos podría ser «conflictos entre familias de etnia gitana»”.
 Mencionar la etnia no aporta nada a la comprensión de la noticia, y criminaliza a toda la comunidad gitana.","Se enviaron cartas de queja a todos los medios citados. El único medio que contestó fue Navarra.com a través de un mensaje de su Director, en el que aseguraba que “por supuesto” no iba a cambiar la noticia ni eliminar la mención al supuesto origen étnico de los implicados porque esto supondría una “manipulación a los lectores”.",,2018-01-01T00:00:00+01:00,2018-01-01T00:00:00+01:00,Navarra,Medios de comunicación,Discriminación directa,"['https://www.lavozdegalicia.es/noticia/espana/2018/09/18/tres-muertos-tiroteo-dos-familiasnavarra/00031537293750098885282.htm', 'https://www.elcorreo.com/sociedad/sucesos/tres-fallecidos-tiroteo-20180918200004-nt.html', 'https://www.elespanol.com/reportajes/20180920/dispara-dispara-asesinatos-vengar-marido-echo-casa/339217175_0.html']"
"El día 16 de septiembre de 2018 en el Mediterráneo Digital salió publicada una noticia donde el titular se refería a una persona de etnia gitana, dicho titular es este: “Un gitano le arranca los ojos a un taxista en Valencia para no pagarle la carrera”. Este medio se caracteriza por publicar noticias para criminalizar al pueblo gitano.",Se envió una carta de queja al medio.,"Negativo. Aunque se publicó la carta integra de la FSG en el Mediterráneo digital, no atendieron a nuestras demandas.",2018-01-01T00:00:00+01:00,2018-01-01T00:00:00+01:00,Valencia,Medios de comunicación,Discriminación directa,['https://www.mediterraneodigital.com/sociedad-y-tiempo-libre/ultimas-noticias-sociedad-ytiempo-libre/st2/un-gitano-le-arranca-los-ojos-a-un-taxista-en-valencia-para-no-pagarle-la-carrera.html']
El periódico La Opinión de Murcia publicó un suceso de un conflicto violento entre dos mujeres. En el texto de la noticia mencionaba la etnia gitana de ambas mujeres.,Se envió una carta de queja al medio explicando la mala praxis de ese tipo de redacción.,No se recibió respuesta ni se eliminó la mención a la etnia.,2018-01-01T00:00:00+01:00,2018-01-01T00:00:00+01:00,Murcia,Medios de comunicación,Discriminación directa,['https://www.laopiniondemurcia.es/murcia/2018/09/18/mujer-resulta-herida-quemaduras-80/955637.html']
"Varios medios se hicieron eco de una noticia sobre el acoso de unos vecinos a una familia, presuntamente gitana, que supuestamente ocupaban de forma ilegal un piso. El periódico CasoAislado describía a la familia como protagonista de robos, agresiones y de actividades delictivas. Todas esto sin pruebas concretas y reforzando los estereotipos en torno a la comunidad. Se utilizan expresiones como “estos mierdas” y en el twitter del periódico el título relacionado con la noticia es el siguiente: “Los vecinos de La Llagosta se enfrentan a un clan gitano de okupas que llevan meses destrozando el barrio. ¡Con dos cojones!”. Asimismo, el periódico con su discurso de odio y el modo de presentar la noticia desencadenó una serie de comentarios racistas”.",Se enviaron cartas de queja a ambos medios y se recabó más información sobre el conflicto.,"Negativo. Contestaron a nuestra carta, pero no atendieron a nuestras demandas. Su respuesta fue: “Entendemos vuestra carta pero no vamos a modificar el artículo ni nuestra forma de hacer periodismo. A diferencia de otros medios, nosotros no ocultamos datos que consideramos importantes. La polémica generada en las redes sociales es generada por la acción delictiva. Otra cosa es que fuese mentira. Ahí por supuesto tendrían todo el derecho del mundo a mostrarse disconformes. Al mismo tiempo, no somos ni seremos responsables de los comentarios de nuestros lectores”.",2018-01-01T00:00:00+01:00,2018-01-01T00:00:00+01:00,Barcelona,Medios de comunicación,Discriminación directa,['https://casoaislado.com/valientes-vecinos-la-llagosta-se-enfrentan-unos-gitanos-okupabanviviendas-robaban-agredian-e-insultaban-los-vecinos/']
El periódico La Vanguardia publicó una noticia trata sobre una pelea en la entrada de un hospital. El texto de la noticia mencionaba que se trataba de un enfrentamiento entre “dos clanes gitanos”.,Se envió carta de queja al periódico explicando la mala práctica de mencionar la etnia cuando no es relevante en la noticia.,Negativo. No hubo respuesta del medio.,2018-01-01T00:00:00+01:00,2018-01-01T00:00:00+01:00,Barcelona,Medios de comunicación,Discriminación directa,['https://www.lavanguardia.com/local/vilanova/20180907/451686160938/multitudinaria-pelea-clanes-gitanos-hospital-sant-pere-de-ribes.html']
"El humorista Rober Bodegas hizo un monólogo en televisión, donde por medio de chistes “sobre payos” daba a entender que los gitanos roban, trafican con drogas, no trabajan, no saben escribir y se casas con menores de edad.","La FSG publicó un comunicado criticando los contenidos racistas del monólogo, y un artículo de opinión en el periódico Cuartopoder.es.",Positivo. El humorista pidió disculpas y retiró el video de la web.,2018-01-01T00:00:00+01:00,2018-01-01T00:00:00+01:00,Estatal,Medios de comunicación,Discriminación directa,['https://gitanos.org/actualidad/archivo/125418.html']
"Se publicó una noticia en Ideal Granada, con fecha de 22 de julio 2018 con el título: “Tensión por la agresión a una menor en Fuente Vaqueros”. En dicha noticia, aparece la mención a la etnia gitana de las agresoras. A partir de esta publicación aparecieron comentarios racistas de lectores en el medio on line.","Se envió una nota de queja, pidiendo la retirada de esos contenidos.",No hubo respuesta.,2018-01-01T00:00:00+01:00,2018-01-01T00:00:00+01:00,Granada,Medios de comunicación,Discriminación directa,['https://www.ideal.es/granada/provincia-granada/tension-agresion-menor-20180722014028-nt.html']
"Europapress publicó una noticia sobre narcotráfico en Galicia, donde mencionaba en varias ocasiones a la comunidad gitana: “Detenidas seis personas de etnia gitana dentro de un macrooperativo en Lugo Hasta un total de seis personas de etnia gitana han sido detenidas, por el momento, en una macroperación desplegada por la Guardia Civil en Lugo que ha llevado a realizar registros en el mismo poblado gitano de O Carqueixo, así como en otros puntos de la ciudad como en las calles Nazario Abel, Serra de Outes y Lamas de Prado.”",Se envió correo electrónico al medio con la noticia y una carta sobre el trato informativo realizado en ella.,"Parcialmente positivo. El medio respondió disculpándose, pero no modificó su edición on line.",2018-01-01T00:00:00+01:00,2018-01-01T00:00:00+01:00,Lugo,Medios de comunicación,Discriminación directa,['http://www.europapress.es/galicia/noticia-abierta-operacion-contra-delincuencia-comun-lugo-20180814112640.html']
"El periódico Miciudadreal.es publicó una noticia sobre un tiroteo. Aunque la noticia no menciona a la comunidad gitana, aparecieron numerosos comentarios de lectores, contra esta comunidad.",Se envió una nota de queja al medio solicitando la retirada de esos contenidos de odio.,Positivo. Los comentarios fueron retirados de la web.,2018-01-01T00:00:00+01:00,2018-01-01T00:00:00+01:00,Ciudad Real,Medios de comunicación,Discriminación directa,['https://www.miciudadreal.es/2018/08/10/una-persona-resulta-herida-en-un-tiroteo-en-el-poligono-industrial-de-la-carretera-de-carrion/']
"El canal de Youtube Miciudadreal publicó un video sobre la jornada de Puertas abiertas de la FSG en Ciudad Real. A partir de eso, aparecieron varios comentarios racistas al video.",Se envió un mail a la dirección del diario digital miciudadreal.es para que se retiraran los comentarios a la noticia.,Positivo. Se retiraron los comentarios y se desactivó esa opción.,2018-01-01T00:00:00+01:00,2018-01-01T00:00:00+01:00,Ciudad Real,Redes sociales,Discriminación directa,['https://www.youtube.com/watch?reload=9&v=Msm1a2sqYPo']
"En un programa de humor en la radio dirigido por Dani Mateo (Yu: No te pierdas nada), este hizo una serie de alusiones y menciones burlescas cargadas de estereotipos hacia la comunidad gitana. Se representaba y dramatizaba la figura de un Sr gitano autoproclamado “el rey de gitanonia” y también de Juan de Dios, un gitano que va a ir a comprar y vender oro al espacio.","Se comprobó que los comentarios realizados, aunque tratados en tono de humor, estaban cargados de estereotipos y ofrecían una visión negativa de los gitanos y gitanas. En ellos, se hace alusión a un supuesto Rey de “Gitanonia”, a la venta ambulante, al gusto por el oro y la comercialización del mismo, a una mala imagen de la mujer gitana. Se envió un escrito de queja al responsable del programa de radio donde se exponía la contrariedad con los contenidos del programa y solicitando el ejercicio de responsabilidad y buena praxis periodística para en lo sucesivo, no contribuir a la perpetuación de estereotipos y visión negativa hacia la comunidad gitana. Esa misma tarde, se recibió contestación por parte del medio, que aunque no reconocía abiertamente su error, pidió disculpas: “Le pedimos disculpas si el contenido de nuestro programa ha podido causar alguna molestia. Yu: no te pierdas nada es un programa de humor y de entretenimiento. No discriminamos a nadie por su color de piel, ideología, raíces, ni religión. Lamentamos cualquier molestia al respecto. Reciban un cordial saludo.”","Parcialmente positivo. Aunque el medio contestó y pidió disculpas, no reconocieron su error ni tomaron medidas.",2018-01-01T00:00:00+01:00,2018-01-01T00:00:00+01:00,Estatal,Medios de comunicación,Discriminación directa,['https://podtail.com/es/podcast/yu-no-te-pierdas-nada-programa-completo/yu-18-07-2018-tramo-de-15-00-a-16-00/']
