hechos,intervencion,resultado,fecha_hechos,fecha_denuncia,provincia,ambito,tipo_desciminacion,reference,link
"en un colegio de educación primaria de la provincia de Huesca se realizan actividades con familias gitanas, una escuela de madres, mientras los niños acuden a las clases de apoyo escolar. en una ocasión ambas actividades coinciden en la misma sala. la monitora que realiza la actividad con cuatro niños, tres de ellos de etnia gitana, enuncia de la siguiente forma un problema matemático: “si j.r tiene 20 piojos y e. le quita 12, ¿cuántos piojos tiene ahora j.r?”. una de las madres comenta a la monitora que parece poco educativo el ejemplo que planteaba; ella contesta que así lo entenderían mejor. la fsg se pone en contacto con la dirección del colegio, que manifiesta su pesar por lo sucedido y asegura mantener una reunión con la monitora en cuestión para evitar situaciones similares en el futuro. las familias afectadas se sintieron resarcidas y no quisieron desarrollar ninguna otra actuación.",,,2010-01-01T00:00:00+01:00,2010-01-01T00:00:00+01:00,Huesca,Educación,Sin especificar,,https://informesdiscriminacion.gitanos.org/casos/mayo-arag%C3%B3n-educaci%C3%B3n
"Para la puesta en funcionamiento de un programa educativo de la FSG, cuyo objetivo es conseguir tasas más elevadas de éxito académico en el último ciclo de Educación Primaria Secundaria obligatoria, y promover la continuidad en estudios medios y/o superiores y Formación Profesional, se precisa que el centro educativo se comprometa a participar en las acciones que se lleven a cabo con los menores. En el presente caso, la Técnico del programa educativo en la provincia de Jaén, se reúne con la dirección de un centro escolar y la familia de la menor en cuestión, para solicitar su colaboración. En el encuentro mantenido, pese a que la dirección tiene un buen concepto sobre la menor, se puede observar una actitud estereotipada y prejuiciosa hacia la comunidad gitana por parte de la jefa de estudios, quien manifiesta haber tenido malas experiencia en otro centro con comunidad gitana. Esta actitud es discutida y se trata de sensibilizar sobre la necesaria evitación de las generalizaciones.",,,2010-01-01T00:00:00+01:00,2010-01-01T00:00:00+01:00,Jaén,Educación,Sin especificar,,https://informesdiscriminacion.gitanos.org/casos/abril-andaluc%C3%ADa-educaci%C3%B3n
"La madre de una menor de 13 años, acude a la sede de la FSG en Almería aduciendo discriminación hacia su hija en su centro escolar, tanto por parte de un profesor como de varios compañeros. Al parecer, le llaman continuamente gitana sucia y le dicen que se marche del colegio. La menor al principio no cuenta nada a su familia, empieza a no querer acudir a clase y a presentar un cuadro depresivo, hasta que un día tiene que ser tratada por trastorno de ansiedad. La madre acude al centro escolar para reunirse con el director del colegio, el cuál asegura que lo ocurrido “son cosas de niños” y que en su centro no existen conductas discriminatorias ni racismo.",,,2010-01-01T00:00:00+01:00,2010-01-01T00:00:00+01:00,Almería,Educación,Sin especificar,,https://informesdiscriminacion.gitanos.org/casos/febrero-andaluc%C3%ADa-educaci%C3%B3n-0
"Un joven de etnia gitana estudia un Programa de Cualificación Profesional Inicial (PCPI) de electricidad. Para la realización de las prácticas, el centro se pone en contacto con las diferentes empresas del gremio que hay en la provincia de Almería, negándose todas ellas a aceptar gitanos o inmigrantes.",,,2010-01-01T00:00:00+01:00,2010-01-01T00:00:00+01:00,Almería,Educación,Sin especificar,,https://informesdiscriminacion.gitanos.org/casos/febrero-andaluc%C3%ADa-educaci%C3%B3n
"Una madre, a la salida de un colegio concertado de la provincia de Huelva, llama a su hija por su nombre y primer apellido. Otra mujer al escucharlo comenta: “Ese apellido es de gitanos”, a lo que la niña responde que ella es gitana. La mujer añade: “Pues no digas eso que no se te nota que eres gitana”. La madre de la menor contesta que no hay razón para ocultar su etnia, que su padre es gitano y la niña está orgullosa de ser gitana.",,,2010-01-01T00:00:00+01:00,2010-01-01T00:00:00+01:00,Huelva,Educación,Sin especificar,,https://informesdiscriminacion.gitanos.org/casos/enero-andaluc%C3%ADa-educaci%C3%B3n
"Una mujer, a la salida de un centro comercial en Valencia donde trabaja, estando con su marido y cuñada, de etnia gitana, coincide con la encargada de su tienda. Esta última, al ver a su familia, pregunta a la trabajadora por su origen étnico. Al día siguiente le comunican su despido. La mujer pide una explicación y la encargada dice directamente que es por ser gitana, que no se fía. Su contrato acababa de ser renovado y tan solo dos días antes del despido había sido propuesta su promoción. La joven, ante unos hechos que encajan en lo que la ley describe como despido improcedente, ha recibido asesoramiento legal por parte de la Fundación.",,,2010-01-01T00:00:00+01:00,2010-01-01T00:00:00+01:00,Valencia,Empleo,Sin especificar,,https://informesdiscriminacion.gitanos.org/casos/noviembre-comunidad-valenciana-empleo
"Una usuaria del programa Acceder de la FSG de Córdoba, está realizando un curso de formación profesional ocupacional de dependienta de comercio y, por motivos familiares, se ve en la obligación de dejar el curso. En el momento de presentar dicha renuncia, el técnico de la formación comienza a proferir todo tipo de estereotipos insultantes sobre la etnia gitana, tales como: “Los gitanos no quieren estudiar, seguro que es tu marido el que te obliga, es normal que los gitanos estéis así de atrasados”. Es decir, sin la información suficiente, el técnico presupone que el motivo por el que deja el curso, no es ajeno a su condición de gitana.",,,2010-01-01T00:00:00+01:00,2010-01-01T00:00:00+01:00,Córdoba,Empleo,Sin especificar,,https://informesdiscriminacion.gitanos.org/casos/octubre-andaluc%C3%ADa-empleo-1
"Una joven, de la provincia de Almería, se encuentra trabajando en una frutería. La empresa decide despedirla porque, según la dirección, el establecimiento ha bajado sus ventas debido a la etnia de la joven, puesto que responde al estereotipo físico normalmente atribuido a las personas pertenecientes a dicha etnia y los clientes no quieren comprar a personas gitanas. Los prejuicios provocan que ciertos hechos objetivos, como puede ser una bajada en las ventas en época de crisis económica, sean atribuidos a personas determinadas en base a su etnia.",,,2010-01-01T00:00:00+01:00,2010-01-01T00:00:00+01:00,Almería,Empleo,Sin especificar,,https://informesdiscriminacion.gitanos.org/casos/octubre-andaluc%C3%ADa-empleo-0
"Los prospectores laborales de la FSG realizan un sondeo de empresas que puedan estar interesadas en realizar contrataciones de nuevo personal. En este caso, se trata nuevamente de un taller mecánico de reparación de vehículos en la provincia de Almería, donde el gerente reconoce abiertamente que no quiere trabajadores de etnia gitana debido a malas experiencias en el pasado. La discriminación directa en el acceso al empleo es, como vemos, uno de los casos más frecuentes y con mayor dificultad de resolución. La labor de sensibilización es clave para luchar contra las ideas negativas preconcebidas que la sociedad tiene frente a la comunidad gitana en su conjunto. Obviamente, la heterogeneidad de dicha comunidad hace imposible atribuir determinadas conductas inadecuadas a todo un grupo de personas, en base a la pertenencia a una misma etnia.",,,2010-01-01T00:00:00+01:00,2010-01-01T00:00:00+01:00,Almería,Empleo,Sin especificar,,https://informesdiscriminacion.gitanos.org/casos/octubre-andaluc%C3%ADa-empleo
"En Huesca, una joven de etnia gitana comienza a trabajar en una zapatería. El trato por parte de las encargadas parece ser desde un principio bastante desagradable, refiriéndose a ella como “gitana” o siendo la única que no puede disfrutar de su pausa, o afirmando ante las clientas que las gitanas no saben trabajar, entre otros. En una ocasión falta dinero de la caja y la joven es acusada directamente. Cuando se dan cuenta que ha sido un error en los pagos con las tarjetas bancarias, no recibe ninguna disculpa por la falsa acusación. La joven intenta ponerse en contacto con la sede central de la zapatería en Zaragoza pero, tras habar con la responsable, la única solución que se le plantea es abandonar el puesto de trabajo. Desde la FSG, ante esta situación de acoso laboral, desarrollamos una labor de interlocución con la empresa sin lograr un acuerdo, puesto que las encargadas del negocio niegan en todo momento un trato discriminatorio hacia la joven. Finalmente la trabajadora abandonó el puesto de trabajo. Cabe señalar, sin embargo, que ante una nueva oferta laboral, una usuaria de la Fundación, que no es de etnia gitana pero que pudiera parecerlo físicamente, ha sido rechazada para trabajar en la misma tienda, presuntamente por ser demasiado mayor. Esta mujer tiene 29 años.",,,2010-01-01T00:00:00+01:00,2010-01-01T00:00:00+01:00,Huesca,Empleo,Sin especificar,,https://informesdiscriminacion.gitanos.org/casos/septiembre-arag%C3%B3n-empleo
"En la provincia de Cáceres, una Agencia de Trabajo Temporal (ETT) oferta un trabajo para realizar sustituciones durante el periodo vacacional estivo. La ETT selecciona a una mujer de etnia gitana con discapacidad sensorial de un 45%. Superada esta primera fase, la mujer mantiene la última entrevista con la empresa contratante, la cual descarta su candidatura en base a los siguientes argumentos: Tener discapacidad auditiva; ser gitana; y por su poca expresividad durante la entrevista. El técnico de la Fundación, en un intento de negociación, argumentó ante la empresa que las entrevistas iban dirigidas a personas con algún tipo de discapacidad y que la candidata presentada cumplía, además de éste, el resto de requisitos exigidos en la oferta. Sin embargo la responsable no cambió de idea puesto que según su parecer “a una gitana no se la puede dejar sola en la oficina, y tal y como están las cosas no me puedo exponer a perder clientes”.",,,2010-01-01T00:00:00+01:00,2010-01-01T00:00:00+01:00,Cáceres,Empleo,Sin especificar,,https://informesdiscriminacion.gitanos.org/casos/julio-extremadura-empleo
"En la provincia de Sevilla, una joven de etnia gitana, que se encuentra en búsqueda de empleo, asiste a una entrevista de trabajo y durante la misma la trasladan que no es aceptada porque físicamente responde al estereotipo de etnia gitana. La interesada prefirió no realizar actuación alguna al respecto.",,,2010-01-01T00:00:00+01:00,2010-01-01T00:00:00+01:00,Sevilla,Empleo,Sin especificar,,https://informesdiscriminacion.gitanos.org/casos/junio-andaluc%C3%ADa-empleo-2
"Una Empresa de Trabajo Temporal (ETT) contacta con la Fundación Secretariado Gitano en Jaén para solicitar perfiles de usuarios en búsqueda de empleo. Tras las entrevistas, la ETT llama a la Fundación y pregunta por la procedencia gitana de una de las mujeres. El orientador contesta que el pertenecer a una etnia determinada no debe significar un hecho objetivo en cuanto a su capacidad laboral. El encargado de la ETT responde que él no es racista pero que los empresarios no suelen aceptar a personas de etnia gitana. Tras diversas gestiones y conversaciones por parte de la Fundación con el encargado de la ETT, la mujer fue propuesta y finalmente seleccionada para el puesto de trabajo ofertado.",,,2010-01-01T00:00:00+01:00,2010-01-01T00:00:00+01:00,Jaén,Empleo,Sin especificar,,https://informesdiscriminacion.gitanos.org/casos/junio-andaluc%C3%ADa-empleo-1
"Una joven, usuaria del programa de empleo Acceder de la FSG en Granada, entra en una tienda de ropa donde necesitan una dependienta. Pregunta por el anuncio y le comentan que debe dejar el currículum otro día porque el responsable no está. Días más tarde intenta entregar el currículum pero dicen que el puesto ya ha sido ocupado. El anuncio, sin embargo, sigue colgado en la puerta del negocio. La joven no quiso que los técnicos de la Fundación intervinieran en el asunto, algo que suele ocurrir sobre todo cuando las personas se encuentran en búsqueda de empleo en localidades pequeñas, para evitar añadir dificultades a un proceso ya de por si complicado cuando se pertenece a una etnia minoritaria.",,,2010-01-01T00:00:00+01:00,2010-01-01T00:00:00+01:00,Granada,Empleo,Sin especificar,,https://informesdiscriminacion.gitanos.org/casos/junio-andaluc%C3%ADa-empleo-0
"Una joven de etnia gitana es llamada por una Empresa de Trabajo Temporal (ETT), en la provincia de Jaén, para trabajar como camarera de piso durante un fin de semana. Cuando se presenta en el establecimiento, su compañera de trabajo comienza a realizar comentarios a la joven sobre su capacidad para realizar bien la tarea debido a su condición de gitana, mostrándole en todo momento desconfianza en su modo de desempeñar la labor y falta de respeto.",,,2010-01-01T00:00:00+01:00,2010-01-01T00:00:00+01:00,Jaén,Empleo,Sin especificar,,https://informesdiscriminacion.gitanos.org/casos/junio-andaluc%C3%ADa-empleo
"Una mujer acude al dispositivo de la FSG en Salamanca, manifestando haber sufrido discriminación como causa de despido laboral. La joven, que trabajaba de dependienta en una tienda, afirma que los problemas comienzan cuando el jefe se da cuenta de que su casero es de etnia gitana. Desde entonces, se despiertan las sospechas de los lazos de ésta con personas de etnia gitana. La actitud hacia la joven en el entorno laboral cambia de manera notable. Semanas más tarde la suegra de la joven, también de etnia gitana, visita la tienda. A los pocos días el jefe pregunta directamente a la joven “quiero saber más de tu vida, estoy preocupado por saber quién eres”. Días más tarde, con el finiquito en la mano, la despide alegando que tiene muchas ojeras y que no se fía. Desde la FSG se intentó contactar con el empresario, pero éste se negó a mantener una entrevista con nuestros técnicos. Ante las irregularidades del despido, y la imposibilidad de mediar en el caso, la joven es asesorada legalmente para la presentación de la reclamación laboral ante el Servicio de Mediación, Arbitraje y Conciliación (SMAC). El empresario no ha acudido al acto de conciliación, por lo que el caso se ha derivado a instancias judiciales.",,,2010-01-01T00:00:00+01:00,2010-01-01T00:00:00+01:00,Salamanca,Empleo,Sin especificar,,https://informesdiscriminacion.gitanos.org/casos/mayo-castilla-y-le%C3%B3n-empleo
"Una joven usuaria del programa Acceder de la FSG en Huelva, tras realizar un curso de dependienta comienza sus prácticas en una perfumería. Al principio el ambiente de trabajo es muy bueno, le explican todo lo necesario e incluso la encargada dice que la va a enseñar a utilizar la caja registradora, puesto que la cajera estaba a punto de irse temporalmente por baja maternal y seguramente ella supliría su baja. Sin embargo, una clienta comenta un día en la tienda la procedencia gitana de la joven. La encargada preguntó directamente a la joven si era o no gitana. A partir de ese momento el trato hacia la joven cambió totalmente. Al terminar el periodo en prácticas no la llamaron para cubrir la baja.",,,2010-01-01T00:00:00+01:00,2010-01-01T00:00:00+01:00,Huelva,Empleo,Sin especificar,,https://informesdiscriminacion.gitanos.org/casos/mayo-andaluc%C3%ADa-empleo
"A través del programa de empleo Acceder de la FSG, dos usuarios tienen concertada una entrevista en una empresa privada de la provincia de Badajoz, para la formación en la misma con compromiso a posterior contratación. Una vez presentados los servicios del programa de empleo, tras varias reuniones, y acordar los términos para la firma del convenio de colaboración entre la FSG y la empresa, ésta se niega a formar y mucho menos contratar a personas de etnia gitana. Los comentarios racistas y prejuiciosos por parte de los responsables son innumerables: “No quiero a gitanos en mi empresa”, “apenas he tenido clientes gitanos y cuando los he tenido les he pedido el doble por la prestación de servicios”, “los gitanos si no la dan a la entrada, la dan a la salida” etc. La prospectora laboral de la FSG, en un intento por sensibilizar a los empresarios, les muestra documentación que avala el éxito obtenido hasta el momento con los programas de empleo que se realizan, y muestra otros convenios de colaboración firmados por grandes empresas nacionales. Sin embargo, los empresarios argumentan que posiblemente nuestros usuarios no sean “malos chicos” pero que si podemos enviarles a “chicos normales” sería mejor porque temen que “se les llene la empresa de gitanos”. Además, se interesan por saber qué razón se va a dar a los jóvenes ante la negativa de la firma del convenio, mostrando su preocupación a posibles represalias. Este caso es un claro refl ejo de la dificultad que tienen las personas de etnia gitana en el acceso al empleo. Barreras que en numerosas ocasiones, y pese a la labor de sensibilización e interlocución que realizan organizaciones como la nuestra, son difíciles de superar. La discriminación directa, prohibida por la Directiva 2000/43/CE, vuelve a ser la protagonista en estos casos.",,,2010-01-01T00:00:00+01:00,2010-01-01T00:00:00+01:00,Badajoz,Empleo,Sin especificar,,https://informesdiscriminacion.gitanos.org/casos/mayo-extremadura-empleo
"Un prospector laboral de la FSG visita una empresa de transportes en la provincia de Jaén, para presentar el programa de empleo Acceder. La entrevista transcurre con normalidad y a la finalización de la misma, el empresario ofrece la posibilidad de contratación de una persona, con un periodo de prueba de 15 días y posibilidad de continuación durante 6 meses realizando sustituciones en el periodo vacacional. Al día siguiente el empresario se pone en contacto con el prospector y le comunica que bajo ningún concepto quiere personal de etnia gitana, ni personas de nacionalidad rumana, alegando que había tenido experiencias profesionales previas con personas pertenecientes a esa etnia y habían sido desagradables. Sin embargo, la posibilidad de contratación para personas del programa de empleo de etnia no gitana sigue abierta. La interlocución con el empresario, en un intento de razonar de forma objetiva la situación y sensibilizar sobre la necesidad de no discriminar a toda una comunidad por hechos aislados, no obtiene los resultados deseados.",,,2010-01-01T00:00:00+01:00,2010-01-01T00:00:00+01:00,Jaén,Empleo,Sin especificar,,https://informesdiscriminacion.gitanos.org/casos/marzo-andaluc%C3%ADa-empleo
"La FSG de Córdoba intenta formalizar un convenio de formación, con una empresa de publicaciones, a través de una Empresa de Trabajo Temporal (ETT) con la que colaboran en el Programa de empleo Acceder. A través de la ETT, el gerente de la empresa afirma haber tenido una mala experiencia con un empleado gitano y no quiere volver a tener ninguna relación con personas de esta etnia.",,,2010-01-01T00:00:00+01:00,2010-01-01T00:00:00+01:00,Córdoba,Empleo,Sin especificar,,https://informesdiscriminacion.gitanos.org/casos/febrero-andaluc%C3%ADa-empleo
"Con el objeto de buscar prácticas en empresas para personas con formación en búsqueda de empleo, técnicos del Pacto Local por el Empleo de Mérida (PLEM), del Ayuntamiento de esta ciudad, visitan varios negocios, entre los que se encuentra la franquicia de una prestigiosa firma de moda española. En primer lugar, los técnicos realizan un cuestionario para determinar el perfil solicitado, explicando los colectivos con los que se trabaja. El gerente de la tienda afirma que le da igual el colectivo pero que no quiere gitanos porque necesitan que los trabajadores tengan buena presencia. Tras el comentario, el gerente se da cuenta de que debe argumentar mejor sus preferencias e intenta basar su criterio en la necesidad de trabajar con personas cualificadas. Los técnicos del PLEM contactan con la FSG para denunciar el hecho discriminatorio. Tras una reunión entre los responsables gestores del PLEM, se decide enviar una carta al gerente de la tienda informándole de la “imposibilidad de continuar contando con la empresa para el desarrollo de prácticas laborales, al suponer su posicionamiento un evidente caso de discriminación, contrario al espíritu del propio Pacto Local por el Empleo y que supondría la connivencia por parte de los responsables municipales con dicha actitud”. El apoyo de las Administraciones Públicas como garantes del derecho a la igualdad de trato, supone una pieza fundamental en la lucha contra la discriminación. Esta actitud refuerza a su vez la obligación legal y moral que la sociedad tiene frente a este derecho constitucionalmente establecido.",,,2010-01-01T00:00:00+01:00,2010-01-01T00:00:00+01:00,Badajoz,Empleo,Sin especificar,,https://informesdiscriminacion.gitanos.org/casos/febrero-extremadura-empleo
"Un prospector laboral de la FSG, contacta con un taller en la provincia de Almería para ofrecer candidatos a puestos de mecánico. El gerente de la empresa muestra su interés, puesto que quería incorporar jóvenes en prácticas. Tras el envío de los curriculums, el empresario se interesa por el perfil de usuarios con los que la Fundación trabaja. Al ver que se trata principalmente de comunidad gitana, el hombre manifestó no ser racista pero que, al haber tenido malas experiencias con dicha comunidad, debido sobre todo a la reacción negativa por parte de los clientes, no estaba interesado en contratar personas de esta etnia. Es habitual que los empresarios responsables de la contratación basen su rechazo hacia la comunidad gitana en posibles repercusiones negativas en sus negocios, sin embargo esa justificación no les exime de su responsabilidad como autores de la discriminación directa que realizan.",,,2010-01-01T00:00:00+01:00,2010-01-01T00:00:00+01:00,Almería,Empleo,Sin especificar,,https://informesdiscriminacion.gitanos.org/casos/enero-andaluc%C3%ADa-empleo-1
"Una usuaria del programa de empleo Acceder de Granada, acude a buscar trabajo a una panadería con una amiga. Ambas dejan su currículum el mismo día. La amiga entró a trabajar primero, mientras que la joven, de etnia gitana, tardó bastante más en conseguir el trabajo. La encargada de la panadería afirmaba que no quería a gitanos porque no saben trabajar y lo único para lo que sirven es para dar palmas. Al poco tiempo de incorporarse al puesto, la dueña de la tienda ascendió a nuestra usuaria como encargada de la panadería, sustituyendo a la anterior, por su buen desempeño.",,,2010-01-01T00:00:00+01:00,2010-01-01T00:00:00+01:00,Granada,Empleo,Sin especificar,,https://informesdiscriminacion.gitanos.org/casos/enero-andaluc%C3%ADa-empleo-0
"Una mujer se encontraba trabajando en una heladería en un centro comercial en la provincia de Cádiz, el trato era bueno y no tenía ningún problema en su centro de trabajo. Un día invitó a su familia a tomar café en el establecimiento, la encargada se sorprendió al verlos y comentó que no sabía que su familia y ella eran de etnia gitana. Días más tarde fue despedida sin causa justificada. Como en el presente caso, las personas de etnia gitana que no responden a los estereotipos físicos habitualmente atribuidos a dicha etnia, suelen tener mayor facilidad en el acceso al empleo y tienden a no presentar problemas en el puesto de trabajo. Sin embargo, la discriminación afl ora en cuanto, de uno u otro modo, se las relaciona con su etnia, es ahí cuando surge el acoso laboral, los despidos improcedentes, etc. De este modo, se hace evidente la discriminación basada en el origen étnico de las personas.",,,2010-01-01T00:00:00+01:00,2010-01-01T00:00:00+01:00,Cádiz,Empleo,Sin especificar,,https://informesdiscriminacion.gitanos.org/casos/enero-andaluc%C3%ADa-empleo
"Dos mujeres trabajadoras, con contratos indefinidos en una empresa de limpieza, reciben un expediente sancionador con una suspensión de empleo y sueldo de 2 días. El motivo: presentarse al puesto de trabajo con ropa no apta para el desarrollo de sus funciones. Efectivamente, los trabajadores de esta empresa tienen que ir uniformados. En el caso de estas mujeres, se les entregó un único uniforme y zapatos en el año 2008 los cuales, dos años más tarde, han quedado inservibles y, pese a la solicitud de nueva indumentaria, la empresa no ha accedido. Por lo tanto ambas mujeres, al igual que la mayoría de sus compañeros, van a trabajar en ocasiones con pantalones vaqueros. El día en cuestión por el que recibieron la sanción, había un total de 8 trabajadores sin uniformar. Sin embargo sólo ellas, las únicas de etnia gitana, fueron expedientadas. Además, las dos mujeres nos transmiten que se sienten acosadas por la encargada de la tienda donde limpiaban, con comentarios sobre su actitud y calidad del trabajo. En este caso la FSG contactó con la empresa de limpieza y, mediante la interlocución, se logró solucionar el problema existente. En la actualidad ambas mujeres conservan sus puestos de trabajo sin ningún tipo de acciones discriminatorias por parte de los responsables.",,,2010-01-01T00:00:00+01:00,2010-01-01T00:00:00+01:00,Murcia,Empleo,Sin especificar,,https://informesdiscriminacion.gitanos.org/casos/enero-murcia-empleo
