news_id,news_url_absolute,news_init_date,news_final_date,news_title,news_text_content
8c7aa021-e493-4b11-be37-fa33dd84f9b5,https://informesdiscriminacion.gitanos.org/casos/cantabria-servicios-policiales-discriminaci%C3%B3n-directa-7,2023-03-23,2023-03-23,Cantabria. Servicios policiales. Discriminación directa.,"Una mujer gitana salió de su casa para ir al supermercado. En el trayecto al mismo, se encontró con su hermana que iba en coche. Ambas decidieron ir al supermercado juntas. Dos agentes de policía que se encontraban en la entrada las pararon y les solicitaron sus DNI.

Las mujeres les dijeron a los agentes que no entendían por qué las paraban, a no ser que fuera porque eran gitanas. El agente respondió que “sí”, a lo que la víctima le acusó de racismo. Considera que la multa que les pusieron fue motivada por el enfadó del agente al llamarle racista."
acfbf12d-e71d-4e22-b1ee-be51d70ce7fa,https://informesdiscriminacion.gitanos.org/casos/sevilla-servicios-policiales-discriminaci%C3%B3n-directa,2023-03-23,2023-03-23,Sevilla. Servicios policiales. Discriminación directa.,"Un ex trabajador de la FSG contó que un joven gitano, que iba paseando con su hijo, de tres años de edad, fue parado y registrado por agentes de la Policía Local, sin justificación alguna. El joven pidió que no tocaran la comida de su hijo y le empezaron a increpar y finalmente, le llevaron detenido, dejando al niño sólo, en el parque. En aquellos momentos, pasaba un joven que conocía al chico y se hizo cargo del niño."
9299c52e-36f1-49c3-b2e2-73959021a89d,https://informesdiscriminacion.gitanos.org/casos/murcia-servicios-policiales-discriminaci%C3%B3n-directa-3,2023-03-23,2023-03-23,Murcia. Servicios policiales. Discriminación directa.,"Una joven de etnia gitana de 17 años informó que hacía un año sufrió una agresión policial en la comisaría de policía. Al parecer la policía llegó a su casa porque una vecina la había denunciado por su perro y le dijeron que fuera con ella a comisaría para comprobar el chip. La chica confió y se fue con la policía y cuando llegó a la comisaria al parecer, la agredieron. Después denunció los hechos, llamó al 112. Aunque no le dieron un parte de lesiones, le diagnosticaron crisis de ansiedad. La chica comunicó que denunció los hechos en la guardia civil pero la denuncia no prosperó. Desde entonces la joven ha tenido represalias ya que cada vez que se encontraba con la policía le hacían comentarios (incluso amenazas) y sentía que era por ser gitana."
2b0e7194-4102-422f-a770-756bb42f3099,https://informesdiscriminacion.gitanos.org/casos/salamanca-servicios-policiales-discriminaci%C3%B3n-directa-2,2023-03-23,2023-03-23,Salamanca. Servicios policiales. Discriminación directa.,"Un matrimonio se encontraba estacionado en una zona donde no estaba permitido, con el fin de ver cómo su hija entraba al colegio. Había otros cinco coches más aparcados. El agente de la policía local se dirigió al padre y le dijo: “¿qué, no te das por aludido?”. Le tomó nota de la matrícula. Él argumentó que era para comprobar que su hija accedía a la escuela. El policía dijo “aquí solo aparcáis los gitanos”.

El policía, según comentó la familia, la tenía tomada con ellos, ya que en ocasiones anteriores le dijo a su hijo de 12 años que no debía estar en el parque (solo se dirigía al grupo de gitanos) y que si rompían algo iban a avisar a servicios sociales."
bff3f876-7ff2-46ca-a6a4-7c4071f39b45,https://informesdiscriminacion.gitanos.org/casos/madrid-servicios-policiales-discriminaci%C3%B3n-directa-12,2023-03-23,2023-03-23,Madrid. Servicios policiales. Discriminación directa.,"Comprobamos a través del testimonio de la víctima, el trato que recibió por parte de la policía, que la acusó de robar un solomillo, en un pasillo del supermercado donde siempre va a comprar, delante de otras personas que estaban comprando. Comprobamos documentación: reclamaciones contra el supermercado y policía local, ticket compra, informe SUMMA y carta de Atención al cliente del supermercado donde comunican a la víctima que habían registrado la reclamación recibida.

Desde la FSG se le informó de la posibilidad de llevar a cabo alguna otra actuación como una reclamación por responsabilidad civil y nos coordinamos con el abogado de oficio para preparar la estrategia jurídica."
a3aa509a-ca0d-4307-9d25-3a2671a31c49,https://informesdiscriminacion.gitanos.org/casos/granada-servicios-policiales-discriminaci%C3%B3n-directa-3,2023-03-23,2023-03-23,Granada. Servicios policiales. Discriminación directa.,"Un joven gitano salía de su domicilio para ir a entrenar, vestido con ropa de deporte y mochila. A escasos metros de su domicilio fue parado por un agente de la Policía Nacional preguntándole a donde se dirigía, y pidiéndole que abriera la mochila. El joven le dijo que iba a entrenar y el agente insistió en registrar su mochila, haciéndole diferentes preguntas y percibiendo la víctima un trato discriminatorio por perfil étnico. El joven manifestó que ésta no era la primera vez que le ocurría algo parecido, los agentes le identificaban como si estuviera haciendo algo sospechoso."
260618f5-f06f-4b84-86c4-f5559f33031c,https://informesdiscriminacion.gitanos.org/casos/madrid-servicios-policiales-discriminaci%C3%B3n-directa-11,2023-03-23,2023-03-23,Madrid. Servicios policiales. Discriminación directa.,"Una mujer gitana tiene un hijo que desde hace años no vive en casa de su madre, ya que está en búsqueda y captura. Desde hace mes y medio, la policía nacional iba casi todos los días a su casa y le aporreaba la puerta, aunque saben que el hijo no vive con su madre, y tampoco está empadronado en ese domicilio. Uno de esos días fueron dos agentes; la mujer vio a uno mirando por la mirilla y al otro apoyado en el marco de la puerta. Cuando abrió la puerta, llevaba el móvil en la mano y uno de los agentes se lo cogió. Nos comentó que la policía sabe que son gitanos. La mujer vivía esta situación con mucha ansiedad y preocupación."
